status,title,company,location,date,blurb,tags,link,id,provider,query,locale,wage,remotenessNEW,"Tech Lead Manager, Human Data",OpenAI,"San Francisco, CA",2024-10-22,OpenAI's Human Data Team creates custom data solutions driving groundbreaking research. We work with AI trainers to gather specialized data for training and evaluating our models across modalities…,"Remote: Hybrid work
Benefits: Relocation assistance",https://www.indeed.com/m/viewjob?jk=2ec2922ea7280923,IndeedScraperUSAEng_2ec2922ea7280923,IndeedScraperUSAEng,Data,USA_ENGLISH,$310000 - $465000 yearly,TEMPORARILY_REMOTE
NEW,Entry Level Data Center Technician,dataNet IT,"San Jose, CA",2024-10-22,"Cabling and connecting Cisco routers & Switches to metal racks. Install, integrate various product/equipment per Build Specifications and/or Configuration Instructions.","Job types: Full-time
Job types cc: Full-time",https://www.indeed.com/m/viewjob?jk=2983aaa854486ee7,IndeedScraperUSAEng_2983aaa854486ee7,IndeedScraperUSAEng,Data,USA_ENGLISH,,UNKNOWN
NEW,Support Insight Data Scientist,Apple,"Sunnyvale, CA",2024-11-14,"Demonstrated experience in leading data science projects through all phases including exploratory data analysis, data quality management, modeling, tool deployment, and presentation of results.","Benefits: Employee stock purchase plan, Health insurance, Dental insurance, RSU, Retirement plan",https://www.indeed.com/m/viewjob?jk=fa6319fc15d07798,IndeedScraperUSAEng_fa6319fc15d07798,IndeedScraperUSAEng,Data,USA_ENGLISH,$165500 - $248700 yearly,UNKNOWN
NEW,Staff Data Scientist,Salesforce,"San Francisco, CA 94105",2024-11-19,Design new datasets and metrics to be added to our data model. Evangelize evidence-based decision making by partnering with key decision makers and driving general accessibility of data and insights.,"Job types: Full-time
Job types cc: Full-time",https://www.indeed.com/m/viewjob?jk=7a2d12cf06910f3b,IndeedScraperUSAEng_7a2d12cf06910f3b,IndeedScraperUSAEng,Data,USA_ENGLISH,$188885 - $265200 yearly,UNKNOWN
NEW,"Data Reporting and Analytics Consultant III, Programming",Kaiser Permanente,"Oakland, CA",2024-10-22,Prepares data for analytic efforts by consolidating data; reviewing data for quality and accuracy; profiling data inaccuracies; and cleaning and creating final data set(s) for analysis.,"Job types: Full-time
Shifts: Day shift
Job types cc: Full-time
Schedules: Day shift",https://www.indeed.com/m/viewjob?jk=4557e9e55b7207f6,IndeedScraperUSAEng_4557e9e55b7207f6,IndeedScraperUSAEng,Data,USA_ENGLISH,$104500 - $135190 yearly,UNKNOWN
NEW,Temporary Provider Systems Data Specialist II,Partnership HealthPlan of California,"Fairfield, CA 94534",2024-10-22,"Enters data for regulatory reporting. Enters data, including rate information relating to contracts and amendments. To maintain accurate provider information by entering necessary data elements into…","Job types: Temporary, Full-time
Job types cc: Temporary, Full-time",https://www.indeed.com/m/viewjob?jk=9c5e14f66d45dbb5,IndeedScraperUSAEng_9c5e14f66d45dbb5,IndeedScraperUSAEng,Data,USA_ENGLISH,$28 - $28 hourly,UNKNOWN
NEW,Data Manager,CURRY SENIOR CENTER,"San Francisco, CA 94102",2024-10-22,"Conduct data QA/QI, development and ensure robust data cleaning protocols, and perform data validation. Perform data management, quality controlling and database cleaning data and ensuring record…","Benefits: 403(b) matching, Paid holidays, Health insurance, Dental insurance, Flexible spending account, Paid time off, Employee assistance program, Vision insurance, Life insurance, Food provided",https://www.indeed.com/m/viewjob?jk=ab67712fd16b791e,IndeedScraperUSAEng_ab67712fd16b791e,IndeedScraperUSAEng,Data,USA_ENGLISH,$38 - $42 hourly,UNKNOWN
NEW,"Research Engineer, Human Data",OpenAI,"San Francisco, CA",2024-10-22,OpenAI's Human Data Team creates custom data solutions driving groundbreaking research. We leverage OpenAI models to improve and streamline our data collection and quality processes.,"Remote: Hybrid work
Benefits: Relocation assistance",https://www.indeed.com/m/viewjob?jk=bd98538ccbd5466a,IndeedScraperUSAEng_bd98538ccbd5466a,IndeedScraperUSAEng,Data,USA_ENGLISH,$295000 - $360000 yearly,TEMPORARILY_REMOTE
NEW,Senior Data Warehouse ETL Developer,Partnership HealthPlan of California,"Fairfield, CA 94534",2024-10-22,"Knowledge of data warehousing, data. Consolidation, data storage, data distribution, schema mapping, data enrichment, and data. This includes source identification, data collection, data.","Job types: Full-time
Job types cc: Full-time",https://www.indeed.com/m/viewjob?jk=380f721db0360fdd,IndeedScraperUSAEng_380f721db0360fdd,IndeedScraperUSAEng,Data,USA_ENGLISH,$136296.78 - $177185.81 yearly,UNKNOWN
NEW,"Associate, Data & Technology, eDiscovery",Ankura,"San Francisco, CA",2024-10-22,"Utilize the latest advances in data science, predictive analytics, and machine learning to transform large datasets into actionable intelligence. This role involves applying expertise in forensics,…","Job types: Full-time
Remote: Remote
Job types cc: Full-time",https://www.indeed.com/m/viewjob?jk=89a5d9d744a9231f,IndeedScraperUSAEng_89a5d9d744a9231f,IndeedScraperUSAEng,Data,USA_ENGLISH,$50000 - $120000 yearly,FULLY_REMOTE
NEW,Experienced Data Engineer,Stytch,"San Francisco, CA",2024-11-15,Snowflake for our data warehouse. MySQL and Elasticsearch for data storage. 5+ years as a data engineer. Experience optimizing data integration with ETL orchestration.,"Job types: Full-time
Remote: Hybrid work
Benefits: Paid parental leave, Health insurance, Parental leave
Job types cc: Full-time",https://www.indeed.com/m/viewjob?jk=4852b51e2477b4f2,IndeedScraperUSAEng_4852b51e2477b4f2,IndeedScraperUSAEng,Data,USA_ENGLISH,$185000 - $225000 yearly,TEMPORARILY_REMOTE
NEW,Database Administrator,"Public Health Foundation Enterprises, In","San Francisco, CA 94102",2024-10-22,"Develops basic data queries for statistical analyses of study data. Trains staff on use of databases and data applications. Under the direct supervision of the Medical Director, the Database…","Job types: Full-time
Job types cc: Full-time",https://www.indeed.com/m/viewjob?jk=7e9fe5fd8bf9c56c,IndeedScraperUSAEng_7e9fe5fd8bf9c56c,IndeedScraperUSAEng,Data,USA_ENGLISH,$59.35 - $59.35 hourly,UNKNOWN
NEW,Business Analyst - Global Monetization Product & Tech,TikTok,"San Jose, CA",2024-10-22,"Fluency in SQL/Hive, R/Python; experience in using data visualization products; knowledge of quantitative attribution methods. Conduct in-depth analysis of key metrics, trends, and performance…","Benefits: Paid parental leave, Health savings account, AD&D insurance, Paid holidays, Disability insurance, Health insurance, Dental insurance, Flexible spending account, RSU, Paid time off, Parental leave, Employee assistance program, Vision insurance, 401(k) matching, Paid sick time",https://www.indeed.com/m/viewjob?jk=66a08dd6bd2678b0,IndeedScraperUSAEng_66a08dd6bd2678b0,IndeedScraperUSAEng,Data,USA_ENGLISH,$147000 - $270000 yearly,UNKNOWN
NEW,Data Engineer,Arch Systems,"Palo Alto, CA",2024-11-20,"Cross-Team Data Modeling: Lead complex data modeling efforts across multiple teams and domains, identifying and resolving data inconsistencies. In this role, you'll collaborate closely with both our…","Job types: Full-time
Remote: Remote
Benefits: Stock options
Job types cc: Full-time",https://www.indeed.com/m/viewjob?jk=f95b868fc5ff1ddc,IndeedScraperUSAEng_f95b868fc5ff1ddc,IndeedScraperUSAEng,Data,USA_ENGLISH,$200000 - $250000 yearly,FULLY_REMOTE
NEW,Research Data Analyst (Hybrid Opportunity),Stanford University,"Stanford, CA",2024-10-22,"Experience with data visualization software. Analyze data processes in documentation. Use system reports and analyses to identify potentially problematic data, make corrections, and determine root…","Job types: Full-time
Benefits: Tuition reimbursement, Opportunities for advancement, Retirement plan
Job types cc: Full-time",https://www.indeed.com/m/viewjob?jk=055cae519f818bb8,IndeedScraperUSAEng_055cae519f818bb8,IndeedScraperUSAEng,Data,USA_ENGLISH,$82468 - $106256 yearly,UNKNOWN
NEW,Data Scientist,The Voleon Group,"Berkeley, CA",2024-10-22,"Design and implement systems to ensure data correctness and monitor data health in data stores and live feeds. As a Data Scientist, you will be responsible for harvesting insights from a complex array…","Job types: Full-time
Remote: Hybrid work
Benefits: AD&D insurance, Health insurance, Dental insurance, Paid time off, Vision insurance, 401(k) matching, Referral program
Job types cc: Full-time",https://www.indeed.com/m/viewjob?jk=a4fe7b9d7a55e35c,IndeedScraperUSAEng_a4fe7b9d7a55e35c,IndeedScraperUSAEng,Data,USA_ENGLISH,$150000 - $190000 yearly,TEMPORARILY_REMOTE
NEW,Research Data Analyst 2,Stanford University,"Stanford, CA",2024-11-14,Track reports for problems with pipeline analysis and underlying data. Experience in systems biology approaches for data integration is a plus. Experience in developing tools and statistical methods…,"Job types: Full-time
Benefits: Tuition reimbursement, Retirement plan
Job types cc: Full-time",https://www.indeed.com/m/viewjob?jk=b767f453cc5c143e,IndeedScraperUSAEng_b767f453cc5c143e,IndeedScraperUSAEng,Data,USA_ENGLISH,$104358 - $128038 yearly,UNKNOWN
NEW,"Partner 20, Data Engineer",a16z,"San Francisco, CA",2024-11-13,"Ship new and unique data products quickly and often, engage our users, and continuously iterate on internal feedback. You will be required to design and implement performant backend systems that…","Benefits: Disability insurance, Health insurance, Dental insurance, 401(k), Vision insurance, Life insurance",https://www.indeed.com/m/viewjob?jk=16327c53c356b665,IndeedScraperUSAEng_16327c53c356b665,IndeedScraperUSAEng,Data,USA_ENGLISH,$350000 - $408000 yearly,UNKNOWN
NEW,Full Stack Data Scientist,X Corp.,"Palo Alto, CA",2024-10-25,"Provide data and analysis support for product A/B tests, playing a pivotal role in data-driven decision-making for product changes. 3+ years of industry experience working with large scale data…","Job types: Full-time
Job types cc: Full-time",https://www.indeed.com/m/viewjob?jk=b7550b3adfd245b1,IndeedScraperUSAEng_b7550b3adfd245b1,IndeedScraperUSAEng,Data,USA_ENGLISH,$127000 - $297000 yearly,UNKNOWN
NEW,"Senior Data Scientist, ASE iCloud Data Organization [Executive Communications]",Apple,"Cupertino, CA",2024-10-29,Extract information from structured and unstructured data. 5+ years in an analytics or data science role. You think about data in terms of statistical distributions and have a big enough analytics…,"Job types: Full-time
Benefits: Stock options, Employee stock purchase plan, Health insurance, Dental insurance, RSU, Retirement plan
Job types cc: Full-time",https://www.indeed.com/m/viewjob?jk=2054e78c0bdbaa6a,IndeedScraperUSAEng_2054e78c0bdbaa6a,IndeedScraperUSAEng,Data,USA_ENGLISH,$175800 - $312200 yearly,UNKNOWN
NEW,Collaboration & Data Coordinator (BLANK AST 3),"University of California, Davis","Davis, CA 95616",2024-11-16,"Analytical and problem-solving skills to be resourceful, anticipate and identify problems, and develop creative solutions for resolution; demonstrates ability to analyze, research and synthesize large…","Job types: Full-time
Shifts: 8 hour shift
Remote: Hybrid work
Benefits: Continuing education credits, Paid holidays, Disability insurance, Dental insurance, Tuition reimbursement, Paid time off, Parental leave, Employee assistance program, Vision insurance, Union benefits, Loan forgiveness, Loan assistance, Pet insurance
Job types cc: Full-time
Schedules: 8 hour shift, Overtime, Evenings as needed, Monday to Friday",https://www.indeed.com/m/viewjob?jk=dba8f6ad50321a5d,IndeedScraperUSAEng_dba8f6ad50321a5d,IndeedScraperUSAEng,Data,USA_ENGLISH,$28.49 - $40.83 hourly,TEMPORARILY_REMOTE
NEW,"Data Scientist, Legal Technology Solutions",Meta,"Menlo Park, CA 94025",2024-10-22,"3+ years’ experience in the design, deployment, and maintenance of large data pipelines and data warehouses. Apply expertise in Machine Learning, AI, statistics, and data exploration and analysis in…",,https://www.indeed.com/m/viewjob?jk=fb06baf937ab7e90,IndeedScraperUSAEng_fb06baf937ab7e90,IndeedScraperUSAEng,Data,USA_ENGLISH,$124000 - $176000 yearly,UNKNOWN
NEW,Principal Data Scientist,Intuit,"Mountain View, CA 94043",2024-10-22,"3+ years as either a lead in a data science role or a management position in data science. Computer science fundamentals: data structures, algorithms, performance complexity, and implications of…",,https://www.indeed.com/m/viewjob?jk=108c4b4b1ce1f70a,IndeedScraperUSAEng_108c4b4b1ce1f70a,IndeedScraperUSAEng,Data,USA_ENGLISH,,UNKNOWN
NEW,Senior Data Analyst - SF,Aircall,"San Francisco, CA",2024-10-22,"Work closely with data engineers to continuously improve the data stack, governance practices, and analysis quality. Excellent interpersonal skills and the ability to explain complex data clearly to…","Job types: Full-time
Benefits: Health insurance, Unlimited paid time off, Dental insurance, Parental leave, Vision insurance, 401(k) matching
Job types cc: Full-time",https://www.indeed.com/m/viewjob?jk=58dbeafe1abe6759,IndeedScraperUSAEng_58dbeafe1abe6759,IndeedScraperUSAEng,Data,USA_ENGLISH,,UNKNOWN
NEW,"Sales Engineer, Big Data Technology",Cheetah Mobile,"San Francisco, CA 94105",2024-10-22,"We invest in the latest technologies and trends, such as robotics, artificial intelligence, fintech and data-driven content strategies. Responsible for selling the Big Data products in US market.",,https://www.indeed.com/m/viewjob?jk=c2643deb5ece5b48,IndeedScraperUSAEng_c2643deb5ece5b48,IndeedScraperUSAEng,Data,USA_ENGLISH,,UNKNOWN
NEW,Data Engineer,Niktor Inc,"Sunnyvale, CA 94085",2024-10-25,"Create and maintain reports, create and manage data models, leverage data across complex hierarchies using multiple data sources. Leverage process improvement techniques to drive improvements in data…","Job types: Full-time
Benefits: Health insurance, Dental insurance, 401(k)
Job types cc: Full-time",https://www.indeed.com/m/viewjob?jk=1ffac08a17f51972,IndeedScraperUSAEng_1ffac08a17f51972,IndeedScraperUSAEng,Data,USA_ENGLISH,$126477.36 - $152316.81 yearly,UNKNOWN
NEW,"Software Engineer, Big Data","DistroScale, Inc.","San Bruno, CA",2024-10-22,"Develop a highly scalable, reliable, and real-time data processing pipeline. Build efficient data processing pipelines to deliver real-time feedback to various components throughout production systems…","Job types: Full-time
Job types cc: Full-time",https://www.indeed.com/m/viewjob?jk=001187b3e8b2990f,IndeedScraperUSAEng_001187b3e8b2990f,IndeedScraperUSAEng,Data,USA_ENGLISH,,UNKNOWN
NEW,Database Engineer,Tandem PV,"San Jose, CA",2024-11-14,"Utilize SQLite to build a SQL database from tabulated data outputs from our manufacturing execution system and various metrology techniques. In this critical role, you will work with a team of…","Job types: Full-time
Benefits: Disability insurance, Health insurance, Paid time off, Parental leave, Life insurance
Job types cc: Full-time",https://www.indeed.com/m/viewjob?jk=f89e628a06f1184e,IndeedScraperUSAEng_f89e628a06f1184e,IndeedScraperUSAEng,Data,USA_ENGLISH,,UNKNOWN
NEW,"Principal Technical Architect, Data Cloud",Salesforce,"San Francisco, CA 94105",2024-11-15,"Hands on Experience designing data solutions on cloud platforms like Amazon Web Services, Microsoft Azure or Google Cloud Platform. Provide Technical Domain Expertise - Answer in-depth Data Cloud…","Job types: Full-time
Job types cc: Full-time",https://www.indeed.com/m/viewjob?jk=248a8e9c93ce313d,IndeedScraperUSAEng_248a8e9c93ce313d,IndeedScraperUSAEng,Data,USA_ENGLISH,$181510 - $242830 yearly,UNKNOWN
NEW,Data Scientist / Senior Data Scientist,"Diagnose Early Holdings, Inc.","Menlo Park, CA",2024-10-22,4+ years proven experience in a data science or quantitative analysis role. Contribute to interdisciplinary discussions to guide experimental design and data collection.,"Job types: Full-time
Benefits: Paid holidays, Health insurance, Dental insurance, 401(k), Paid time off
Job types cc: Full-time",https://www.indeed.com/m/viewjob?jk=d10a658382ecb699,IndeedScraperUSAEng_d10a658382ecb699,IndeedScraperUSAEng,Data,USA_ENGLISH,$160000 - $225000 yearly,UNKNOWN
NEW,Data Entry Technician,"Contact Government Services, LLC","San Francisco, CA",2024-10-22,Maintain data entry requirements by following data program techniques and procedures. Purges files to eliminate duplication of data. Verifies data and prepares materials for pdf printing.,"Job types: Full-time
Remote: Hybrid work
Benefits: Health insurance, Dental insurance, 401(k), Flexible spending account, Paid time off, Vision insurance, Life insurance
Job types cc: Full-time",https://www.indeed.com/m/viewjob?jk=202abe9449c5e768,IndeedScraperUSAEng_202abe9449c5e768,IndeedScraperUSAEng,Data,USA_ENGLISH,$27178.67 - $34944 yearly,TEMPORARILY_REMOTE
NEW,"Data Scientist, Product Analytics",Meta,"San Francisco, CA 94105",2024-10-26,"Communication and influence: You won't simply present data, but tell data-driven stories. Apply technical expertise with quantitative analysis, experimentation, data mining, and the presentation of…",,https://www.indeed.com/m/viewjob?jk=76a8df9ed1d86c65,IndeedScraperUSAEng_76a8df9ed1d86c65,IndeedScraperUSAEng,Data,USA_ENGLISH,$114000 - $171000 yearly,UNKNOWN
NEW,Sports Data Operator - Baseball/Softball (CA - Bay Area),Realplay,"San Francisco, CA 94103",2024-10-22,"Realplay delivers video of every swing, pitch, and defensive play that any player makes on a baseball or softball field. Our Sports Data Operators will be tasked with:","Job types: Part-time
Job types cc: Part-time",https://www.indeed.com/m/viewjob?jk=30742a8468d6fdfc,IndeedScraperUSAEng_30742a8468d6fdfc,IndeedScraperUSAEng,Data,USA_ENGLISH,$18.5 - $18.5 hourly,UNKNOWN
NEW,Data Scientist,Meta,"Fremont, CA 94555",2024-10-22,"Continuously monitor and update models to adapt to new data or changes in data patterns. As a lead data scientist, you will partner with stakeholders, Product & Program Managers, and other data…",,https://www.indeed.com/m/viewjob?jk=98f9415500865fbe,IndeedScraperUSAEng_98f9415500865fbe,IndeedScraperUSAEng,Data,USA_ENGLISH,$173000 - $242000 yearly,UNKNOWN
NEW,"Machine Learning Engineer, On-Device ML","Grammarly, Inc.","San Francisco, CA",2024-10-22,"Build ML models to solve real-world problems and leverage data to evaluate and improve their quality. Propose, design, and prototype strategic new features that on-device capabilities make possible.","Remote: Hybrid work
Benefits: Paid parental leave, Paid holidays, Disability insurance, Health insurance, Dental insurance, Paid time off, Parental leave, Vision insurance, 401(k) matching, Life insurance",https://www.indeed.com/m/viewjob?jk=eb0d0f3d170eaccf,IndeedScraperUSAEng_eb0d0f3d170eaccf,IndeedScraperUSAEng,Data,USA_ENGLISH,$337000 - $403000 yearly,TEMPORARILY_REMOTE
NEW,Data Researcher (Part-Time),SportTechie,"San Francisco, CA",2024-10-22,Company Description SportTechie exists to analyze and illuminate the growing number of ways technology is evolving the global sports industry. We are seeking a diligent and detail-oriented Data…,"Job types: Part-time
Benefits: Flexible schedule
Job types cc: Part-time",https://www.indeed.com/m/viewjob?jk=8c795f5c2b1e2adb,IndeedScraperUSAEng_8c795f5c2b1e2adb,IndeedScraperUSAEng,Data,USA_ENGLISH,$25 - $25 hourly,UNKNOWN
NEW,Database Sustainment Specialist (DSS),DAWSON,"Fairfield, CA",2024-11-08,"Verifies entered customer and account data by reviewing, updating, and archiving files to eliminate duplication of data. Perform quality assurance by ensuring the accuracy of reporting data.","Benefits: AD&D insurance, Health insurance, Dental insurance, Employee assistance program, Vision insurance, 401(k) matching, Pet insurance",https://www.indeed.com/m/viewjob?jk=3e66daceca78a34d,IndeedScraperUSAEng_3e66daceca78a34d,IndeedScraperUSAEng,Data,USA_ENGLISH,$45000 - $60000 yearly,UNKNOWN
NEW,"Data Science Manager, Analytics",Meta,"Burlingame, CA 94010",2024-10-22,"Communication and influence: You won’t simply present data, but tell data-driven stories. Analytics: You will guide product teams using data and insights.",,https://www.indeed.com/m/viewjob?jk=ff761a9bc2947884,IndeedScraperUSAEng_ff761a9bc2947884,IndeedScraperUSAEng,Data,USA_ENGLISH,$173000 - $242000 yearly,UNKNOWN
NEW,"Project Manager, Marketing Data Science",SoFi,"San Francisco Bay Area, CA",2024-10-26,"Data analysis and Interpretation: Understand data analysis techniques and methodologies, collaborate with data scientists to interpret results and provide actionable insights, ensure integrity and…",,https://www.indeed.com/m/viewjob?jk=bc5ae969a055efc9,IndeedScraperUSAEng_bc5ae969a055efc9,IndeedScraperUSAEng,Data,USA_ENGLISH,,UNKNOWN
NEW,ML Infrastructure Engineer,Delart,"Sunnyvale, CA",2024-10-31,"Perform data preprocessing, feature engineering, and data wrangling to ensure high-quality inputs for models. Experience with data preprocessing and feature engineering techniques.","Benefits: Disability insurance, Health insurance, Dental insurance, Flexible spending account, Paid time off, Vision insurance, 401(k) matching, Life insurance",https://www.indeed.com/m/viewjob?jk=c45317618f978942,IndeedScraperUSAEng_c45317618f978942,IndeedScraperUSAEng,Data,USA_ENGLISH,,UNKNOWN
NEW,Senior Data Systems Analyst,NVIDIA,"Santa Clara, CA 95050",2024-10-22,"Develop and implement data analytics and data collection systems to improve data analysis. Technical expertise regarding data models, database design development, data analytics and segmentation…","Job types: Full-time
Remote: Hybrid work
Job types cc: Full-time",https://www.indeed.com/m/viewjob?jk=50c3656de7848db4,IndeedScraperUSAEng_50c3656de7848db4,IndeedScraperUSAEng,Data,USA_ENGLISH,$128000 - $207000 yearly,TEMPORARILY_REMOTE
NEW,AVP Business Intelligence and Reporting,SAFE Credit Union,"Folsom, CA 95630",2024-10-22,"Strong understanding of data warehouse architectures. Develop and implement a comprehensive data literacy program across the organization, empowering employees at all levels to effectively interpret…","Job types: Full-time
Shifts: 8 hour shift, Day shift
Benefits: Health savings account, Paid holidays, Disability insurance, Health insurance, Dental insurance, 401(k), Flexible spending account, Tuition reimbursement, Paid time off, Family leave, Parental leave, Vision insurance, 401(k) matching, Life insurance, Retirement plan, Paid sick time
Job types cc: Full-time
Schedules: 8 hour shift, Overtime, Day shift, Monday to Friday",https://www.indeed.com/m/viewjob?jk=e3b2a5774b0a359f,IndeedScraperUSAEng_e3b2a5774b0a359f,IndeedScraperUSAEng,Data,USA_ENGLISH,$152000 - $203000 yearly,UNKNOWN
NEW,Senior Data Scientist,Gap Inc.,"San Francisco, CA 94105",2024-10-22,"Manipulate large amounts of data across a diverse set of subject areas, collaborating with other data scientists and data engineers to prepare data pipelines for various modeling protocols.","Job types: Full-time
Benefits: Store discount, Employee stock purchase plan, Health insurance, Dental insurance, Paid time off, Vision insurance, 401(k) matching, Life insurance
Job types cc: Full-time",https://www.indeed.com/m/viewjob?jk=a9add5c46a92098d,IndeedScraperUSAEng_a9add5c46a92098d,IndeedScraperUSAEng,Data,USA_ENGLISH,$170200 - $225600 yearly,UNKNOWN
NEW,"Data Engineer, Analytic Systems",BayOne,"San Francisco, CA",2024-10-22,The successful candidate would have extensive experience as a data engineer or ETL developer building and automating data transformation and loading procedures. Minimum Years of Experience - 5 Years.,,https://www.indeed.com/m/viewjob?jk=110243a2fffc8944,IndeedScraperUSAEng_110243a2fffc8944,IndeedScraperUSAEng,Data,USA_ENGLISH,,UNKNOWN
NEW,Data Scientist- Tiktok Ads,TikTok,"San Jose, CA",2024-10-22,"Apply your expertise in quantitative analysis, data mining, and the presentation of data to see beyond the numbers and understand how our users interact with our ads products.","Benefits: Paid parental leave, Health savings account, AD&D insurance, Paid holidays, Disability insurance, Health insurance, Dental insurance, Flexible spending account, RSU, Paid time off, Parental leave, Employee assistance program, Vision insurance, 401(k) matching, Paid sick time",https://www.indeed.com/m/viewjob?jk=d6335ee625f082be,IndeedScraperUSAEng_d6335ee625f082be,IndeedScraperUSAEng,Data,USA_ENGLISH,$153000 - $296000 yearly,UNKNOWN
NEW,"Data Scientist, Product Analytics",TikTok,"Mountain View, CA 94041",2024-10-22,"Deep dive into data sources, understand their limitations, and communicate complex data insights through exploratory analysis and research to suggest improvement. Experience with SQL, Python, or R.","Remote: Hybrid work
Benefits: Paid parental leave, Health savings account, AD&D insurance, Paid holidays, Disability insurance, Health insurance, Dental insurance, Flexible spending account, RSU, Paid time off, Parental leave, Employee assistance program, Vision insurance, 401(k) matching, Paid sick time",https://www.indeed.com/m/viewjob?jk=36a1d43f9b8338cc,IndeedScraperUSAEng_36a1d43f9b8338cc,IndeedScraperUSAEng,Data,USA_ENGLISH,$114000 - $240000 yearly,TEMPORARILY_REMOTE
