status,title,company,location,date,blurb,tags,link,id,provider,query,locale,wage,remotenessNEW,"Member of Technical Staff, AI Data",Microsoft,"Mountain View, CA 94043",2024-10-22,"The AI Data team at Microsoft AI is responsible for all aspects of data preparation to support our model pre-training operations, including collecting data from the source, extracting and transforming…","Job types: Full-time
Job types cc: Full-time",https://www.indeed.com/m/viewjob?jk=a478e9985e5e681b,IndeedScraperUSAEng_a478e9985e5e681b,IndeedScraperUSAEng,Data,USA_ENGLISH,$137600 - $294000 yearly,UNKNOWN
NEW,Data Scientist,LatentView Analytics,"San Jose, CA 95131",2024-11-14,"Analyze marketing data to identify patterns and trends. Attention to detail and ability to work with a large data set. Strong SQL skills Strong analytical skills, with experience in statistical…",Job types cc: Permanent,https://www.indeed.com/m/viewjob?jk=a5cac93c431ba407,IndeedScraperUSAEng_a5cac93c431ba407,IndeedScraperUSAEng,Data,USA_ENGLISH,,UNKNOWN
NEW,"Staff Data Engineer, Energy Service Engineering",Tesla,"Palo Alto, CA",2024-10-22,"Derive an overall strategy of data management, within an established information architecture that allows us to scale data processing effectively. Gather and processes raw, structured, semi-structured…","Job types: Full-time
Benefits: Commuter assistance, Health savings account, AD&D insurance, Paid holidays, Disability insurance, Health insurance, Dental insurance, Flexible spending account, Flextime, Employee assistance program, Vision insurance, 401(k) matching, Employee discount, Benefits from day one, Life insurance, Pet insurance
Job types cc: Full-time
Schedules: Flextime",https://www.indeed.com/m/viewjob?jk=a5cebb5461413895,IndeedScraperUSAEng_a5cebb5461413895,IndeedScraperUSAEng,Data,USA_ENGLISH,$108000 - $222000 yearly,UNKNOWN
NEW,"Business Analyst - Research - Roseville, CA",Gainwell Technologies LLC,"Roseville, CA 95747",2024-10-22,Great companies need great teams to propel their operations. Join the group that solves business challenges and enhances the way we work and grow. Working at Gainwell carries its rewards. You’ll…,"Job types: Full-time
Remote: Hybrid work
Benefits: Health insurance, Tuition reimbursement, 401(k) matching
Job types cc: Full-time",https://www.indeed.com/m/viewjob?jk=9802e6d5ad539dc2,IndeedScraperUSAEng_9802e6d5ad539dc2,IndeedScraperUSAEng,Data,USA_ENGLISH,$59500 - $85000 yearly,TEMPORARILY_REMOTE
NEW,Merchandising Data Analyst,BayOne,"Pleasanton, CA 94588",2024-10-22,Query and analyze data for quality standardization and consistency. Perform root causes analysis to holistically resolve problems in the data and system process. Manage exceptions in the process.,,https://www.indeed.com/m/viewjob?jk=8525fa9b3710ff51,IndeedScraperUSAEng_8525fa9b3710ff51,IndeedScraperUSAEng,Data,USA_ENGLISH,,UNKNOWN
NEW,"Software Engineer, Data Streaming",TikTok,"San Jose, CA",2024-10-22,"Responsibilities TikTok is the leading destination for short-form mobile video. At TikTok, our mission is to inspire creativity and bring joy. TikTok's global headquarters are in Los Angeles and…","Benefits: Paid parental leave, Health savings account, AD&D insurance, Paid holidays, Disability insurance, Health insurance, Dental insurance, Flexible spending account, RSU, Paid time off, Parental leave, Employee assistance program, Vision insurance, 401(k) matching, Paid sick time",https://www.indeed.com/m/viewjob?jk=b6ee1a26737a1f21,IndeedScraperUSAEng_b6ee1a26737a1f21,IndeedScraperUSAEng,Data,USA_ENGLISH,$145000 - $250000 yearly,UNKNOWN
NEW,Data Service Manager (Modesto),Golden Valley Health Centers,"Modesto, CA 95350",2024-10-22,"Oversee data integration, data quality, and data governance initiatives to ensure the integrity and security of data assets. Champion data literacy and promote a data-driven culture throughout the…","Job types: Full-time
Benefits: 403(b) matching, Health insurance, Dental insurance, Flexible spending account, Vision insurance, Gym membership
Job types cc: Full-time
Schedules: Monday to Friday",https://www.indeed.com/m/viewjob?jk=c8e223c8daa7bcd1,IndeedScraperUSAEng_c8e223c8daa7bcd1,IndeedScraperUSAEng,Data,USA_ENGLISH,$126214.4 - $135049.4 yearly,UNKNOWN
NEW,"Staff Software Engineer, Data Engineering",The Voleon Group,"Berkeley, CA",2024-10-22,"This includes procurement and ingestion of new datasets, enabling data processing and analysis in research and production environments, building data-related infrastructure and tooling, and…","Job types: Full-time
Remote: Hybrid work
Benefits: AD&D insurance, Health insurance, Dental insurance, Paid time off, Vision insurance, 401(k) matching, Referral program
Job types cc: Full-time",https://www.indeed.com/m/viewjob?jk=99c9111549ef1bbb,IndeedScraperUSAEng_99c9111549ef1bbb,IndeedScraperUSAEng,Data,USA_ENGLISH,$225000 - $300000 yearly,TEMPORARILY_REMOTE
NEW,"Data Scientist, Product Analytics",Meta,"San Francisco, CA 94105",2024-10-25,"Communication and influence: You won't simply present data, but tell data-driven stories. Analytics: You will guide teams using data and insights. Apply technical expertise with quantitative analysis,…",,https://www.indeed.com/m/viewjob?jk=7576388cec01c434,IndeedScraperUSAEng_7576388cec01c434,IndeedScraperUSAEng,Data,USA_ENGLISH,$145000 - $204000 yearly,UNKNOWN
NEW,Senior Data Engineer,Babylist,"Emeryville, CA",2024-10-22,"Build and optimize data pipelines for seamless data ingestion into our data warehouse, with a focus on scalability and performance. Familiarity with data observability platforms like Monte Carlo for…","Remote: Remote
Benefits: Paid parental leave, Health insurance, Dental insurance, Flexible spending account, Paid time off, Parental leave, Vision insurance, 401(k) matching, Opportunities for advancement",https://www.indeed.com/m/viewjob?jk=999aa71b3b9219c6,IndeedScraperUSAEng_999aa71b3b9219c6,IndeedScraperUSAEng,Data,USA_ENGLISH,$133000 - $199408 yearly,FULLY_REMOTE
NEW,Head of Data Science / Machine Learning,Instawork Internal,"San Francisco, CA",2024-11-14,"At Instawork, we’re driven by our vision to create economic opportunity for local businesses and skilled hourly professionals in communities around the world. With a growing number of hub cities…","Benefits: Stock options, Health savings account, Paid holidays, Health insurance, Dental insurance, 401(k), Paid time off, Cell phone reimbursement, Vision insurance, Employee discount
Job types cc: Permanent",https://www.indeed.com/m/viewjob?jk=9b9a71bebd2a18d1,IndeedScraperUSAEng_9b9a71bebd2a18d1,IndeedScraperUSAEng,Data,USA_ENGLISH,$230000 - $265000 yearly,UNKNOWN
NEW,Data Science R&D AI Consultant,ZS,"South San Francisco, CA 94080",2024-10-22,"Apply problem solving, data, delivery, functional and technology expertise to develop AI & data science solutions for problems across the life sciences R&D lifecycle. Life Sciences R&D AI Capability.","Benefits: Internal mobility program, Work from home",https://www.indeed.com/m/viewjob?jk=a658094d73efe1ca,IndeedScraperUSAEng_a658094d73efe1ca,IndeedScraperUSAEng,Data,USA_ENGLISH,,UNKNOWN
NEW,Data Specialist,"Contact Government Services, LLC","San Francisco, CA",2024-10-22,Perform special format data conversions and file manipulation requests. Perform special format data conversions and file manipulation requests. Clearly and accurately discusses data inconsistencies…,"Job types: Full-time
Remote: Hybrid work
Benefits: Health insurance, Dental insurance, 401(k), Flexible spending account, Paid time off, Vision insurance, Life insurance
Job types cc: Full-time",https://www.indeed.com/m/viewjob?jk=5aaff1b2a4062659,IndeedScraperUSAEng_5aaff1b2a4062659,IndeedScraperUSAEng,Data,USA_ENGLISH,$61152 - $82992 yearly,TEMPORARILY_REMOTE
NEW,Head of Data Engineering,Samsung Electronics,"Mountain View, CA 94043",2024-10-22,"Work with stakeholders including the Executives, Product and business teams to assist with data-related technical issues and support their data infrastructure needs.","Job types: Full-time
Job types cc: Full-time",https://www.indeed.com/m/viewjob?jk=8a941c379b7c4f95,IndeedScraperUSAEng_8a941c379b7c4f95,IndeedScraperUSAEng,Data,USA_ENGLISH,$275500 - $325000 yearly,UNKNOWN
NEW,Data Entry - SQL/PHP Knowledge desired,Emergency Gear Direct,"Ripon, CA",2024-10-22,"As a data entry specialist, responsibilities will include the day-to-day operations of entering products onto our online store, updating product pricing, and product descriptions.",,https://www.indeed.com/m/viewjob?jk=5615ad8820cdec65,IndeedScraperUSAEng_5615ad8820cdec65,IndeedScraperUSAEng,Data,USA_ENGLISH,,UNKNOWN
NEW,"Machine Learning Engineer, GenAI Search",Moveworks.ai,"Mountain View, CA",2024-11-13,"The Moveworks Copilot is powered by an industry-leading Reasoning Engine that uses a combination of public and proprietary language models to understand employee queries, then build and execute multi…","Job types: Full-time
Job types cc: Full-time",https://www.indeed.com/m/viewjob?jk=3a01b6b865d578e4,IndeedScraperUSAEng_3a01b6b865d578e4,IndeedScraperUSAEng,Data,USA_ENGLISH,$120000 - $249000 yearly,UNKNOWN
NEW,"Data Scientist- TikTok Ads, Ad Inventory & User Experience",TikTok,"Mountain View, CA 94041",2024-10-22,"Responsibilities TikTok is the leading destination for short-form mobile video. Our mission is to inspire creativity and bring joy. TikTok has global offices including Mountain View (CA), Seattle,…","Benefits: Paid parental leave, Health savings account, AD&D insurance, Paid holidays, Disability insurance, Health insurance, Dental insurance, Flexible spending account, RSU, Paid time off, Parental leave, Employee assistance program, Vision insurance, 401(k) matching, Paid sick time",https://www.indeed.com/m/viewjob?jk=78c23bd2606c12a4,IndeedScraperUSAEng_78c23bd2606c12a4,IndeedScraperUSAEng,Data,USA_ENGLISH,$153000 - $296000 yearly,UNKNOWN
NEW,Data Analyst,LatentView Analytics,"San Jose, CA 95131",2024-11-13,"LatentView Analytics is a leading global analytics and decision sciences provider, delivering solutions that help companies drive digital transformation and use data to gain a competitive advantage.",Job types cc: Permanent,https://www.indeed.com/m/viewjob?jk=e643312ab6123e7b,IndeedScraperUSAEng_e643312ab6123e7b,IndeedScraperUSAEng,Data,USA_ENGLISH,,UNKNOWN
NEW,Product Data Scientist,PayPal,"San Jose, CA",2024-10-22,"Experience analyzing very large, complex, multi-dimensional data sets. This person will help generate insights by mining Venmo’s rich data and support experimentation efforts driven by the consumer…","Job types: Full-time
Remote: Hybrid work
Benefits: Health insurance, Dental insurance, Vision insurance, Life insurance
Job types cc: Full-time",https://www.indeed.com/m/viewjob?jk=c8c61dded1ba8e05,IndeedScraperUSAEng_c8c61dded1ba8e05,IndeedScraperUSAEng,Data,USA_ENGLISH,$72700 - $176000 yearly,TEMPORARILY_REMOTE
NEW,Software Engineer - Data Platform,X Corp.,"Palo Alto, CA",2024-10-25,Demonstrated experience building data pipelines. Knowledge of ETL processes and data warehousing. Design and develop core functionalities in data ingestion and processing.,"Job types: Full-time
Job types cc: Full-time",https://www.indeed.com/m/viewjob?jk=7425fa6e905aa1c8,IndeedScraperUSAEng_7425fa6e905aa1c8,IndeedScraperUSAEng,Data,USA_ENGLISH,$154000 - $297000 yearly,UNKNOWN
NEW,Physical Data Recovery Technician,DriveSavers Data Recovery,"Novato, CA 94949",2024-10-22,"The flash team recovers data from iPhones, Androids, iPads, SSDs, and all-flash devices. We are seeking an organized technician with smart device or computer repair experience that is excited to…","Job types: Full-time
Benefits: Paid training, Paid parental leave, Paid holidays, Health insurance, Dental insurance, 401(k), Parental leave, Vision insurance
Job types cc: Full-time",https://www.indeed.com/m/viewjob?jk=43a57376a4ba33bd,IndeedScraperUSAEng_43a57376a4ba33bd,IndeedScraperUSAEng,Data,USA_ENGLISH,,UNKNOWN
NEW,"Senior Engineer, Data Scientist",Samsung Semiconductor,"San Jose, CA",2024-10-22,"Performs complicated statistical and data -mining analysis, using statistical tools like Python, SQL, R and design of data acquisition systems, data structure and database design.",,https://www.indeed.com/m/viewjob?jk=a28bd2974f3c0226,IndeedScraperUSAEng_a28bd2974f3c0226,IndeedScraperUSAEng,Data,USA_ENGLISH,$132000 - $198000 yearly,UNKNOWN
NEW,Data Analyst,Serino Systems Inc,"Danville, CA 94526",2024-11-01,"Provide heavy data conversion, data cleaning and data analysis and data encoding work as necessary (Translate technical documents such as invoices and billings). Knowledge of SQL with basic scripting.","Job types: Full-time
Shifts: Night shift
Job types cc: Full-time
Schedules: Night shift",https://www.indeed.com/m/viewjob?jk=c072e115c37c1c31,IndeedScraperUSAEng_c072e115c37c1c31,IndeedScraperUSAEng,Data,USA_ENGLISH,,UNKNOWN
NEW,"Tech Lead, Database Acceleration",TikTok,"San Jose, CA",2024-10-22,"Responsible for architecting internal data warehouse and data lakes to support all business unites. As a senior software engineer in the data platform team, you will have the opportunity to build,…","Benefits: Paid parental leave, Health savings account, AD&D insurance, Paid holidays, Disability insurance, Health insurance, Dental insurance, Flexible spending account, RSU, Paid time off, Parental leave, Employee assistance program, Vision insurance, 401(k) matching, Paid sick time",https://www.indeed.com/m/viewjob?jk=8c503bc18ab64c41,IndeedScraperUSAEng_8c503bc18ab64c41,IndeedScraperUSAEng,Data,USA_ENGLISH,$187040 - $280000 yearly,UNKNOWN
NEW,Data Scientist - TikTok Ads,TikTok,"San Jose, CA",2024-10-22,"Demonstrated skills in selecting the right statistical tools given a data analysis problem. Work with large, complex data sets. Develop comprehensive knowledge of Tiktok data structures and metrics,…","Benefits: Paid parental leave, Health savings account, AD&D insurance, Paid holidays, Disability insurance, Health insurance, Dental insurance, Flexible spending account, RSU, Paid time off, Parental leave, Employee assistance program, Vision insurance, 401(k) matching, Paid sick time",https://www.indeed.com/m/viewjob?jk=b6a4a2a7286dc03e,IndeedScraperUSAEng_b6a4a2a7286dc03e,IndeedScraperUSAEng,Data,USA_ENGLISH,$153000 - $296000 yearly,UNKNOWN
NEW,"Data Engineer (Streaming, Scala, Java, GCP) | Hybrid - Sunnyvale, CA",Zenith Services,"Sunnyvale, CA",2024-10-22,"Candidates must have 5+ years of data experience, 2+ years of experience with Google Cloud platform, and hands on experience. 3+ years of solid Java and 2+ years experience in design, implementation,…",,https://www.indeed.com/m/viewjob?jk=e60ac034951d9ab8,IndeedScraperUSAEng_e60ac034951d9ab8,IndeedScraperUSAEng,Data,USA_ENGLISH,$75 - $75 hourly,UNKNOWN
NEW,"GenAI Project Manager, Product Data Operations",Meta,"Menlo Park, CA 94025",2024-11-14,"Guide the work of onshore and offshore workers to complete data annotation projects. PDO provides data and insights that power machine learning and AI, at the core of all Meta products.",,https://www.indeed.com/m/viewjob?jk=fc643008b7c6a82d,IndeedScraperUSAEng_fc643008b7c6a82d,IndeedScraperUSAEng,Data,USA_ENGLISH,$129000 - $185000 yearly,UNKNOWN
NEW,Data Center Technician,"MIRAPATH, INC","Cupertino, CA 95014",2024-11-09,"The Low Voltage Services Technician works on installation of cabling, containment, and cable replenishment projects. The position is responsible for delivery and white glove receiving and installation…","Job types: Full-time
Job types cc: Full-time
Schedules: Overtime",https://www.indeed.com/m/viewjob?jk=c463d29e6f1641b4,IndeedScraperUSAEng_c463d29e6f1641b4,IndeedScraperUSAEng,Data,USA_ENGLISH,$20 - $35 hourly,UNKNOWN
NEW,SSP Data User Studies Research Engineer,Apple,"Cupertino, CA",2024-11-12,"Experience planning, and executing small to mid range-scale human/user data collection studies. User Studies Research Engineer will work multi-functionally with various teams to plan and execute study…","Benefits: Employee stock purchase plan, Health insurance, Dental insurance, RSU, Retirement plan",https://www.indeed.com/m/viewjob?jk=29a2616a5af0188e,IndeedScraperUSAEng_29a2616a5af0188e,IndeedScraperUSAEng,Data,USA_ENGLISH,$165500 - $293800 yearly,UNKNOWN
NEW,Data Scientist,V15P1TALONNN,"San Jose, CA 95138",2024-10-22,Extending company’s data with third party sources of information when needed. Enhancing data collection procedures to include information that is relevant for building analytic systems.,,https://www.indeed.com/m/viewjob?jk=d0605f8c5c202a13,IndeedScraperUSAEng_d0605f8c5c202a13,IndeedScraperUSAEng,Data,USA_ENGLISH,,UNKNOWN
NEW,Sports Data Operator - Baseball/Softball (CA - Bay Area),Realplay,"San Francisco, CA 94103",2024-10-22,"Realplay is looking for self-driven data operators for the Spring/Summer baseball and softball season. Realplay is hiring for applicants with a passion for baseball, softball, or sports data…","Job types: Part-time
Job types cc: Part-time",https://www.indeed.com/m/viewjob?jk=bc7e411af337b069,IndeedScraperUSAEng_bc7e411af337b069,IndeedScraperUSAEng,Data,USA_ENGLISH,$18.5 - $18.5 hourly,UNKNOWN
NEW,Senior Privacy and Data Governance Engineer - iCloud Data,Apple,"Cupertino, CA",2024-10-24,Promote a culture of data minimization and help strategize and implement technical data engineering and data science solutions that meet iCloud data and business needs.,"Job types: Full-time
Benefits: Employee stock purchase plan, Health insurance, Dental insurance, RSU, Retirement plan
Job types cc: Full-time",https://www.indeed.com/m/viewjob?jk=6677ba9afa68de7a,IndeedScraperUSAEng_6677ba9afa68de7a,IndeedScraperUSAEng,Data,USA_ENGLISH,$207800 - $312200 yearly,UNKNOWN
NEW,"Lecturer - Data Science Undergraduate Studies - College of Computing, Data Science, and Society",University of California Berkeley,"Berkeley, CA 94720",2024-10-22,Connector courses allow students to apply theoretical concepts from data science to a particular area of interest. Core to the college is an understanding of how computing and data science affect…,"Job types: Full-time
Job types cc: Full-time",https://www.indeed.com/m/viewjob?jk=811124fe2406515f,IndeedScraperUSAEng_811124fe2406515f,IndeedScraperUSAEng,Data,USA_ENGLISH,$66259 - $186446 yearly,UNKNOWN
NEW,Member of Technical Staff (Data Science),EnamCo,"Hillsborough, CA 94010",2024-10-22,"At least 3 years of professional experience in data science, with a strong emphasis on machine learning and data analysis. Enhance our data science productivity, focusing on areas such as automation,…","Job types: Full-time
Job types cc: Full-time",https://www.indeed.com/m/viewjob?jk=09097f811cdaa7ad,IndeedScraperUSAEng_09097f811cdaa7ad,IndeedScraperUSAEng,Data,USA_ENGLISH,,UNKNOWN
NEW,Big Data Developer - Data Analytics Team,Teamsoft Technologies,"San Francisco, CA",2024-10-22,If you see an opportunity that fits for you then write us at [email protected] to tell us about what you can bring to the table. Job Summary: Teamsoft builds necessary infrastructure which are the…,,https://www.indeed.com/m/viewjob?jk=f2e8a52eccee3e47,IndeedScraperUSAEng_f2e8a52eccee3e47,IndeedScraperUSAEng,Data,USA_ENGLISH,,UNKNOWN
NEW,"Software Engineer (Framework - BigData), Ai & Data Platforms",Apple,"Sunnyvale, CA",2024-11-03,"Experience with SQL and NoSQL data stores. Deep understanding of data structures and algorithms. Experience or familiarity with big data technologies like Apache Iceberg, Delta or Hudi.","Benefits: Employee stock purchase plan, Health insurance, Dental insurance, RSU, Retirement plan",https://www.indeed.com/m/viewjob?jk=795e61ca787cb9fd,IndeedScraperUSAEng_795e61ca787cb9fd,IndeedScraperUSAEng,Data,USA_ENGLISH,$143100 - $264200 yearly,UNKNOWN
NEW,"Data Scientist, Finance",Meta,"Menlo Park, CA 94025",2024-10-24,"Meta is seeking a highly quantitative, analytical and motivated data scientist for the Finance Data Science team. The Finance DS team has a unique bird's-eye view of Meta's world class advertising…",,https://www.indeed.com/m/viewjob?jk=5d5312ca01dc92cf,IndeedScraperUSAEng_5d5312ca01dc92cf,IndeedScraperUSAEng,Data,USA_ENGLISH,$145000 - $204000 yearly,UNKNOWN
NEW,Machine Learning Engineer,Kiddom,"San Francisco, CA",2024-10-22,"Design, build, and maintain scalable data pipelines to transform raw data into analytics-ready datasets. 3+ years of experience as a data engineer, and 8+ years of software engineering experience …","Job types: Full-time
Benefits: Health savings account, Disability insurance, Health insurance, Dental insurance, Family leave, Vision insurance, Life insurance, Paid sick time
Job types cc: Full-time",https://www.indeed.com/m/viewjob?jk=e0351903f500fec3,IndeedScraperUSAEng_e0351903f500fec3,IndeedScraperUSAEng,Data,USA_ENGLISH,$150000 - $200000 yearly,UNKNOWN
NEW,Senior Data Engineer (Python/Pyspark),HireIO,"Mountain View, CA",2024-10-22,"Responsibilities: Participate in all aspects data platform Writing production level Python and Pyspark for ETL pipelines Data processing, validation, cleaning, and debugging Using AWS services and…",,https://www.indeed.com/m/viewjob?jk=0dfa78d87c285b29,IndeedScraperUSAEng_0dfa78d87c285b29,IndeedScraperUSAEng,Data,USA_ENGLISH,$100000 - $100000 yearly,UNKNOWN
NEW,Data Scientist,Dew Software,"Newark, CA 94560",2024-10-22,"Dew Software is seeking a highly skilled Data Scientist to join our team of digital transformation experts. As a leading player in the digital transformation space, we work with Fortune 500…","Job types: Contract
Job types cc: Contract",https://www.indeed.com/m/viewjob?jk=e6a1a5092bfeb982,IndeedScraperUSAEng_e6a1a5092bfeb982,IndeedScraperUSAEng,Data,USA_ENGLISH,$70 - $80 hourly,UNKNOWN
NEW,Data Center Engineer,BayOne,"Foster City, CA",2024-10-22,"HireArt is helping an on-demand, autonomous ride-hailing company hire a Data Center Engineer. In this role, you will be responsible for the company's application, compute, and storage infrastructure.","Job types: Contract
Job types cc: Contract",https://www.indeed.com/m/viewjob?jk=dc691f7d4b6e596d,IndeedScraperUSAEng_dc691f7d4b6e596d,IndeedScraperUSAEng,Data,USA_ENGLISH,,UNKNOWN
NEW,"Analyst, Corporate Data Intermediate - Remote in California",SAN JOAQUIN COUNTY HEALTH COMMISSION,"French Camp, CA 95231",2024-10-22,"Demonstrates competency in quantitative analysis, data mining, and the presentation of data with a focus on actionable analytics. Intermediate data storytelling skills, with the ability to clearly…","Job types: Full-time
Remote: Remote
Benefits: AD&D insurance, Paid holidays, Disability insurance, Health insurance, Dental insurance, Flexible spending account, Paid time off, Vision insurance
Job types cc: Full-time",https://www.indeed.com/m/viewjob?jk=63c415618c7cbfd9,IndeedScraperUSAEng_63c415618c7cbfd9,IndeedScraperUSAEng,Data,USA_ENGLISH,$78960 - $112430 yearly,FULLY_REMOTE
NEW,"Sr. Software Engineer, Data",Blackhawk Network,"Pleasanton, CA 94588",2024-11-01,"Responsible for data quality, data accuracy & data completeness. Connecting to various data sources, importing data, and transforming data for providing business insights.","Job types: Full-time
Benefits: Paid holidays, Disability insurance, Health insurance, Dental insurance, Flexible spending account, Parental leave, Vision insurance, 401(k) matching, Life insurance, Paid sick time
Job types cc: Full-time
Schedules: On call",https://www.indeed.com/m/viewjob?jk=c3743c5989f34c67,IndeedScraperUSAEng_c3743c5989f34c67,IndeedScraperUSAEng,Data,USA_ENGLISH,$89620 - $156340 yearly,UNKNOWN
NEW,Data Center Technician,CoreWeave,"Newark, CA",2024-10-22,Provide technical support to data center teams. Occasional travel to other data centers as needed. Maintain data center operations to ensure availability and reliability of service levels.,"Job types: Full-time
Remote: Hybrid work
Benefits: Paid parental leave, Disability insurance, Health insurance, Dental insurance, Flexible spending account, Tuition reimbursement, Paid time off, Parental leave, Vision insurance, 401(k) matching, Life insurance
Job types cc: Full-time
Schedules: On call",https://www.indeed.com/m/viewjob?jk=e20e6a879c8112d6,IndeedScraperUSAEng_e20e6a879c8112d6,IndeedScraperUSAEng,Data,USA_ENGLISH,$65000 - $85000 yearly,TEMPORARILY_REMOTE
NEW,"Staff Data Scientist, Fraud",Angi,"San Francisco Bay Area, CA",2024-10-30,"At Angi, we have one simple mission: Get all your home service jobs done well. That's how we've helped over 150 million homeowners care for their homes over the last 25+ years. Today, our network…","Remote: Remote
Benefits: Health insurance, Dental insurance, Vision insurance, 401(k) matching",https://www.indeed.com/m/viewjob?jk=2ed62d976b9d573c,IndeedScraperUSAEng_2ed62d976b9d573c,IndeedScraperUSAEng,Data,USA_ENGLISH,$190000 - $260000 yearly,FULLY_REMOTE
NEW,"Business Analyst, Consultant",Blue Shield of California,"El Dorado Hills, CA",2024-11-19,"JOB DESCRIPTION Your Role The Behavioral Health Strategy team ensures members have access to affordable, high - quality care that differentiates BSC as a market leader in behavioral health. The…","Job types: Full-time
Remote: Hybrid work
Benefits: Work from home
Job types cc: Full-time",https://www.indeed.com/m/viewjob?jk=e99e633d647fb154,IndeedScraperUSAEng_e99e633d647fb154,IndeedScraperUSAEng,Data,USA_ENGLISH,$96470 - $144760 yearly,TEMPORARILY_REMOTE
