status,title,company,location,date,blurb,tags,link,id,provider,query,locale,wage,remotenessNEW,Data Engineer,Cubesmart,"Malvern, PA 19355",2024-10-13,"Collaborate with 3rd party vendors to understand externally sourced data and incorporate into CubeSmart’s data environment, in adherence with CubeSmart’s data design standards.",Remote: Hybrid work,https://www.indeed.com/m/viewjob?jk=930956ff47755b54,IndeedScraperUSAEng_930956ff47755b54,IndeedScraperUSAEng,Data,USA_ENGLISH,,TEMPORARILY_REMOTE
NEW,"Operations Analyst - Bronx, NY",Citarella,"Bronx, NY 10474",2024-10-13,Analyzing data and ensuring its accuracy throughout the company. Excellent verbal and written communication skills with the ability to influence others through data and logic.,,https://www.indeed.com/m/viewjob?jk=67c8d55b255eb63e,IndeedScraperUSAEng_67c8d55b255eb63e,IndeedScraperUSAEng,Data,USA_ENGLISH,$70000 - $80000 yearly,UNKNOWN
NEW,Data Manager - Medicine/Virology,Physician Affiliate Group of New York,"New York, NY 10037",2024-10-17,Physician Affiliate Group of New York (PAGNY) is adding an Data Manager to the Medicine - Virology department at NYC Health + Hospitals/Harlem. Harlem Hospital is a designated Level 1 Trauma Center…,"Job types: Part-time
Benefits: Health insurance, Dental insurance, Paid time off, 401(k) matching
Job types cc: Part-time",https://www.indeed.com/m/viewjob?jk=206ba9afbac40611,IndeedScraperUSAEng_206ba9afbac40611,IndeedScraperUSAEng,Data,USA_ENGLISH,$31437 - $31437 yearly,UNKNOWN
NEW,Data Engineer,Edmunds GovTech,"Northfield, NJ 08225",2024-10-13,Validate that data conversions meet customer expectations and requirements. Develop data conversion programs using Java and other related technologies. Health Benefits & Paid Family Leave.,"Job types: Full-time
Benefits: Paid holidays, Health insurance, Dental insurance, Tuition reimbursement, Paid time off, Family leave, Vision insurance, 401(k) matching, Gym membership
Job types cc: Full-time",https://www.indeed.com/m/viewjob?jk=ee1f6f1aa119fb8d,IndeedScraperUSAEng_ee1f6f1aa119fb8d,IndeedScraperUSAEng,Data,USA_ENGLISH,,UNKNOWN
NEW,Associate | Data Manager (Client Solutions Group),Macquarie Group Limited,"New York, NY",2024-10-13,"As a Data Manager supporting Client Solutions Group, you will focus on the essentials of building data products and implementing data governance practices. Hybrid and flexible working arrangements.","Benefits: Health savings account, Disability insurance, Health insurance, Dental insurance, 401(k), Paid time off, Parental leave, Employee assistance program, Vision insurance, Life insurance",https://www.indeed.com/m/viewjob?jk=995678ad044b20fc,IndeedScraperUSAEng_995678ad044b20fc,IndeedScraperUSAEng,Data,USA_ENGLISH,$95000 - $125000 yearly,UNKNOWN
NEW,"Data Scientist, Product Analytics",Meta,"New York, NY",2024-11-01,"Communication and influence: You won't simply present data, but tell data-driven stories. Analytics: You will guide teams using data and insights. Apply technical expertise with quantitative analysis,…",,https://www.indeed.com/m/viewjob?jk=4389e5ad24ce1e4e,IndeedScraperUSAEng_4389e5ad24ce1e4e,IndeedScraperUSAEng,Data,USA_ENGLISH,$114000 - $171000 yearly,UNKNOWN
NEW,Associate Commercial Data Scientist,Alexander Group,"New York, NY 10022",2024-10-13,Support teams engaged with big data environments. Proficiency with open-source data science languages like R or Python. Advise teams with data preparation and model-building best-practices.,,https://www.indeed.com/m/viewjob?jk=71a9570e0ffd5acd,IndeedScraperUSAEng_71a9570e0ffd5acd,IndeedScraperUSAEng,Data,USA_ENGLISH,$80000 - $80000 yearly,UNKNOWN
NEW,Manager - Cybersecurity GRC & Data Privacy,Central Hudson,"Poughkeepsie, NY",2024-11-09,"Manage data privacy risk assessments and data protection impact assessments. Ensure the proper handling of personal data and responding to data subject requests. Medical, Dental, and Vision insurance.","Job types: Full-time
Benefits: Paid holidays, Health insurance, Dental insurance, Tuition reimbursement, Vision insurance, 401(k) matching
Job types cc: Full-time",https://www.indeed.com/m/viewjob?jk=3b0fa26a63f96d4b,IndeedScraperUSAEng_3b0fa26a63f96d4b,IndeedScraperUSAEng,Data,USA_ENGLISH,$136800 - $211900 yearly,UNKNOWN
NEW,Materials/Data Admin Specialist,AbbVie,"Branchburg, NJ",2024-10-23,Company Description AbbVie's mission is to discover and deliver innovative medicines and solutions that solve serious health issues today and address the medical challenges of tomorrow. We strive…,"Job types: Full-time
Benefits: Paid holidays, Health insurance, Dental insurance, 401(k), Paid time off, Vision insurance
Job types cc: Full-time",https://www.indeed.com/m/viewjob?jk=ad4609b64555da5b,IndeedScraperUSAEng_ad4609b64555da5b,IndeedScraperUSAEng,Data,USA_ENGLISH,,UNKNOWN
NEW,"Nursing Data Clerk, Onsite",RWJBarnabas Health,"South Plainfield, NJ 07080",2024-10-19,Inputs all patient data on log. The Nursing Data Clerk assists in the provision of nursing care under the supervision of the Nurse Manager by performing the clerical tasks involved in managing the…,"Shifts: Day shift
Job types cc: Per diem
Schedules: Day shift",https://www.indeed.com/m/viewjob?jk=083c1d88ceb368ad,IndeedScraperUSAEng_083c1d88ceb368ad,IndeedScraperUSAEng,Data,USA_ENGLISH,,UNKNOWN
NEW,Data Scientist/Senior Data Scientist,C3 AI,"New York, NY",2024-11-07,"Collaborating with data and subject matter experts from C3 AI and its customer teams to seek, understand, validate, interpret, and correctly use new data elements. Learn more at: C3 AI.",,https://www.indeed.com/m/viewjob?jk=73688df930be694c,IndeedScraperUSAEng_73688df930be694c,IndeedScraperUSAEng,Data,USA_ENGLISH,$123000 - $185000 yearly,UNKNOWN
NEW,Data Analyst,Hill Data Management,"New York, NY",2024-10-13,Work Location NYC-Remote Expected Duration December 2028 Type Part-time Contract Experience 5-7 years Education Level Bachelors or relevant experience Salary Hourly Summary Analyze Skillset…,"Job types: Part-time, Contract
Job types cc: Part-time, Contract",https://www.indeed.com/m/viewjob?jk=b3bc71be06c4afc7,IndeedScraperUSAEng_b3bc71be06c4afc7,IndeedScraperUSAEng,Data,USA_ENGLISH,,UNKNOWN
NEW,Data Entry/Customer Service,I Zakarin and Sons,"South Fallsburg, NY 12779",2024-10-30,Ensure confidentiality of sensitive information while handling data. Proficient in data collection techniques and database management. Collect and input data from various sources into designated…,"Job types: Part-time, Full-time
Shifts: 8 hour shift, 4 hour shift, 10 hour shift
Benefits: Employee discount, Flexible schedule
Job types cc: Part-time, Full-time
Schedules: 8 hour shift, 4 hour shift, 10 hour shift",https://www.indeed.com/m/viewjob?jk=f54b4bd91ce35461,IndeedScraperUSAEng_f54b4bd91ce35461,IndeedScraperUSAEng,Data,USA_ENGLISH,$16 - $18 hourly,UNKNOWN
NEW,"VP, Enterprise Data Sales",Predactiv,"New York, NY 10003",2024-10-15,"10+ years of Enterprise sales experience, ideally having sold data solutions and/or data platforms across the Advertising & Marketing ecosystem. Develop new content, such as case studies, curated data…","Job types: Full-time
Remote: Remote
Job types cc: Full-time",https://www.indeed.com/m/viewjob?jk=651f29ce8796f7c9,IndeedScraperUSAEng_651f29ce8796f7c9,IndeedScraperUSAEng,Data,USA_ENGLISH,$300000 - $370000 yearly,FULLY_REMOTE
NEW,Data Entry Specialist,"Sutton Warehousing, Inc","Sayreville, NJ 08872",2024-11-08,We are looking for an Import Coordinator - we are a company that ships Pet items to all the big Pet retailers- we are looking for someone who is proficent in Microsoft Excel-sorting- filtering...…,"Job types: Full-time
Shifts: 8 hour shift, Day shift
Benefits: Health savings account, Health insurance, Dental insurance, 401(k), Paid time off, Parental leave, 401(k) matching, Retirement plan
Job types cc: Full-time
Schedules: 8 hour shift, Day shift",https://www.indeed.com/m/viewjob?jk=e0b67fe10c07bfbb,IndeedScraperUSAEng_e0b67fe10c07bfbb,IndeedScraperUSAEng,Data,USA_ENGLISH,$19 - $22 hourly,UNKNOWN
NEW,"Data Scientist, Topline Forecasting",Amazon.com Services LLC,"New York, NY",2024-10-13,"2+ years of data scientist experience. Experience in a ML or data scientist role with a large technology company. Extract data for analysis and model development from large, complex datasets to…","Job types: Full-time
Job types cc: Full-time",https://www.indeed.com/m/viewjob?jk=6ec60c9f2bc364d1,IndeedScraperUSAEng_6ec60c9f2bc364d1,IndeedScraperUSAEng,Data,USA_ENGLISH,$125500 - $212800 yearly,UNKNOWN
NEW,Research Data Associate,NYU Langone Health,"New York, NY 10016",2024-10-17,Compiles data and assists in consolidating and analyzing data for presentation to sponsoring and regulatory agencies Reviews data with supervisor and then provides reports to all parties e g data and…,"Job types: Full-time
Job types cc: Full-time",https://www.indeed.com/m/viewjob?jk=eba4c83e6e520258,IndeedScraperUSAEng_eba4c83e6e520258,IndeedScraperUSAEng,Data,USA_ENGLISH,$48336 - $50180 yearly,UNKNOWN
NEW,Data Entry Specialist,"NEW YORK EDGE, INC","New York, NY 11377",2024-11-06,"The data specialist will play a critical role in assisting the Community School Director and New York Edge in running reports and tracking data which details the programs successes, highlights and…","Job types: Part-time
Shifts: After school
Job types cc: Part-time
Schedules: After school, Monday to Friday",https://www.indeed.com/m/viewjob?jk=22e2160a34b4d2fb,IndeedScraperUSAEng_22e2160a34b4d2fb,IndeedScraperUSAEng,Data,USA_ENGLISH,$20 - $25 hourly,UNKNOWN
NEW,Data Entry Clerk,"Rubin & Rothman, LLC.","Islandia, NY 11749",2024-11-01,*Job Summary:* The Data Entry Clerk will enter data and perform other related duties. Duties/Responsibilities: * Retrieves source files and work from the data center each day. * Verifies and…,"Job types: Full-time
Shifts: 8 hour shift
Benefits: Health savings account, Health insurance, Dental insurance, Flexible spending account, Paid time off, Vision insurance, Flexible schedule, Life insurance
Job types cc: Full-time
Schedules: 8 hour shift, Monday to Friday",https://www.indeed.com/m/viewjob?jk=01f3a65f7a468592,IndeedScraperUSAEng_01f3a65f7a468592,IndeedScraperUSAEng,Data,USA_ENGLISH,$18 - $20 hourly,UNKNOWN
NEW,Data Entry Clerk (Jewelry Information Specialist),"Eric Originals and Antiques, LTD.","New York, NY 10036",2024-10-15,"About Eric Originals and Antiques:*. Since 1978, Eric Originals and Antiques has been a distinguished name in the jewelry industry, specializing in bridal and wedding jewelry, along with an exquisite…","Job types: Temporary, Part-time, Full-time
Shifts: 8 hour shift, 4 hour shift
Benefits: Health insurance, Dental insurance, 401(k), Paid time off, Vision insurance, Flexible schedule
Job types cc: Temporary, Part-time, Full-time
Schedules: 8 hour shift, 4 hour shift, Monday to Friday",https://www.indeed.com/m/viewjob?jk=49392aa04bc66a8a,IndeedScraperUSAEng_49392aa04bc66a8a,IndeedScraperUSAEng,Data,USA_ENGLISH,,UNKNOWN
NEW,Strategic Remediation & Control Office – Data Governance QA,Deutsche Bank,"New York, NY",2024-10-13,"Job Title Strategic Remediation & Control Office – Data Governance QA. This role sits within the Strategic Remediation Control Office, which leads the Transformation and Remediation at Deutsche Bank.","Job types: Full-time
Remote: Hybrid work
Benefits: Work from home, Parental leave, Retirement plan
Job types cc: Full-time",https://www.indeed.com/m/viewjob?jk=28de344802f08343,IndeedScraperUSAEng_28de344802f08343,IndeedScraperUSAEng,Data,USA_ENGLISH,$125000 - $266700 yearly,TEMPORARILY_REMOTE
NEW,"Analyst, Data Management",Hamilton Lane,"Philadelphia, PA",2024-11-02,"Hamilton Lane is looking to expand our team to satisfy the needs of our growing client base. Hamilton Lane is built on collaboration, teamwork and integrity. Our employees pursue excellence and…","Job types: Full-time
Benefits: Employee stock purchase plan, Health insurance, Dental insurance, 401(k), Flexible spending account, Tuition reimbursement, Paid time off, Gym membership, Volunteer time off
Job types cc: Full-time",https://www.indeed.com/m/viewjob?jk=193e0ea3a92fe6ff,IndeedScraperUSAEng_193e0ea3a92fe6ff,IndeedScraperUSAEng,Data,USA_ENGLISH,,UNKNOWN
NEW,Data Privacy Coordinator,Morgan Lewis,"Philadelphia, PA",2024-10-13,Oversee firmwide data mapping activities and preparation of record of processing. We welcome candidates who have an interest in the growing field of data privacy.,"Job types: Full-time
Remote: Hybrid work
Job types cc: Full-time",https://www.indeed.com/m/viewjob?jk=91ffb1a3cfd78bc3,IndeedScraperUSAEng_91ffb1a3cfd78bc3,IndeedScraperUSAEng,Data,USA_ENGLISH,,TEMPORARILY_REMOTE
NEW,Data Abstractor,Columbia University,"New York, NY",2024-10-13,"2 years plus related nursing data management preferred. The Data Abstractor will be responsible for data abstraction and data entry and concurrent/retrospective data review for the ACC, STS, TVT and…","Job types: Full-time
Job types cc: Full-time",https://www.indeed.com/m/viewjob?jk=77f854bf917772a3,IndeedScraperUSAEng_77f854bf917772a3,IndeedScraperUSAEng,Data,USA_ENGLISH,$70500 - $78600 yearly,UNKNOWN
NEW,HR Service Center - Data Coordinator Representative,Children’s Hospital of Philadelphia,"Philadelphia, PA 19104",2024-11-12,"Day (United States of America). Children’s Hospital of Philadelphia (CHOP) offers countless ways to change lives. Our diverse community of more than 20,000 Breakthrough Makers will inspire you to…","Job types: Full-time
Shifts: Day shift
Job types cc: Full-time
Schedules: Day shift",https://www.indeed.com/m/viewjob?jk=81eddd7e2fbe0a0f,IndeedScraperUSAEng_81eddd7e2fbe0a0f,IndeedScraperUSAEng,Data,USA_ENGLISH,,UNKNOWN
NEW,"Senior Data Analyst, Bureau of Vital Statistics",DEPT OF HEALTH/MENTAL HYGIENE,"Manhattan, NY",2024-11-02,"Produce Annual Summary of Vital Statistics data tables and figures in collaboration with other data analysts. Staff in this unit work on vital statistics data analyses, data requests, and research…","Job types: Full-time
Benefits: Wellness program, Work from home, Loan forgiveness
Job types cc: Full-time",https://www.indeed.com/m/viewjob?jk=31356f8c546d57f4,IndeedScraperUSAEng_31356f8c546d57f4,IndeedScraperUSAEng,Data,USA_ENGLISH,$106117 - $118534 yearly,UNKNOWN
NEW,Weather Data Scientist (3/2 Hybrid Work Schedule),Castleton Commodities International,"Stamford, CT 06902",2024-10-13,Develop efficient data processing pipelines to handle massive data sets. Experience working with large-scale data sets and data ingestion processes. Increase the spread and accuracy of our forecasting…,"Job types: Full-time
Remote: Hybrid work
Benefits: Health insurance, Dental insurance, Tuition reimbursement, Paid time off, Family leave, Parental leave, Employee discount, Life insurance
Job types cc: Full-time",https://www.indeed.com/m/viewjob?jk=df08462d0f7b55e9,IndeedScraperUSAEng_df08462d0f7b55e9,IndeedScraperUSAEng,Data,USA_ENGLISH,,TEMPORARILY_REMOTE
NEW,Senior Data Analyst,David Yurman,"New York, NY",2024-10-16,"Data Integrity & Governance: Ensure data accuracy and completeness by identifying and addressing data quality issues. Knowledge of data privacy regulations such as GDPR, CCPA, and how they impact…","Job types: Full-time
Remote: Hybrid work
Job types cc: Full-time",https://www.indeed.com/m/viewjob?jk=b939193810263f1a,IndeedScraperUSAEng_b939193810263f1a,IndeedScraperUSAEng,Data,USA_ENGLISH,$110000 - $125000 yearly,TEMPORARILY_REMOTE
NEW,"Sr. Data Scientist, Product Analytics",Peloton,"New York, NY 10011",2024-10-13,"Have solid technical skills when it comes to data wrangling and handling large datasets: expert in SQL for data extraction (including sophisticated joins, CTE, window functions, query optimization),…",Remote: Hybrid work,https://www.indeed.com/m/viewjob?jk=cdca57c4537f2d35,IndeedScraperUSAEng_cdca57c4537f2d35,IndeedScraperUSAEng,Data,USA_ENGLISH,$168426 - $227374 yearly,TEMPORARILY_REMOTE
NEW,Clinical Data Coord,Catholic Health,"Roslyn, NY 11576",2024-11-05,"REGISTERED NURSE CLINICAL DATA COORDINATOR. St. Francis Hospital & Heart Center® is New York State's only specialty designated cardiac center. A member of Catholic Health, St. Francis is consistently…","Benefits: Health insurance, Tuition reimbursement",https://www.indeed.com/m/viewjob?jk=7d3e03a73d7f87f2,IndeedScraperUSAEng_7d3e03a73d7f87f2,IndeedScraperUSAEng,Data,USA_ENGLISH,$53.77 - $77.5 hourly,UNKNOWN
NEW,"Data Scientist, Business Intelligence",Warner Music Group,"New York, NY",2024-10-13,Familiarity with data visualization tools like Tableau or Power BI. Demonstrated ability to lead and execute data science projects with minimal supervision.,"Job types: Full-time
Remote: Hybrid work
Job types cc: Full-time",https://www.indeed.com/m/viewjob?jk=0392004e07df930d,IndeedScraperUSAEng_0392004e07df930d,IndeedScraperUSAEng,Data,USA_ENGLISH,$150000 - $160000 yearly,TEMPORARILY_REMOTE
NEW,Data Analyst -Surgery - C-STAR,NYU Langone Health,"New York, NY 10016",2024-10-13,"Experience with observational studies using EHR data. Serve as a data analyst to the Center of Surgical and Transplant Applied Research (C-STAR), using primarily electronic health record (EHR), also…","Job types: Full-time
Job types cc: Full-time",https://www.indeed.com/m/viewjob?jk=2de997733ab27006,IndeedScraperUSAEng_2de997733ab27006,IndeedScraperUSAEng,Data,USA_ENGLISH,$62400 - $85000 yearly,UNKNOWN
NEW,SR. CLINICAL DATA MANAGER,PVR Technologies,"King of Prussia, PA 19406",2024-10-13,Design clinical trials utilizing CDASH & SDTM standard terminology; Lead the team in understanding integrated data review process (IDRP) and supporting technology ecosystem including medical and…,"Job types: Full-time
Job types cc: Full-time
Schedules: Monday to Friday",https://www.indeed.com/m/viewjob?jk=e72046d9f23b404f,IndeedScraperUSAEng_e72046d9f23b404f,IndeedScraperUSAEng,Data,USA_ENGLISH,$109262 - $109262 yearly,UNKNOWN
NEW,"Data Engineer, Ads Marketing Decision Science",Amazon Advertising LLC,"New York, NY",2024-10-15,"We analyze the needs, experiences, and behaviors of Amazon advertisers at petabytes scale, to deliver the right marketing communications to the right advertiser at the right team to help them make the…","Job types: Full-time
Job types cc: Full-time",https://www.indeed.com/m/viewjob?jk=777923d0a1bf1635,IndeedScraperUSAEng_777923d0a1bf1635,IndeedScraperUSAEng,Data,USA_ENGLISH,$118900 - $205600 yearly,UNKNOWN
NEW,Data Specialist,Queens Public Library,"Jamaica, NY 11432",2024-11-05,"Contributes to teams working on authority control and data harvesting through APIs. Knowledge of website development (Drupal), and linked data. Performs metadata normalization, batch metadata and…","Job types: Temporary
Benefits: Health insurance, Dental insurance, Paid time off, Vision insurance
Job types cc: Temporary
Schedules: Weekends as needed, Monday to Friday",https://www.indeed.com/m/viewjob?jk=629937f1e637277c,IndeedScraperUSAEng_629937f1e637277c,IndeedScraperUSAEng,Data,USA_ENGLISH,$56000 - $75000 yearly,UNKNOWN
NEW,Data and Analytics Consultant,"Systems Evolution, Inc","New York, NY",2024-11-07,"Experience designing and building data platforms that support data lakes, data stores, data ingestion and transformations and API services for consuming data. Experience across our service offerings.","Benefits: Paid parental leave, Paid holidays, Disability insurance, Health insurance, Dental insurance, 401(k), Paid time off, Parental leave, Vision insurance, Life insurance
Job types cc: Permanent",https://www.indeed.com/m/viewjob?jk=64e408e2cf30b90c,IndeedScraperUSAEng_64e408e2cf30b90c,IndeedScraperUSAEng,Data,USA_ENGLISH,$140000 - $190000 yearly,UNKNOWN
NEW,Jr Data Analyst,Veracity Software,"Iselin, NJ 08830",2024-10-13,"Passion for problem solving by gathering descriptive insights through data extraction , slicing and dicing the data. Strong in querying logic and data interpretation.",Benefits: Flexible schedule,https://www.indeed.com/m/viewjob?jk=7513584bd0c547c0,IndeedScraperUSAEng_7513584bd0c547c0,IndeedScraperUSAEng,Data,USA_ENGLISH,,UNKNOWN
NEW,Community Coordinator - Data Support Coordinator Adult Education Programs [P#011933A],New York City Department of Education,"Bronx, NY",2024-10-23,Closely work with central data team directors to ensure proper collection and management of data. Closely work with central data team directors to ensure proper collection and management of data.,"Schedules: Weekends as needed, Evenings as needed",https://www.indeed.com/m/viewjob?jk=2bfccc566dafbbfc,IndeedScraperUSAEng_2bfccc566dafbbfc,IndeedScraperUSAEng,Data,USA_ENGLISH,$60733 - $94279 yearly,UNKNOWN
NEW,Data Engineer,Ipsos,"New York, NY",2024-10-13,Familiarity with data science model deployment and maintenance. Preferred to have experience collaborating or working as data scientist in the past. Develop and maintain data warehouses to efficiently…,"Benefits: Health insurance, Paid time off",https://www.indeed.com/m/viewjob?jk=164af1dd63825512,IndeedScraperUSAEng_164af1dd63825512,IndeedScraperUSAEng,Data,USA_ENGLISH,$75000 - $100000 yearly,UNKNOWN
NEW,QM Clinical Data Coordinator,Catholic Health,"West Islip, NY 11795",2024-10-13,Responsible for the accountability for accurate and complete data collection and the coordination of performance improvement initiatives as indicated by the data for the cardiovascular surgery program…,"Benefits: Health insurance, Flexible spending account, Tuition reimbursement, Paid time off, Life insurance",https://www.indeed.com/m/viewjob?jk=5dfeaa9e7b5575d1,IndeedScraperUSAEng_5dfeaa9e7b5575d1,IndeedScraperUSAEng,Data,USA_ENGLISH,$106996.5 - $127920 yearly,UNKNOWN
NEW,Research Data Associate * Must be bilingual in English and Spanish *,NYU Langone,"New York, NY 10016",2024-11-08,"NYU Grossman School of Medicine is one of the nation's top-ranked medical schools. For 175 years, NYU Grossman School of Medicine has trained thousands of physicians and scientists who have helped…","Job types: Full-time
Job types cc: Full-time",https://www.indeed.com/m/viewjob?jk=8ec990fd2a6d7aca,IndeedScraperUSAEng_8ec990fd2a6d7aca,IndeedScraperUSAEng,Data,USA_ENGLISH,$51243.96 - $51243.96 yearly,UNKNOWN
NEW,Data Analyst,Columbia University,"New York, NY",2024-10-13,"Experience with managing large data frames, multi-level and longitudinal data analysis, and data visualization is critical. Conduct data analysis to fulfill research aims 50%.","Job types: Full-time
Job types cc: Full-time",https://www.indeed.com/m/viewjob?jk=d14beccd4b699030,IndeedScraperUSAEng_d14beccd4b699030,IndeedScraperUSAEng,Data,USA_ENGLISH,$65000 - $74000 yearly,UNKNOWN
NEW,Associate | Data Governance,Macquarie Group Limited,"New York, NY",2024-10-13,"Working as a key member of a team with capabilities in data quality, data advisory and risk management, you will drive the implementation of data management best practices to enable a data-driven and…","Benefits: Health savings account, Disability insurance, Health insurance, Dental insurance, 401(k), Paid time off, Parental leave, Employee assistance program, Vision insurance, Life insurance",https://www.indeed.com/m/viewjob?jk=5cf90dfdbd4d8b2e,IndeedScraperUSAEng_5cf90dfdbd4d8b2e,IndeedScraperUSAEng,Data,USA_ENGLISH,$95000 - $125000 yearly,UNKNOWN
NEW,Data Integration and Data Warehouse Manager,Jackson Lewis,"New York, NY",2024-10-31,"10+ years of experience in data integration, data warehousing, and analytics, with a demonstrated ability to build and manage complex data architectures. Experience with cloud platforms such as Azure.","Job types: Full-time
Remote: Hybrid work
Benefits: Opportunities for advancement
Job types cc: Full-time",https://www.indeed.com/m/viewjob?jk=dd3c46e21c762473,IndeedScraperUSAEng_dd3c46e21c762473,IndeedScraperUSAEng,Data,USA_ENGLISH,$165600 - $200800 yearly,TEMPORARILY_REMOTE
NEW,Data Analytics College Associate,Live Nation,"New York, NY",2024-10-22,"This ranges from improvements to existing dashboards, extracting new insights from big data sets, and providing guidance on improving data quality. Explore relevant trends within datasets using SQL or…","Job types: Full-time
Job types cc: Full-time
Schedules: Overtime",https://www.indeed.com/m/viewjob?jk=2c4ce5aca09cd09a,IndeedScraperUSAEng_2c4ce5aca09cd09a,IndeedScraperUSAEng,Data,USA_ENGLISH,$20 - $20 hourly,UNKNOWN
NEW,Data Steward,Legrand North America,"West Hartford, CT 06110",2024-10-29,"Request data adaptations and manipulation within the data structure and taxonomy by following established processes. Manage all data projects across the division, including individual business unit…","Job types: Full-time
Remote: Remote
Benefits: Paid parental leave, Health insurance, Dental insurance, Paid time off, Parental leave, Vision insurance, 401(k) matching, Volunteer time off
Job types cc: Full-time",https://www.indeed.com/m/viewjob?jk=405989dca38eb240,IndeedScraperUSAEng_405989dca38eb240,IndeedScraperUSAEng,Data,USA_ENGLISH,,FULLY_REMOTE
NEW,Client Strategy & Data Analytics,Natixis North America LLC,"New York, NY",2024-11-07,"IT/Business Analyst background can be a plus to support manipulation and presentation of data. Ability to manipulate data, interpret numbers and deliver relevant messages in a succinct fashion for…",,https://www.indeed.com/m/viewjob?jk=f27016449e75c8e8,IndeedScraperUSAEng_f27016449e75c8e8,IndeedScraperUSAEng,Data,USA_ENGLISH,$105000 - $160000 yearly,UNKNOWN
