status,title,company,location,date,blurb,tags,link,id,provider,query,locale,wage,remoteness
NEW,Principal Clinical Data Manager,TK-CHAIN LLC,"Princeton, NJ 08540",2024-11-01,"Develop, review and maintain project-specific DM documents including data management plans (DMP), eCRF, data validation plan (DVP) and external data transfer agreements throughout the lifecycle of the…","Job types: Full-time
Job types cc: Full-time",https://www.indeed.com/m/viewjob?jk=763cc61c158ab17d,IndeedScraperUSAEng_763cc61c158ab17d,IndeedScraperUSAEng,Data,USA_ENGLISH,$60000 - $120000 yearly,UNKNOWN
NEW,Jr. Web Application Data Engineer,GEI Consultants,"Mount Laurel, NJ 08054",2024-10-13,Description Your role at GEI. The Jr. Web Application Data Engineer position is responsible for the development and support of web applications that are highly data centric. This position goes…,"Job types: Full-time
Remote: Hybrid work
Benefits: Profit sharing, Commuter assistance, Paid parental leave, Paid holidays, Health insurance, Dental insurance, 401(k), Tuition reimbursement, Paid time off, Cell phone reimbursement, Parental leave, Vision insurance, Opportunities for advancement
Job types cc: Full-time",https://www.indeed.com/m/viewjob?jk=f1188dad330e0ce7,IndeedScraperUSAEng_f1188dad330e0ce7,IndeedScraperUSAEng,Data,USA_ENGLISH,$25 - $32 hourly,TEMPORARILY_REMOTE
NEW,Data Integration Developer (100% Remote),"MEDLOGIX, LLC","Lansdale, PA 19446",2024-10-13,"Work with project stakeholders to develop workflows and data formats that address the project requirements. Assist in daily administration activities including monitoring, support, and maintenance of…",Remote: Remote,https://www.indeed.com/m/viewjob?jk=e24ec2302093e938,IndeedScraperUSAEng_e24ec2302093e938,IndeedScraperUSAEng,Data,USA_ENGLISH,,FULLY_REMOTE
NEW,"Sports Data Operator - Baseball/Softball (Yaphank, NY)",Realplay,"Yaphank, NY 11980",2024-10-13,"Realplay delivers video of every swing, pitch, and defensive play that any player makes on a baseball or softball field. Attend Realplay's partner facility ""Lasorda Legacy Park"", in Yaphank NY to…",,https://www.indeed.com/m/viewjob?jk=d9dc8ee215c4932e,IndeedScraperUSAEng_d9dc8ee215c4932e,IndeedScraperUSAEng,Data,USA_ENGLISH,$15 - $16 hourly,UNKNOWN
NEW,2024-2025 Tenure-Track Positions in Artificial Intelligence,New York University,"New York, NY 10012",2024-10-25,"We are looking for outstanding individuals working in a broad set of areas of AI, including, but not limited to, machine learning, natural language processing, computer vision, robotics, systems, and…",Job types cc: Tenure track,https://www.indeed.com/m/viewjob?jk=f3e3337addc62240,IndeedScraperUSAEng_f3e3337addc62240,IndeedScraperUSAEng,Data,USA_ENGLISH,$125000 - $325000 yearly,UNKNOWN
NEW,Data Entry Clerk,Allports Logistics,"Linden, NJ 07036",2024-10-13,Perform regular backups of data. Confirm accuracy of data by comparing to original documents. Create reports or otherwise retrieve data from the database. Skilled in Microsoft Word and Excel.,"Job types: Full-time
Benefits: Paid time off, Opportunities for advancement
Job types cc: Full-time",https://www.indeed.com/m/viewjob?jk=bf324f0f1e4b0805,IndeedScraperUSAEng_bf324f0f1e4b0805,IndeedScraperUSAEng,Data,USA_ENGLISH,$17 - $17 hourly,UNKNOWN
NEW,PAM DATA ENTRY CLERK,HRA/DEPT OF SOCIAL SERVICES,"Manhattan, NY 10038",2024-10-13,Review and check Turn Around Document (TAD) for completeness to ensure accuracy of data entries and make corrections when necessary; enter information received from source documents for data entry.,"Job types: Full-time
Job types cc: Full-time
Schedules: Monday to Friday",https://www.indeed.com/m/viewjob?jk=1f3b99607828685a,IndeedScraperUSAEng_1f3b99607828685a,IndeedScraperUSAEng,Data,USA_ENGLISH,$39763 - $45728 yearly,UNKNOWN
NEW,Booth Attendant / Data Entry Clerk,Sarcona Management,"Newark, NJ 07105",2024-10-13,"Port Kearny is seeking Full-Time/Part-Time lot attendants who will be responsible for capturing specific data points for each unit entering/exiting the grounds, ensuring a neat and orderly parking…","Job types: Full-time
Shifts: 12 hour shift, Overnight shift, Night shift, Day shift
Benefits: Health insurance, Dental insurance, 401(k), Paid time off, On-the-job training, Vision insurance, Flexible schedule, Life insurance, Referral program
Job types cc: Full-time
Schedules: 12 hour shift, Overtime, Weekends as needed, Overnight shift, Night shift, Every weekend, Day shift, Monday to Friday, Holidays",https://www.indeed.com/m/viewjob?jk=e597326314348314,IndeedScraperUSAEng_e597326314348314,IndeedScraperUSAEng,Data,USA_ENGLISH,$17 - $20 hourly,UNKNOWN
NEW,IIS Data Specialist,Health Federation Of Philadelphia,"Philadelphia, PA 19107",2024-10-24,"The Data Specialist will also be responsible for making corrections to other IIS data, such as lot numbers, vaccine administration data and or other IIS data as required.","Job types: Full-time
Benefits: AD&D insurance, Disability insurance, Health insurance, Dental insurance, Flexible spending account, Paid time off, Employee assistance program, Vision insurance, 403(b)
Job types cc: Full-time
Schedules: Weekends as needed, Monday to Friday",https://www.indeed.com/m/viewjob?jk=13073dbd2b85bb07,IndeedScraperUSAEng_13073dbd2b85bb07,IndeedScraperUSAEng,Data,USA_ENGLISH,$50000 - $52000 yearly,UNKNOWN
NEW,Clinical Data Manager,Katalyst Healthcares & Life Sciences,"Princeton, NJ 08540",2024-10-13,Responsibilities: Lead the creation of the Data Review and Cleaning Plan and development of the data cleaning strategy. Provide oversight of the data validation plan and provide DM insight to…,"Job types: Contract
Job types cc: Contract",https://www.indeed.com/m/viewjob?jk=46e19a911c493033,IndeedScraperUSAEng_46e19a911c493033,IndeedScraperUSAEng,Data,USA_ENGLISH,,UNKNOWN
NEW,Data Entry Specialist,Hispanic Health Council,"Hartford, CT 06106",2024-10-13,Job Description The Hispanic Health Council is looking for an experiences Data Entry Specialist to join our Youth Services Program. The Data Entry Specialist will support the Extended Learning…,,https://www.indeed.com/m/viewjob?jk=40bb96a9d86d1f1f,IndeedScraperUSAEng_40bb96a9d86d1f1f,IndeedScraperUSAEng,Data,USA_ENGLISH,$20 - $-1 hourly,UNKNOWN
NEW,Intake & Data Integrity Specialist,Fortune Society Inc,"Long Island City, NY 11101",2024-10-13,"This is a growth position for the right candidate who can input, aggregate, and analyze multiple data points, anticipates the logical next step and can work closely with senior management to use data…","Job types: Full-time
Job types cc: Full-time
Schedules: Monday to Friday",https://www.indeed.com/m/viewjob?jk=3b1afa12d58aef16,IndeedScraperUSAEng_3b1afa12d58aef16,IndeedScraperUSAEng,Data,USA_ENGLISH,$70000 - $75000 yearly,UNKNOWN
NEW,Data Entry Clerk,Smoking Sales LLC,"Jersey City, NJ 07305",2024-10-13,Benefits: Competitive salary Dental insurance Employee discounts Health insurance Opportunity for advancement Paid time off Vision insurance Benefits/Perks Competitive Compensation Paid Time Off…,"Job types: Full-time
Benefits: Health insurance, Dental insurance, Paid time off, Vision insurance, Employee discount, Opportunities for advancement
Job types cc: Full-time",https://www.indeed.com/m/viewjob?jk=58da44bfa9ce87ce,IndeedScraperUSAEng_58da44bfa9ce87ce,IndeedScraperUSAEng,Data,USA_ENGLISH,$15 - $18 hourly,UNKNOWN
NEW,Data Analyst - Internal Audit (On Site),OceanFirst Bank,"Red Bank, NJ 07701",2024-10-24,"At OceanFirst Bank, each one of our employees plays an important role in fulfilling the mission and taking responsibility to execute daily tasks in alignment with our core values. Together we foster…","Benefits: Tuition reimbursement, Employee discount",https://www.indeed.com/m/viewjob?jk=7f1a86c1dc4e5c42,IndeedScraperUSAEng_7f1a86c1dc4e5c42,IndeedScraperUSAEng,Data,USA_ENGLISH,,UNKNOWN
NEW,Part Time AP Data Entry Clerk,Amerlux,"Oakland, NJ 07436",2024-10-29,"This position works full time in our Oakland, NJ office. This position supports the Accounting Department in an administrative capacity and is responsible for processing Accounts Payables.","Job types: Full-time
Benefits: AD&D insurance, Disability insurance, Health insurance, Dental insurance, Vision insurance, 401(k) matching
Job types cc: Full-time",https://www.indeed.com/m/viewjob?jk=3eeb3ea7eb8772e0,IndeedScraperUSAEng_3eeb3ea7eb8772e0,IndeedScraperUSAEng,Data,USA_ENGLISH,,UNKNOWN
NEW,Data Processing Assistant Supervisor,MEDFORD NURSERY,"Medford, NJ 08055",2024-11-01,Maintain organized records and documentation of data entry activities. Assist in preparing reports on data entry performance metrics. Proven experience in data entry or a related role.,"Job types: Full-time
Shifts: 8 hour shift
Benefits: Health savings account, Health insurance, Dental insurance, 401(k), Paid time off, 401(k) matching
Job types cc: Full-time
Schedules: 8 hour shift, Weekends as needed, Monday to Friday",https://www.indeed.com/m/viewjob?jk=890f87952d1e093c,IndeedScraperUSAEng_890f87952d1e093c,IndeedScraperUSAEng,Data,USA_ENGLISH,$57000 - $60000 yearly,UNKNOWN
NEW,Product Manager - Addepar Data Exchange,Addepar,"New York, NY",2024-10-15,Proficient in data lake house technology and data workflows. This role plays a vital part in fulfilling the ambitious requirements of financial data management and data driven decision making.,Remote: Remote,https://www.indeed.com/m/viewjob?jk=7c0547ca21f3341a,IndeedScraperUSAEng_7c0547ca21f3341a,IndeedScraperUSAEng,Data,USA_ENGLISH,$118000 - $184000 yearly,FULLY_REMOTE
NEW,Jr. Web Application Data Engineer,GEI Consultants,"Exton, PA 19341",2024-10-13,Collaborate with data architects and data engineers. Provide programming and data engineering assistance for desktop applications. The Jr. Web Application Data Engineer position is responsible for the…,"Job types: Full-time
Remote: Hybrid work
Benefits: Profit sharing, Commuter assistance, Paid parental leave, Paid holidays, Health insurance, Dental insurance, 401(k), Tuition reimbursement, Paid time off, Cell phone reimbursement, Parental leave, Vision insurance, Opportunities for advancement
Job types cc: Full-time",https://www.indeed.com/m/viewjob?jk=0b481823891b5bd9,IndeedScraperUSAEng_0b481823891b5bd9,IndeedScraperUSAEng,Data,USA_ENGLISH,$25 - $32 hourly,TEMPORARILY_REMOTE
NEW,Training Manager - Data Centers (Hybrid),Belimo Americas,"Danbury, CT",2024-10-13,"Provides consultation for development of data center specific training, including research, evaluation and selection of outside consultants and trainers. BS or BA degree in related field of study.","Job types: Full-time
Job types cc: Full-time",https://www.indeed.com/m/viewjob?jk=9b9521e0f7248919,IndeedScraperUSAEng_9b9521e0f7248919,IndeedScraperUSAEng,Data,USA_ENGLISH,$85000 - $100000 yearly,UNKNOWN
NEW,Data Entry Specialist Part Time Evenings,CarVision Inc.,"Maple Shade, NJ 08052",2024-11-10,"Who We Are At Car Vision, we strive to make every customer a customer for life. Happy employees make happy customers, and we reward individuals who are ready to work hard and stay motivated. Every…","Job types: Full-time
Shifts: Evening shift
Benefits: Paid training, Paid holidays, Employee discount
Job types cc: Full-time
Schedules: Evening shift",https://www.indeed.com/m/viewjob?jk=4b59697db582ffb3,IndeedScraperUSAEng_4b59697db582ffb3,IndeedScraperUSAEng,Data,USA_ENGLISH,,UNKNOWN
NEW,Traveling Property Data Surveyor,ID Plans,"New Haven, CT",2024-10-30,"Experience in property inspecting, surveying, and data entry: Prior experience in similar roles is advantageous but not required. Problem-solving and adaptability: Find solutions to unexpected issues…","Job types: Full-time
Benefits: Paid training, Dental insurance, Paid time off, Vision insurance, 401(k) matching, Flexible schedule, Pet insurance
Job types cc: Full-time
Schedules: Monday to Friday",https://www.indeed.com/m/viewjob?jk=6d97ffc431ec7563,IndeedScraperUSAEng_6d97ffc431ec7563,IndeedScraperUSAEng,Data,USA_ENGLISH,$22 - $26 hourly,UNKNOWN
NEW,Applied Mathematician / Data Analyst,Arcfield,"King of Prussia, PA 19406",2024-10-13,"Tools, models, and data evaluation are typically performed with combinations of Matlab, Python, Perl, Java, C++, R, or similar platforms. 0-2 yeas of experience with a Bachelor’s degree in engineering…","Job types: Full-time
Job types cc: Full-time",https://www.indeed.com/m/viewjob?jk=c549cf2b45e1a10b,IndeedScraperUSAEng_c549cf2b45e1a10b,IndeedScraperUSAEng,Data,USA_ENGLISH,,UNKNOWN
NEW,"Clinical Data Coordinator, Neonatology/NICU - Hartford - 12 HR",Connecticut Children's Medical Center,"Hartford, CT 06102",2024-10-13,"DATA INTEGRITY: Provides ongoing quality assurance of the clinical databases for department, to include validating accuracy and completeness of data in forms and reports, by using a variety of…",,https://www.indeed.com/m/viewjob?jk=02c9863b410d4903,IndeedScraperUSAEng_02c9863b410d4903,IndeedScraperUSAEng,Data,USA_ENGLISH,,UNKNOWN
NEW,Senior Machine Learning Engineer,AllSTEM - Jobs,"Jersey City, NJ 07302",2024-11-05,"MACHINE LEARNING ENGINEER W2 ROLE JERSEY CITY,NJ HYBRID MODEL:3DAYS ONSITE RIGHT TO HIRE POSITION Looking for a Senior AI/ML Full Stack Engineer role with a strong emphasis on data-driven problem…","Job types: Temporary, Contract
Shifts: 8 hour shift
Remote: Hybrid work
Job types cc: Temporary, Contract
Schedules: 8 hour shift, Weekends as needed, Monday to Friday",https://www.indeed.com/m/viewjob?jk=d5772f7aec375eeb,IndeedScraperUSAEng_d5772f7aec375eeb,IndeedScraperUSAEng,Data,USA_ENGLISH,$75 - $78 hourly,TEMPORARILY_REMOTE
NEW,Data Ops Analyst,Human Security,"New York, NY",2024-10-24,Experience working with multi TB to PB data sets in cloud databases. Deploy long-term defenses based on statistical analysis of supply chain data and fraud actor behavior.,"Job types: Full-time
Benefits: Stock options
Job types cc: Full-time",https://www.indeed.com/m/viewjob?jk=395ede462b0220d7,IndeedScraperUSAEng_395ede462b0220d7,IndeedScraperUSAEng,Data,USA_ENGLISH,$130000 - $150000 yearly,UNKNOWN
NEW,Data & Impact Specialist (Waterbury),Womens Business Development Council,"Waterbury, CT",2024-10-13,"Responsible for client services data input and data organization, ensuring accuracy and. Present data trends and analysis to staff, in support of fostering a strong data culture.","Job types: Full-time
Remote: Hybrid work
Job types cc: Full-time",https://www.indeed.com/m/viewjob?jk=b6a480190bdf5346,IndeedScraperUSAEng_b6a480190bdf5346,IndeedScraperUSAEng,Data,USA_ENGLISH,$45000 - $50000 yearly,TEMPORARILY_REMOTE
NEW,Senior Data Conversion Analyst (Remote),Patriot Growth Insurance Services,"Fort Washington, PA 19034",2024-11-05,"Strong working knowledge of data requirements used within Applied Epic data platform. This role requires extensive work experience in data conversion, and the technical acumen to ensure smooth data…","Job types: Full-time
Remote: Remote
Benefits: Paid parental leave, Health savings account, Paid holidays, Disability insurance, Health insurance, Dental insurance, Flexible spending account, Paid time off, Parental leave, Employee assistance program, Vision insurance, Flexible schedule
Job types cc: Full-time",https://www.indeed.com/m/viewjob?jk=c38630ac125b6b03,IndeedScraperUSAEng_c38630ac125b6b03,IndeedScraperUSAEng,Data,USA_ENGLISH,$75000 - $90000 yearly,FULLY_REMOTE
NEW,DEI Senior Data & Insights Analyst,Interpublic Group,"New York, NY",2024-10-13,Manage the data collection process for DEI surveys and ensure data integrity. Advance DEI initiatives through data-driven insights and strategic analysis. Bachelor’s degree or equivalent experience.,"Benefits: Employee stock purchase plan, Health insurance, Dental insurance, Flexible spending account, Tuition reimbursement, Paid time off, Employee assistance program, Vision insurance, 401(k) matching",https://www.indeed.com/m/viewjob?jk=81f6d81e6c89248f,IndeedScraperUSAEng_81f6d81e6c89248f,IndeedScraperUSAEng,Data,USA_ENGLISH,$100000 - $120000 yearly,UNKNOWN
NEW,HR Data and Process Analyst,CooperSurgical,"Trumbull, CT",2024-10-22,"Strong understanding of data compliance practices and regulations related to HR data. Conduct regular audits to ensure data accuracy and compliance. Data Management: Manage HR data precisely, ensuring…","Job types: Full-time
Benefits: Health insurance, 401(k), Paid time off, Parental leave
Job types cc: Full-time",https://www.indeed.com/m/viewjob?jk=d5af39db901e9ed6,IndeedScraperUSAEng_d5af39db901e9ed6,IndeedScraperUSAEng,Data,USA_ENGLISH,,UNKNOWN
NEW,Manager - IDCS Data Analytics,SHI International Corp.,"Piscataway, NJ 08854",2024-10-13,"Minimum 3-5 years experience in data analysis, business intelligence, and data governance. Develop and implement data strategies, ensuring data quality, integrity, and security.","Job types: Full-time
Benefits: Dental insurance, 401(k), Vision insurance
Job types cc: Full-time
Schedules: Extended hours",https://www.indeed.com/m/viewjob?jk=fcc64b05cf02d90e,IndeedScraperUSAEng_fcc64b05cf02d90e,IndeedScraperUSAEng,Data,USA_ENGLISH,$70000 - $90000 yearly,UNKNOWN
NEW,Data Entry,Genesis Laboratory Management,"Oakhurst, NJ 07755",2024-11-06,"Full-Time Data Entry Technician (Tuesday to Saturday 10 am to 6 pm). Specimen Processing and Check-in. LIS Data entry and Verification. Ability to communicate with clients (physicians, laboratories,…","Job types: Full-time
Shifts: 8 hour shift
Job types cc: Full-time
Schedules: 8 hour shift, Overtime",https://www.indeed.com/m/viewjob?jk=2d495535913896b9,IndeedScraperUSAEng_2d495535913896b9,IndeedScraperUSAEng,Data,USA_ENGLISH,,UNKNOWN
NEW,Human Resources Data Entry Clerk,General Trading Co.,"Carlstadt, NJ 07072",2024-11-06,"Weekly data entry: running reports, compiling and entering data. The duties include, but not limited to, tracking the time and attendance, productivity, and drafting warnings.","Job types: Full-time
Benefits: Health insurance, Dental insurance, Vision insurance, 401(k) matching
Job types cc: Full-time",https://www.indeed.com/m/viewjob?jk=2b15c76bbd3b43d4,IndeedScraperUSAEng_2b15c76bbd3b43d4,IndeedScraperUSAEng,Data,USA_ENGLISH,$17 - $19 hourly,UNKNOWN
NEW,Neonatology - Clinical Data Coordinator-NICU - PT,Connecticut Children's Medical Center,"Hartford, CT 06102",2024-10-13,"Connecticut Children’s is the only health system in Connecticut that is 100% dedicated to children. Established on a legacy that spans more than 100 years, Connecticut Children’s offers personalized…","Job types: Part-time
Job types cc: Part-time",https://www.indeed.com/m/viewjob?jk=ceb5692e56a472bd,IndeedScraperUSAEng_ceb5692e56a472bd,IndeedScraperUSAEng,Data,USA_ENGLISH,,UNKNOWN
NEW,Lead Data Product Management,NASDAQ,"New York, NY",2024-10-30,"Continue to establish product-market-fit for our new data management product. Broad understanding of the Market Data business and related businesses (Proprietary, Index, Fund, Alt, and Partner data).","Job types: Full-time
Benefits: Paid parental leave, Employee stock purchase plan, Loan repayment program, Disability insurance, Health insurance, Dental insurance, Tuition reimbursement, Paid time off, Parental leave, 401(k) 6% Match, Vision insurance, 401(k) matching, Gym membership, Bereavement leave
Job types cc: Full-time",https://www.indeed.com/m/viewjob?jk=8d5c69710c823893,IndeedScraperUSAEng_8d5c69710c823893,IndeedScraperUSAEng,Data,USA_ENGLISH,$116200 - $193600 yearly,UNKNOWN
NEW,Data Analyst,Techligent Systems,"Philadelphia, PA",2024-10-13,"Hadoop and/or Big data solutions. Knowledge of databases, including big data technologies. Knowledge of referential and large data formats and file structures. Knowledge of programming and SDLC.","Job types: Full-time
Job types cc: Full-time",https://www.indeed.com/m/viewjob?jk=a91e269fd5056cd7,IndeedScraperUSAEng_a91e269fd5056cd7,IndeedScraperUSAEng,Data,USA_ENGLISH,,UNKNOWN
NEW,Senior Data Management Analyst,Stony Brook Southampton Hospital,"Southampton, NY 11968",2024-11-09,"Competency in data manipulation and analysis; accessing raw data in varied formats with different methods and analyzing and processing data. Experience with data modeling, data structure principles…","Job types: Full-time
Shifts: Day shift
Job types cc: Full-time
Schedules: Day shift",https://www.indeed.com/m/viewjob?jk=03016d290b766702,IndeedScraperUSAEng_03016d290b766702,IndeedScraperUSAEng,Data,USA_ENGLISH,$125000 - $125000 yearly,UNKNOWN
NEW,GIS Data Specialist,DEPARTMENT OF TRANSPORTATION,"Queens, NY 11101",2024-10-13,"Managing data collection materials and tools related to division’s timelapse camera data collection efforts. The prospective candidate will be responsible for managing division datasets, performing…","Job types: Full-time
Benefits: Work from home, Loan forgiveness
Job types cc: Full-time
Schedules: Monday to Friday",https://www.indeed.com/m/viewjob?jk=a58555296a31e8f2,IndeedScraperUSAEng_a58555296a31e8f2,IndeedScraperUSAEng,Data,USA_ENGLISH,$75000 - $160000 yearly,UNKNOWN
NEW,Data Entry,allens oil and propane,"Vincentown, NJ 08088",2024-10-13,"Responsibilities will include but not limited to entering data into the computer, answering phones, filing, help customers that come into the office and dispatching tickets to the drivers.","Job types: Full-time
Shifts: 8 hour shift
Benefits: Health insurance, 401(k), Paid time off
Job types cc: Full-time
Schedules: 8 hour shift",https://www.indeed.com/m/viewjob?jk=433f39d1c1c6b286,IndeedScraperUSAEng_433f39d1c1c6b286,IndeedScraperUSAEng,Data,USA_ENGLISH,$15 - $22 hourly,UNKNOWN
NEW,Data Entry,Eastern Trading LLC,"Cranbury, NJ 08512",2024-11-09,"Experience in how Microsoft Excel function; Minimum requirement data entry skills, processing orders, and communicating with customers/brokers.","Job types: Full-time
Shifts: 8 hour shift
Benefits: Health insurance, 401(k)
Job types cc: Full-time
Schedules: 8 hour shift, Monday to Friday",https://www.indeed.com/m/viewjob?jk=f660b142b900c279,IndeedScraperUSAEng_f660b142b900c279,IndeedScraperUSAEng,Data,USA_ENGLISH,$18 - $-1 hourly,UNKNOWN
NEW,Head of Commercial Data Products,BNY Mellon,"Pennington, NJ",2024-11-04,"BNY assesses market data to ensure a competitive compensation package for our employees. Executes the setting and vision for a product set involving multiple products, tracks, manages and leverages…",,https://www.indeed.com/m/viewjob?jk=98f97bdd18a64941,IndeedScraperUSAEng_98f97bdd18a64941,IndeedScraperUSAEng,Data,USA_ENGLISH,$136500 - $300000 yearly,UNKNOWN
NEW,Data Scientist,"Canon U.S.A., Inc.","Melville, NY 11747",2024-11-07,"In this role a candidate will gather data from a variety of internal and external sources, clean and amalgamate the data, and use programming, math, statistical and analytical skills to interpret data…","Job types: Full-time
Remote: Hybrid work
Benefits: Profit sharing, Visa sponsorship, Health insurance, Dental insurance, 401(k), Tuition reimbursement, Work from home, Vision insurance, Employee discount, Referral program
Job types cc: Full-time",https://www.indeed.com/m/viewjob?jk=3266797f2efe672a,IndeedScraperUSAEng_3266797f2efe672a,IndeedScraperUSAEng,Data,USA_ENGLISH,$69300 - $103770 yearly,TEMPORARILY_REMOTE
NEW,Imaging Data Operations Specialist,Caristo Diagnostics,"Stamford, CT 06901",2024-11-12,"Ensure processes followed for quality data collection to ensure adequacy, accuracy and legitimacy of data in line with company processes. Monitor and evaluate the quality of data received.","Job types: Full-time
Job types cc: Full-time",https://www.indeed.com/m/viewjob?jk=89308f82bdac7873,IndeedScraperUSAEng_89308f82bdac7873,IndeedScraperUSAEng,Data,USA_ENGLISH,,UNKNOWN
NEW,Research Data Associate * Must be bilingual in English and Spanish *,NYU Langone,"New York, NY 10016",2024-11-06,"Engage in data entry, processing, coding, and transcribing; schedule/track visits with families, track incentives, maintain inventory of materials, and coordinate other operational aspects of study.","Job types: Full-time
Job types cc: Full-time",https://www.indeed.com/m/viewjob?jk=32759b4d2526062e,IndeedScraperUSAEng_32759b4d2526062e,IndeedScraperUSAEng,Data,USA_ENGLISH,$51243.96 - $51243.96 yearly,UNKNOWN
NEW,Privacy & Data Counsel,Zeta Global,"New York, NY",2024-10-13,"Support commercial contracting with data partners, vendors, and clients; Process and track subpoenas and other legal requests for data; and. Provide legal counsel to Zeta Global and its subsidiary…","Benefits: Employee stock purchase plan, Health insurance, Unlimited paid time off, Dental insurance, Vision insurance, Employee discount, Pet insurance",https://www.indeed.com/m/viewjob?jk=c40f5f5cf6c5dc65,IndeedScraperUSAEng_c40f5f5cf6c5dc65,IndeedScraperUSAEng,Data,USA_ENGLISH,$130000 - $160000 yearly,UNKNOWN
NEW,Senior Data Analyst,US Health Connect,"Fort Washington, PA 19034",2024-10-23,"Looking for a forward-thinking, fun work environment where you can grow your career? Do you have a passion for data and turning that data into information and information into insight? Then look no…","Job types: Full-time
Remote: Hybrid work
Job types cc: Full-time
Schedules: Extended hours",https://www.indeed.com/m/viewjob?jk=ed037ea1e12f0958,IndeedScraperUSAEng_ed037ea1e12f0958,IndeedScraperUSAEng,Data,USA_ENGLISH,,TEMPORARILY_REMOTE
