status,title,company,location,date,blurb,tags,link,id,provider,query,locale,wage,remotenessNEW,Alteryx Analyst,Marex,"New York, NY",2024-10-13,"Financial services experience, using Alteryx for data extraction, transformation, and analysis. Scripting skills, preferably Python and dealing with data (e.g., Numpy, Pandas).","Job types: Full-time
Job types cc: Full-time",https://www.indeed.com/m/viewjob?jk=04ef13bd303ae39f,IndeedScraperUSAEng_04ef13bd303ae39f,IndeedScraperUSAEng,Data,USA_ENGLISH,$100000 - $150000 yearly,UNKNOWN
NEW,Staff Data Scientist,Human Security,"New York, NY",2024-10-31,"This role is at the intersection of data, technology, and business as we aspire to deeply understand how actors are perpetrating schemes and develop a powerful product to delight our customers.","Job types: Full-time
Benefits: Stock options
Job types cc: Full-time",https://www.indeed.com/m/viewjob?jk=9d769ea756f34e21,IndeedScraperUSAEng_9d769ea756f34e21,IndeedScraperUSAEng,Data,USA_ENGLISH,$165000 - $205000 yearly,UNKNOWN
NEW,Media Experimentation Senior Analyst,FanDuel,"New York, NY",2024-10-16,Experience working with Tableau for data visualization preferred. Own your data and use a range of analytic techniques to answer questions about marketing test results.,"Remote: Hybrid work
Benefits: Paid holidays, Disability insurance, Health insurance, Dental insurance, Paid time off, Vision insurance, 401(k) matching, Life insurance, Paid sick time",https://www.indeed.com/m/viewjob?jk=d58454b92a634bb2,IndeedScraperUSAEng_d58454b92a634bb2,IndeedScraperUSAEng,Data,USA_ENGLISH,$92000 - $126500 yearly,TEMPORARILY_REMOTE
NEW,Business Analyst,QVC,"New York, NY",2024-11-05,"You will convert data into applicable business insights. 1+ years of experience defining requirements, using data to draw business insights, and influencing partners.","Job types: Full-time
Benefits: Health insurance, 401(k), Tuition reimbursement, Paid time off, Parental leave, Employee assistance program, Benefits from day one
Job types cc: Full-time",https://www.indeed.com/m/viewjob?jk=1d2d3441350f1df3,IndeedScraperUSAEng_1d2d3441350f1df3,IndeedScraperUSAEng,Data,USA_ENGLISH,$65000 - $118000 yearly,UNKNOWN
NEW,Tax-Jersey City-Analyst-Data Analytics,Goldman Sachs,"Jersey City, NJ 07302",2024-11-02,Implementing data strategies and converting logical models into physical data models. Working with data and analytics experts to strive for greater functionality in our data systems.,"Job types: Part-time, Full-time
Job types cc: Part-time, Full-time",https://www.indeed.com/m/viewjob?jk=c387658898d1dc04,IndeedScraperUSAEng_c387658898d1dc04,IndeedScraperUSAEng,Data,USA_ENGLISH,$75000 - $100000 yearly,UNKNOWN
NEW,Data Base Administrator and SQL Programmer,Watson Black,"Philadelphia, PA",2024-10-13,"The SQL Programmer/Data Base Administrator position requires skills for both SQL programming and database administration. Functions include designing, coding and testing queries and stored procedures.",,https://www.indeed.com/m/viewjob?jk=485331ffcdcaddd2,IndeedScraperUSAEng_485331ffcdcaddd2,IndeedScraperUSAEng,Data,USA_ENGLISH,,UNKNOWN
NEW,Data and Analytics Associate Hybrid,David's Bridal,"King of Prussia, PA",2024-11-09,"Power user and expert on planning/allocation/merchandising requirements for new tools, projects, and data availability. Required skills & abilities: Proficient in Excel, Retail Math, Strong…","Job types: Full-time
Benefits: Store discount, Paid holidays, Dental insurance, Vision insurance
Job types cc: Full-time",https://www.indeed.com/m/viewjob?jk=e1e8f0af223658e0,IndeedScraperUSAEng_e1e8f0af223658e0,IndeedScraperUSAEng,Data,USA_ENGLISH,$62400 - $93600 yearly,UNKNOWN
NEW,"Sr. Data Analyst (On-site Middletown, NY)",Access-Supports for Living,"Middletown, NY 10940",2024-10-13,"Provides quantitative and qualitative analysis of agency data, including client demographics, utilization, outcomes and adverse incident data. Bachelor’s Degree with course work related to data…","Job types: Full-time
Benefits: Tuition reimbursement
Job types cc: Full-time
Schedules: Monday to Friday",https://www.indeed.com/m/viewjob?jk=b9fdde933bc61730,IndeedScraperUSAEng_b9fdde933bc61730,IndeedScraperUSAEng,Data,USA_ENGLISH,$61360 - $61360 yearly,UNKNOWN
NEW,Data Scientist,Amazee Global Ventures Inc,"Newark, NJ",2024-11-12,"Data Strategy Leadership: Define and implement a comprehensive data strategy, aligning data science initiatives with business objectives through collaboration with key stakeholders.","Job types: Full-time, Contract
Job types cc: Full-time, Contract",https://www.indeed.com/m/viewjob?jk=e7eb1037b88c0b38,IndeedScraperUSAEng_e7eb1037b88c0b38,IndeedScraperUSAEng,Data,USA_ENGLISH,$55 - $60 hourly,UNKNOWN
NEW,Data Analyst,Fora Travel,"New York, NY",2024-11-07,"Help foster Fora's data and experimentation culture by mentoring, training, and improving data literacy across the organization. Familiarity with dimensional data modeling techniques.","Job types: Full-time
Benefits: Commuter assistance, Stock options, Health insurance, Dental insurance, 401(k), Vision insurance, Life insurance
Job types cc: Full-time",https://www.indeed.com/m/viewjob?jk=515609b0ec9c8d65,IndeedScraperUSAEng_515609b0ec9c8d65,IndeedScraperUSAEng,Data,USA_ENGLISH,$85000 - $105000 yearly,UNKNOWN
NEW,Data Manager,DEPT OF ENVIRONMENT PROTECTION,"New York, NY 11222",2024-10-13,"Frequent QAQC of data is needed to ensure all data being sent externally has been verified and thoroughly checked. The selected candidate will also be responsible for data reporting, from annual…","Job types: Full-time
Job types cc: Full-time",https://www.indeed.com/m/viewjob?jk=6c93dd034d5e7a71,IndeedScraperUSAEng_6c93dd034d5e7a71,IndeedScraperUSAEng,Data,USA_ENGLISH,$84468 - $111003 yearly,UNKNOWN
NEW,Data Entry Clerk,NBP Insurance Group,"Woodbury, NY 11797",2024-10-13,"## Responsibilities - Enter data into various computerized systems with speed and accuracy - Perform data collection, data entry, and file maintenance tasks - Organize and maintain files and records…","Job types: Temporary
Shifts: 8 hour shift
Benefits: Health insurance, Dental insurance, 401(k), Paid time off, Vision insurance, Flexible schedule
Job types cc: Temporary, Temp-to-hire
Schedules: 8 hour shift",https://www.indeed.com/m/viewjob?jk=ba6293f7179f671e,IndeedScraperUSAEng_ba6293f7179f671e,IndeedScraperUSAEng,Data,USA_ENGLISH,$20 - $25 hourly,UNKNOWN
NEW,Investigative Data Reporter,New York Public Radio,"New York, NY 10013",2024-10-13,Develop data workflows around key coverage areas that allow the team to quickly publish data-driven stories when news breaks. At least five years experience as a data reporter and working with data…,"Job types: Full-time
Remote: Hybrid work
Benefits: Health insurance, Dental insurance, Work from home, Parental leave, Vision insurance
Job types cc: Full-time",https://www.indeed.com/m/viewjob?jk=b8b9c453723182de,IndeedScraperUSAEng_b8b9c453723182de,IndeedScraperUSAEng,Data,USA_ENGLISH,$90423.21 - $93000 yearly,TEMPORARILY_REMOTE
NEW,Data Reliability Engineer,Excelsior University,"New York, NY",2024-10-30,Implement data governance and ensure data integrity across all BI initiatives. Gaining a thorough understanding of the data maintained in the enterprise data warehouse is mandatory.,"Job types: Full-time
Remote: Remote
Job types cc: Full-time",https://www.indeed.com/m/viewjob?jk=6875fdcbe9c44dc8,IndeedScraperUSAEng_6875fdcbe9c44dc8,IndeedScraperUSAEng,Data,USA_ENGLISH,$100000 - $110000 yearly,FULLY_REMOTE
NEW,Data Analyst,Sureminds Solutions LLC,"Jersey City, NJ",2024-11-08,"Expertise in exploratory data analytics using complex SQL, Excel and other tools. Experience with data querying languages (SQL) and working with large datasets. Expertise in PowerBI, Tableau etc.","Job types: Full-time
Job types cc: Full-time
Schedules: Monday to Friday",https://www.indeed.com/m/viewjob?jk=fcaa1389f28467fe,IndeedScraperUSAEng_fcaa1389f28467fe,IndeedScraperUSAEng,Data,USA_ENGLISH,$125000 - $135000 yearly,UNKNOWN
NEW,Data Warehouse Developer,Temple University Health System,"Philadelphia, PA",2024-10-13,"1 Years experience in data warehousing, data marts, data management or related field (Required). Works to increase the usage and value of the data warehouse and ensures the integrity of the data…","Job types: Full-time
Shifts: Day shift
Job types cc: Full-time
Schedules: Day shift",https://www.indeed.com/m/viewjob?jk=198b4eaa9baf1d55,IndeedScraperUSAEng_198b4eaa9baf1d55,IndeedScraperUSAEng,Data,USA_ENGLISH,,UNKNOWN
NEW,Data Scientist – Global Finance,Johnson & Johnson,"New Brunswick, NJ",2024-10-22,"Develop data science solutions: Business problem understanding, data processing, algorithms to discover trends & patterns, data visualization, generation of key insights and communication to senior…","Job types: Full-time
Benefits: Paid holidays, Disability insurance, Health insurance, Dental insurance, Vision insurance, Life insurance
Job types cc: Full-time
Schedules: Holidays",https://www.indeed.com/m/viewjob?jk=f4243c9f3324f302,IndeedScraperUSAEng_f4243c9f3324f302,IndeedScraperUSAEng,Data,USA_ENGLISH,$88000 - $142600 yearly,UNKNOWN
NEW,Consultant Business Data Analysis,The Hartford,"Hartford, CT",2024-11-08,"Learn and expand your analysis capabilities such as business process mapping, data analysis, data testing, data wrangling, and data transformation mappings to build data assets that enable business…","Job types: Full-time
Remote: Hybrid work
Job types cc: Full-time",https://www.indeed.com/m/viewjob?jk=9f1fe82556a21fbf,IndeedScraperUSAEng_9f1fe82556a21fbf,IndeedScraperUSAEng,Data,USA_ENGLISH,$77360 - $116040 yearly,TEMPORARILY_REMOTE
NEW,Member of Technical Staff - Data Scientist,Microsoft,"New York, NY",2024-11-05,"Experience building data pipelines to support analytics and experiment scenarios. 1+ years of experience in leveraging complex data, applied data science, developing sophisticated algorithms,…","Job types: Full-time
Remote: Hybrid work
Job types cc: Full-time",https://www.indeed.com/m/viewjob?jk=5249df42f835a1a4,IndeedScraperUSAEng_5249df42f835a1a4,IndeedScraperUSAEng,Data,USA_ENGLISH,$117200 - $294000 yearly,TEMPORARILY_REMOTE
NEW,Data Scientist,Restaurant Depot,"Whitestone, NY 11357",2024-11-01,"Demonstrated ability to take real-world analytics/data science projects from start to finish including data cleaning, descriptive analysis, predictive modelling, and visualizations.","Job types: Full-time
Job types cc: Full-time",https://www.indeed.com/m/viewjob?jk=248fa833e22b6718,IndeedScraperUSAEng_248fa833e22b6718,IndeedScraperUSAEng,Data,USA_ENGLISH,$70000 - $100000 yearly,UNKNOWN
NEW,AI Resident,Normal Computing Corporation,"New York, NY",2024-10-13,Familiarity with data science applications and specific use cases of ML methods. Looking to advance your career in AI? The AI Research Residency program presents an exclusive 6-12 month opportunity to…,"Job types: Full-time
Remote: Remote
Benefits: Health insurance
Job types cc: Full-time",https://www.indeed.com/m/viewjob?jk=1ea7b40f9479a041,IndeedScraperUSAEng_1ea7b40f9479a041,IndeedScraperUSAEng,Data,USA_ENGLISH,$100000 - $100000 yearly,FULLY_REMOTE
NEW,"Senior HIM Data Integrity Specialist - Lake Success, NY",Optum,"Lake Success, NY 11020",2024-10-22,"2+ years of HIM data/chart analysis or identity management experience. Analyze data for errors and works to resolve them, escalating appropriately when necessary. Join us to start Caring.","Job types: Full-time
Benefits: 401(k) matching
Job types cc: Full-time",https://www.indeed.com/m/viewjob?jk=f2dea5bd98a66437,IndeedScraperUSAEng_f2dea5bd98a66437,IndeedScraperUSAEng,Data,USA_ENGLISH,$23.22 - $45.43 hourly,UNKNOWN
NEW,Data Insight & Reporting Analyst,Independence Blue Cross,"Philadelphia, PA 19103",2024-10-13,Translate statistical data into trends and projections of operational and future financial performance. Devise and provide analytical and decision support measurement models to management and business…,,https://www.indeed.com/m/viewjob?jk=e9f53098b9263603,IndeedScraperUSAEng_e9f53098b9263603,IndeedScraperUSAEng,Data,USA_ENGLISH,,UNKNOWN
NEW,Data Analyst,Catholic Charities,"Hartford, CT 06106",2024-10-13,"Use reports and produce data extracts/analysis to support grant making, regulatory reporting, and ad hoc data requests and data dashboards. Ability to prepare and present data to executive level…","Job types: Full-time
Benefits: 403(b) matching, AD&D insurance, Disability insurance, Health insurance, Dental insurance, Paid time off, Employee assistance program, Vision insurance, 403(b), Loan forgiveness
Job types cc: Full-time",https://www.indeed.com/m/viewjob?jk=8485e1a907e51f1f,IndeedScraperUSAEng_8485e1a907e51f1f,IndeedScraperUSAEng,Data,USA_ENGLISH,,UNKNOWN
NEW,Full Time - Data Engineer,SPINO,"New York, NY 10036",2024-11-12,"Solid understanding of data warehousing concepts, ETL processes, and data modeling techniques. Troubleshoot and resolve data-related issues, ensuring data pipelines are running smoothly and…","Job types: Full-time
Shifts: 8 hour shift, Day shift
Benefits: Health insurance, Dental insurance
Job types cc: Full-time
Schedules: 8 hour shift, Day shift, Monday to Friday",https://www.indeed.com/m/viewjob?jk=eda989ede0b983eb,IndeedScraperUSAEng_eda989ede0b983eb,IndeedScraperUSAEng,Data,USA_ENGLISH,$110000 - $115000 yearly,UNKNOWN
NEW,Associate Data Analyst (NY Based),Headway,"New York, NY",2024-11-06,"As our data expert, you will collaborate with the Payer team to understand business requirements, identify relevant metrics, and visualize and interpret data to drive revenue-enhancing SLA performance…","Remote: Remote
Benefits: Work from home stipend, Health savings account, Paid holidays, Health insurance, Dental insurance, 401(k), Flexible spending account, Paid time off, Parental leave, Employee assistance program, Vision insurance",https://www.indeed.com/m/viewjob?jk=aab982297055d222,IndeedScraperUSAEng_aab982297055d222,IndeedScraperUSAEng,Data,USA_ENGLISH,$125000 - $125000 yearly,FULLY_REMOTE
NEW,Senior Data Journalist,Dow Jones,"New York, NY 10176",2024-11-06,Collaborate with journalists to uncover data-driven stories. Familiarity with modern data visualization tools would be helpful. 5+ years of post-graduate experience in data science.,"Benefits: Commuter assistance, Health insurance",https://www.indeed.com/m/viewjob?jk=2dcd65f37d2965ea,IndeedScraperUSAEng_2dcd65f37d2965ea,IndeedScraperUSAEng,Data,USA_ENGLISH,$145000 - $165000 yearly,UNKNOWN
NEW,Python/Spark/SQL Data Egnineer,Zettalogix,"Iselin, NJ 08830",2024-10-13,"Data Analysis, heavy SQL, analyzing existing SQL scripts, connecting to data sources and mapping to new source. Work Authorizations: USC, GCH, GC-EAD.",,https://www.indeed.com/m/viewjob?jk=60f5216cbc47839a,IndeedScraperUSAEng_60f5216cbc47839a,IndeedScraperUSAEng,Data,USA_ENGLISH,,UNKNOWN
NEW,Senior Product Manager - (Data Products),MANTL,"New York, NY",2024-10-29,Lead the strategy and growth of MANTL's data product offerings. You lead efforts to enhance self-service capabilities through data access products. You work closely with engineering to ensure seamless…,"Remote: Remote
Benefits: Health insurance, Unlimited paid time off, Dental insurance, Happy hour, Vision insurance",https://www.indeed.com/m/viewjob?jk=12a51f6b43fbb771,IndeedScraperUSAEng_12a51f6b43fbb771,IndeedScraperUSAEng,Data,USA_ENGLISH,$175000 - $190000 yearly,FULLY_REMOTE
NEW,Data Analyst,SDG Group,"Bedminster, NJ 07921",2024-10-13,"Some knowledge of BI technologies, data modeling, data management. Development of data transformation processes. Data structure analysis and data model design. About The Data Analyst Role.","Job types: Full-time
Remote: Hybrid work
Benefits: Paid holidays, Disability insurance, Health insurance, Dental insurance, Vision insurance, 401(k) matching, Flexible schedule
Job types cc: Full-time",https://www.indeed.com/m/viewjob?jk=a345ec817e36eb56,IndeedScraperUSAEng_a345ec817e36eb56,IndeedScraperUSAEng,Data,USA_ENGLISH,,TEMPORARILY_REMOTE
NEW,Data Engineer III,Children’s Hospital of Philadelphia,"Philadelphia, PA 19104",2024-11-08,"Execute data engineering projects from inception to completion, utilizing real-time streaming data platforms and cloud services for efficient data extraction and ingestion, performing code development…","Job types: Full-time
Shifts: Day shift
Job types cc: Full-time
Schedules: Day shift",https://www.indeed.com/m/viewjob?jk=9a14f0e2df89f98f,IndeedScraperUSAEng_9a14f0e2df89f98f,IndeedScraperUSAEng,Data,USA_ENGLISH,,UNKNOWN
NEW,Data Scientist II - Retail,Burlington Stores,"Edgewater Park, NJ 08010",2024-11-10,Experience in writing SQL code to access data from the data warehouse. Able to understand various data structures and common methods in data transformation. 5+ years Information Technology experience.,"Job types: Full-time
Remote: Hybrid work
Benefits: Paid holidays, Disability insurance, Health insurance, Dental insurance, 401(k), Paid time off, Vision insurance, Flexible schedule
Job types cc: Full-time",https://www.indeed.com/m/viewjob?jk=55ba65eadd7b0b52,IndeedScraperUSAEng_55ba65eadd7b0b52,IndeedScraperUSAEng,Data,USA_ENGLISH,$115000 - $150000 yearly,TEMPORARILY_REMOTE
NEW,Central Office Data Clerk,"Beacon of Hope, Catholic Charities Community Services of New York","New York, NY 10022",2024-11-01,The Data Clerk’s primary responsibilities include the preparation of finance related materials and assistance with Central Office reception. The Data Clerk also provides office support to the BOH…,"Job types: Full-time
Job types cc: Full-time",https://www.indeed.com/m/viewjob?jk=83cac09fa580f327,IndeedScraperUSAEng_83cac09fa580f327,IndeedScraperUSAEng,Data,USA_ENGLISH,$22.5 - $24.5 hourly,UNKNOWN
NEW,Data Engineer,Canyon Associates,"Bridgewater, NJ 08807",2024-10-29,"Minimum 5 years a a data engineer, ETL/ELT. Continuous experience in Python and Airflow. Snowflake/Star-Schema/Azure/AWS.","Job types: Full-time
Shifts: 8 hour shift
Remote: Hybrid work
Benefits: Health insurance, Dental insurance, 401(k)
Job types cc: Full-time
Schedules: 8 hour shift",https://www.indeed.com/m/viewjob?jk=6a7c1af8956820fb,IndeedScraperUSAEng_6a7c1af8956820fb,IndeedScraperUSAEng,Data,USA_ENGLISH,$100000 - $130000 yearly,TEMPORARILY_REMOTE
NEW,Data Modeler,NTT DATA,"New York, NY 10261",2024-10-13,"Work with business and application/solution teams to implement data strategies, build data flows, and develop conceptual/logical/physical data models Define and govern data modeling and design…","Job types: Full-time
Benefits: Health savings account, AD&D insurance, Disability insurance, Health insurance, Dental insurance, Paid time off, Vision insurance, 401(k) matching
Job types cc: Full-time",https://www.indeed.com/m/viewjob?jk=34a9fa667c97f23a,IndeedScraperUSAEng_34a9fa667c97f23a,IndeedScraperUSAEng,Data,USA_ENGLISH,$50 - $80 hourly,UNKNOWN
NEW,"Sales Manager, OEM - Data Partnerships",Similarweb,"New York, NY 10016",2024-10-16,Join us as we continue to disrupt the industry and drive the growth of our data licensing business. Uncover New Opportunities: Identify untapped use cases and expand the knowledge of Similarweb's…,"Benefits: Employee stock purchase plan, Health insurance, Dental insurance, 401(k), Happy hour, Parental leave, Vision insurance",https://www.indeed.com/m/viewjob?jk=b269f73b8facd23c,IndeedScraperUSAEng_b269f73b8facd23c,IndeedScraperUSAEng,Data,USA_ENGLISH,$75400 - $147950 yearly,UNKNOWN
NEW,Community Coordinator - Data Support Coordinator Adult Education Programs [P#011933A],New York City Department of Education,"Brooklyn, NY 11201",2024-10-23,Closely work with central data team directors to ensure proper collection and management of data. Closely work with central data team directors to ensure proper collection and management of data.,"Schedules: Weekends as needed, Evenings as needed",https://www.indeed.com/m/viewjob?jk=513ce2d3772c6187,IndeedScraperUSAEng_513ce2d3772c6187,IndeedScraperUSAEng,Data,USA_ENGLISH,$60733 - $94279 yearly,UNKNOWN
NEW,Pharmacy Data Analyst,MJHS,"New York, NY 10040",2024-10-13,"Computer literate, including Windows, Excel, Word, Visio, and data base programs required. 1-3 years of experience in analyzing pharmacy claims data to identify trends and summarize outcomes,…","Job types: Full-time
Job types cc: Full-time",https://www.indeed.com/m/viewjob?jk=f042a3d61df80d90,IndeedScraperUSAEng_f042a3d61df80d90,IndeedScraperUSAEng,Data,USA_ENGLISH,$77099.34 - $92519.21 yearly,UNKNOWN
NEW,"Data Analyst, Credit Risk",current,"New York, NY 10011",2024-10-13,"Drive data modeling requirements for analytics and data engineers. Detailed knowledge of credit bureau data, bank statement transaction data, or alternative credit data providers.","Benefits: Commuter assistance, Stock options, Paid holidays, Health insurance, Dental insurance, 401(k), Flexible spending account, Parental leave, Snacks provided, Employee assistance program, Vision insurance",https://www.indeed.com/m/viewjob?jk=a845e11f2a610f68,IndeedScraperUSAEng_a845e11f2a610f68,IndeedScraperUSAEng,Data,USA_ENGLISH,$130000 - $175000 yearly,UNKNOWN
NEW,Data Entry Specialist,Carvana,"Bronx, NY",2024-11-12,"1+ years of work experience in an administrative or data entry capacity. Input, cross-reference, and retrieve data from multiple internal and external databases.","Job types: Full-time
Shifts: 8 hour shift
Benefits: Wellness program, Employee stock purchase plan, Paid holidays, Loan repayment program, Dental insurance, Tuition reimbursement, Paid time off, Vision insurance, 401(k) matching
Job types cc: Full-time
Schedules: 4x10, 8 hour shift, Overtime, 5x8, Monday to Friday, Holidays",https://www.indeed.com/m/viewjob?jk=270087684bf123b4,IndeedScraperUSAEng_270087684bf123b4,IndeedScraperUSAEng,Data,USA_ENGLISH,$19 - $-1 hourly,UNKNOWN
NEW,Reporting Analyst,MAYORS OFFICE OF CONTRACT SVCS,"Manhattan, NY 10007",2024-10-13,"Understanding of data governance frameworks. Manage implementation and expansion of Power BI portfolio, collaborating with data engineering to define data integration with the Power BI platform.","Job types: Full-time
Benefits: Loan forgiveness
Job types cc: Full-time",https://www.indeed.com/m/viewjob?jk=92db928e34828511,IndeedScraperUSAEng_92db928e34828511,IndeedScraperUSAEng,Data,USA_ENGLISH,$80000 - $90000 yearly,UNKNOWN
NEW,"Data Specialist, Clinical Research",Simons Foundation,"New York, NY 10010",2024-10-13,"Experience aggregating EHR, clinical EEG and/or MRI data or digital data preferred. Contribute to data quality/cleaning and release efforts for all SFARI cohorts and other clinical data sets.","Job types: Full-time
Job types cc: Full-time",https://www.indeed.com/m/viewjob?jk=bf9c4b7aba7b2796,IndeedScraperUSAEng_bf9c4b7aba7b2796,IndeedScraperUSAEng,Data,USA_ENGLISH,$77000 - $85000 yearly,UNKNOWN
NEW,Data Scientist,Innovative Defense Technologies (IDT),"Mount Laurel, NJ 08054",2024-10-13,"3+ years of experience in predictive modeling, data science and analysis. Knowledge of data and information visualization principles and experience using related tools.","Job types: Full-time
Job types cc: Full-time",https://www.indeed.com/m/viewjob?jk=3bccbf91ecb46847,IndeedScraperUSAEng_3bccbf91ecb46847,IndeedScraperUSAEng,Data,USA_ENGLISH,,UNKNOWN
NEW,"Director, Data Centers & Facilities Lead, Infra Engineering",The Estée Lauder Companies,"Long Island City, NY",2024-10-13,Oversee the daily operations of data center facilities. Plan and implement data center expansions or modifications. Develop and manage the data center's budget. Track and control operational expenses.,"Job types: Full-time
Shifts: Day shift
Benefits: Paid holidays, Disability insurance, Health insurance, Retirement plan
Job types cc: Full-time
Schedules: Day shift, On call",https://www.indeed.com/m/viewjob?jk=37e5da2b4b8ca244,IndeedScraperUSAEng_37e5da2b4b8ca244,IndeedScraperUSAEng,Data,USA_ENGLISH,$137000 - $228000 yearly,UNKNOWN
NEW,Banking Domain Data Quality Analyst,Mizuho Americas,"New York, NY",2024-10-13,"The successful candidate will be responsible for ensuring the quality and integrity of banking-related data, investigating authoritative sourcing of data, conducting data analysis to support risk…","Job types: Full-time
Remote: Hybrid work
Job types cc: Full-time",https://www.indeed.com/m/viewjob?jk=d2f2c2af74a20c2e,IndeedScraperUSAEng_d2f2c2af74a20c2e,IndeedScraperUSAEng,Data,USA_ENGLISH,$77000 - $135000 yearly,TEMPORARILY_REMOTE
NEW,Data Equity Analyst,The Fund for Public Health in New York City,"New York, NY",2024-11-05,"Perform data conversions including extracting data from non-Epic EHR systems, performing transformations upon the data, and importing it into Epic. Conduct data quality assurance activities throughout…","Job types: Full-time
Benefits: Commuter assistance, Health insurance, Dental insurance, Paid time off, Work from home, Life insurance, Retirement plan
Job types cc: Full-time
Schedules: Year round work, Monday to Friday",https://www.indeed.com/m/viewjob?jk=940a55a529293dc7,IndeedScraperUSAEng_940a55a529293dc7,IndeedScraperUSAEng,Data,USA_ENGLISH,$70000 - $75000 yearly,UNKNOWN
NEW,Staff Data Scientist,Integral Ad Science,"New York, NY",2024-10-13,"Comfort manipulating and analyzing complex, high-volume, high-dimensionality data from varying sources. IAS's software provides comprehensive and enriched data that ensures ads are seen by real people…",Remote: Hybrid work,https://www.indeed.com/m/viewjob?jk=84a618e2ed4bc614,IndeedScraperUSAEng_84a618e2ed4bc614,IndeedScraperUSAEng,Data,USA_ENGLISH,$135100 - $231600 yearly,TEMPORARILY_REMOTE
