status,title,company,location,date,blurb,tags,link,id,provider,query,locale,wage,remotenessNEW,Data Analyst (NY),Excellence Community Schools,"Bronx, NY 10462",2024-10-13,"Acquire data from primary or secondary data sources and maintain databases/data systems. Technical expertise regarding data models, data mining, and segmentation techniques.","Job types: Full-time
Benefits: Dental insurance, Vision insurance, 403(b)
Job types cc: Full-time",https://www.indeed.com/m/viewjob?jk=9f3127aa0977e653,IndeedScraperUSAEng_9f3127aa0977e653,IndeedScraperUSAEng,Data,USA_ENGLISH,$50000 - $70000 yearly,UNKNOWN
NEW,Data Engineer,Kustomer,"New York, NY",2024-10-13,"This role requires a deep understanding of both the technical and strategic aspects of big data solutions, including data modeling, data warehousing, and data integration.","Job types: Full-time
Benefits: Stock options, Health insurance, 401(k), Cell phone reimbursement
Job types cc: Full-time
Schedules: On call",https://www.indeed.com/m/viewjob?jk=a2c255265df719c1,IndeedScraperUSAEng_a2c255265df719c1,IndeedScraperUSAEng,Data,USA_ENGLISH,$140000 - $185000 yearly,UNKNOWN
NEW,Data Analyst,Exertis | JAM,"Philadelphia, PA",2024-10-13,"Collaborate with other data professionals as required. 3+ years of experience in a data analysis role is typically necessary, with a focus on data cleaning, modeling, and interpretation.",Schedules: Monday to Friday,https://www.indeed.com/m/viewjob?jk=d65ae90130ae031b,IndeedScraperUSAEng_d65ae90130ae031b,IndeedScraperUSAEng,Data,USA_ENGLISH,,UNKNOWN
NEW,Finance Data Analyst,Cushman & Wakefield,"New York, NY 10019",2024-10-15,"Analyze financial data, variances, forecasts and track financial data for history and planning purposes. Ensure that the relevant MCF financial data is available for senior management inquiries.","Job types: Full-time
Benefits: Health savings account, Disability insurance, Dental insurance, Flexible spending account, Vision insurance, Retirement plan
Job types cc: Full-time",https://www.indeed.com/m/viewjob?jk=20bb9131514c10e1,IndeedScraperUSAEng_20bb9131514c10e1,IndeedScraperUSAEng,Data,USA_ENGLISH,$76500 - $90000 yearly,UNKNOWN
NEW,Data and Systems Analyst,HCSC,"Bethlehem, PA 18017",2024-10-31,"Ensure data integrity and accuracy across integrated systems. Monitor and troubleshoot data integration issues, implementing solutions as needed. Collaborate with stakeholders to understand their data…","Job types: Full-time
Benefits: Health insurance, Employee assistance program, Employee discount, Gym membership, Life insurance, Retirement plan
Job types cc: Full-time
Schedules: On call",https://www.indeed.com/m/viewjob?jk=4336a22e48195e18,IndeedScraperUSAEng_4336a22e48195e18,IndeedScraperUSAEng,Data,USA_ENGLISH,$52000 - $55000 yearly,UNKNOWN
NEW,Senior Data Analyst,Intone Networks,"Woodbridge, NJ",2024-10-24,"Title: Senior Data Analyst Location: Woodbridge, NJ. This is a 6+month contract to hire and onsite 4 days per week.(local DL…","Job types: Contract
Job types cc: Contract",https://www.indeed.com/m/viewjob?jk=af62747b7a5aac93,IndeedScraperUSAEng_af62747b7a5aac93,IndeedScraperUSAEng,Data,USA_ENGLISH,,UNKNOWN
NEW,"Director, Data Operations",GLG,"New York, NY",2024-10-24,GLG's Core Engineering team builds the technology eco-system that enables effective and efficient operations for the company globally. Our team of engineers are laser focused on deploying technology…,,https://www.indeed.com/m/viewjob?jk=c20e41bd34c48b26,IndeedScraperUSAEng_c20e41bd34c48b26,IndeedScraperUSAEng,Data,USA_ENGLISH,$118000 - $180000 yearly,UNKNOWN
NEW,EMR Data Analyst,Southern Jersey Family Medical Centers,"Marlton, NJ 08053",2024-10-13,Knowledge of healthcare operations and data structures and the use of information system applications in the practicing healthcare environment preferred. Bachelor's degree in a related field.,"Job types: Full-time
Benefits: Paid holidays, Health insurance, Dental insurance, Tuition reimbursement, Paid time off, 403(b), Life insurance
Job types cc: Full-time",https://www.indeed.com/m/viewjob?jk=dbc798385549f01f,IndeedScraperUSAEng_dbc798385549f01f,IndeedScraperUSAEng,Data,USA_ENGLISH,,UNKNOWN
NEW,Sales Data Analyst,Practising Law Institute,"New York, NY",2024-10-25,"Using PLI's systems and resources performs high level research and data analysis to uncover opportunities and drive the business. Work in a collaborative environment with a diverse, employee community…","Remote: Hybrid work
Benefits: Paid holidays, Health insurance, Dental insurance, Paid time off, Vision insurance, Gym membership",https://www.indeed.com/m/viewjob?jk=a195b2d489be909d,IndeedScraperUSAEng_a195b2d489be909d,IndeedScraperUSAEng,Data,USA_ENGLISH,$68000 - $83000 yearly,TEMPORARILY_REMOTE
NEW,CLINICAL DATA ANALYST,Zenith LifeScience,"South Plainfield, NJ",2024-10-13,"Coordinate CRO (Clinical Research Organization) data validation activities (coordinate data transfer specs, data reconciliation, query generation and resolution).","Job types: Full-time
Job types cc: Full-time",https://www.indeed.com/m/viewjob?jk=5b4fd2315354b0c3,IndeedScraperUSAEng_5b4fd2315354b0c3,IndeedScraperUSAEng,Data,USA_ENGLISH,$80000 - $100000 yearly,UNKNOWN
NEW,Data Production Engineer,Hudson River Trading,"New York, NY",2024-10-13,"Identify and develop new processes within the data request process to enrich data. Onboard datasets, explore data, and automate tasks using a modern Python data stack.",,https://www.indeed.com/m/viewjob?jk=3279cf963e13c04e,IndeedScraperUSAEng_3279cf963e13c04e,IndeedScraperUSAEng,Data,USA_ENGLISH,$150000 - $200000 yearly,UNKNOWN
NEW,Nurse Data Manager Ex,"Jefferson - Center City, Philadelphia, PA","Philadelphia, PA 19106",2024-10-13,PRIMARY FUNCTION: This position is responsible for performing clinical audits of detailed patient records with an emphasis on the accuracy of charges posted to meet billing compliance requirements.,"Job types: Full-time
Remote: Remote
Job types cc: Full-time
Schedules: No weekends, Weekends & holidays off",https://www.indeed.com/m/viewjob?jk=7b134e5ef55715c7,IndeedScraperUSAEng_7b134e5ef55715c7,IndeedScraperUSAEng,Data,USA_ENGLISH,,FULLY_REMOTE
NEW,Senior Product Data Scientist,Propel,"Brooklyn, NY",2024-10-13,"Maintain reliable data pipelines to ensure trustworthy data. Exceptional skills at converting questions into data analysis and insight, with just the right level of complexity.","Remote: Remote
Benefits: Health insurance, Dental insurance, Paid time off, 401(k) 4% Match, Vision insurance, 401(k) matching",https://www.indeed.com/m/viewjob?jk=daadb01a15d09ba4,IndeedScraperUSAEng_daadb01a15d09ba4,IndeedScraperUSAEng,Data,USA_ENGLISH,$165000 - $200000 yearly,FULLY_REMOTE
NEW,Data Protection Incident Responder - USDS - NY,TikTok,"New York, NY",2024-11-08,"This role requires the ability to work with and support systems designed to protect sensitive data and information. This position requires the ability to work well under pressure, act quickly, bring…","Remote: Hybrid work
Benefits: Paid parental leave, Health savings account, AD&D insurance, Paid holidays, Disability insurance, Health insurance, Dental insurance, Flexible spending account, RSU, Paid time off, Parental leave, Employee assistance program, Vision insurance, 401(k) matching, Paid sick time",https://www.indeed.com/m/viewjob?jk=8250cf9e4c3d2abe,IndeedScraperUSAEng_8250cf9e4c3d2abe,IndeedScraperUSAEng,Data,USA_ENGLISH,$118800 - $196000 yearly,TEMPORARILY_REMOTE
NEW,Data valuation,CENTSTONE SERVICES LLC,"New York, NY 11226",2024-10-13,"Lead and manage valuation projects for financial reporting, tax compliance, M&A, and strategic planning. Develop and review financial models (DCF, OPM, market multiples) and prepare detailed valuation…","Job types: Full-time
Benefits: Health insurance, Paid time off, Flexible schedule, Life insurance
Job types cc: Full-time",https://www.indeed.com/m/viewjob?jk=90c3c63025616ca4,IndeedScraperUSAEng_90c3c63025616ca4,IndeedScraperUSAEng,Data,USA_ENGLISH,$92771.74 - $111725.11 yearly,UNKNOWN
NEW,"Manager, Data and Process Analytics","AMERCAREROYAL, LLC","Exton, PA 19341",2024-11-02,"Strong understanding of relational database and data warehouse related concepts. The Data and Process Analytics Manager oversees the reporting, data analytics and automation practices at ACR.","Job types: Full-time
Benefits: Health insurance, Paid time off
Job types cc: Full-time",https://www.indeed.com/m/viewjob?jk=16ea75b131f50321,IndeedScraperUSAEng_16ea75b131f50321,IndeedScraperUSAEng,Data,USA_ENGLISH,$130000 - $150000 yearly,UNKNOWN
NEW,DATA RESEARCH SPECIALIST,HRA/DEPT OF SOCIAL SERVICES,"Manhattan, NY 10038",2024-10-13,"Maintain consistency and integrity of data collection, and report concerns regarding data integrity to the Assistant Director. Provide analytical support to the DART Management, AO and IREA in the…","Job types: Full-time
Job types cc: Full-time
Schedules: Monday to Friday",https://www.indeed.com/m/viewjob?jk=f0358983ed3f1bfe,IndeedScraperUSAEng_f0358983ed3f1bfe,IndeedScraperUSAEng,Data,USA_ENGLISH,$82506 - $94882 yearly,UNKNOWN
NEW,DATA AND SYSTEMS ANALYST,DEPT. OF HOMELESS SERVICES,"Manhattan, NY",2024-10-13,"Analyze the development and use of data and systems, ensuring effective data management, secure procedures, and data analysis. Analyze large amounts of project and financial data to accurately and…","Job types: Full-time
Benefits: Loan forgiveness
Job types cc: Full-time
Schedules: Monday to Friday",https://www.indeed.com/m/viewjob?jk=6321bf87e862c306,IndeedScraperUSAEng_6321bf87e862c306,IndeedScraperUSAEng,Data,USA_ENGLISH,$77158 - $95000 yearly,UNKNOWN
NEW,Data Entry Associate,Mavis Tire Supply,"White Plains, NY 10603",2024-11-07,"Data Entry Associate Put your career into high gear with Mavis Discount Tire! We're looking for a full-time Data Entry Associate to join Team Mavis at our offices in White Plains, NY. Mavis is one…","Job types: Full-time
Benefits: Paid holidays, Health insurance, Dental insurance, On-the-job training, 401(k) matching, Opportunities for advancement
Job types cc: Full-time",https://www.indeed.com/m/viewjob?jk=4832b38846b24399,IndeedScraperUSAEng_4832b38846b24399,IndeedScraperUSAEng,Data,USA_ENGLISH,$16.5 - $18 hourly,UNKNOWN
NEW,Junior Data Analyst with Programming Background for Law Firm,"Lawrence J. Berger, P.C.","New York, NY 10016",2024-11-07,Experience with data retrieval using APIs is a plus. Property Tax Law Firm looking for a data analyst to assist in our property valuation department. This is for an in-office position.,"Job types: Full-time
Shifts: 8 hour shift
Benefits: Health insurance, Paid time off, Retirement plan
Job types cc: Full-time
Schedules: 8 hour shift",https://www.indeed.com/m/viewjob?jk=4986ac00c35fdad6,IndeedScraperUSAEng_4986ac00c35fdad6,IndeedScraperUSAEng,Data,USA_ENGLISH,$45500 - $49500 yearly,UNKNOWN
NEW,"NFP Data Coordinator, Bureau of Maternal Infant and Reproductive Health",DEPT OF HEALTH/MENTAL HYGIENE,"Queens, NY 11221",2024-11-09,"The Division of Family and Child Health (DFCH) of the New York City Department of Health and Mental Hygiene is charged with the creation and oversight of programs, policies, services, and environments…","Job types: Full-time
Benefits: Wellness program, Work from home, Loan forgiveness
Job types cc: Full-time",https://www.indeed.com/m/viewjob?jk=b550eea29e83bf38,IndeedScraperUSAEng_b550eea29e83bf38,IndeedScraperUSAEng,Data,USA_ENGLISH,$51816 - $59588 yearly,UNKNOWN
NEW,Enterprise Risk Management - Risk Data Aggregation and Risk Reporting (RDA) Associate,"Bank of China Limited, New York Branch","New York, NY 10018",2024-10-13,Understand and maintain the data mapping and data model of the centralized risk data repository. Perform data analysis of the databases and systems at the bank to facilitate with implementation of…,"Job types: Full-time
Job types cc: Full-time",https://www.indeed.com/m/viewjob?jk=289b6b84c0b6937c,IndeedScraperUSAEng_289b6b84c0b6937c,IndeedScraperUSAEng,Data,USA_ENGLISH,$42000 - $90000 yearly,UNKNOWN
NEW,Data Engineer,Intone Networks,"Malvern, PA",2024-10-13,"This role involves extracting data from various sources, transforming into usable data formats, and loading into data lake or data warehouse like redshift for analysts and reporting while leveraging…",,https://www.indeed.com/m/viewjob?jk=b22948e94e8c6af0,IndeedScraperUSAEng_b22948e94e8c6af0,IndeedScraperUSAEng,Data,USA_ENGLISH,,UNKNOWN
NEW,Data Scientist (Mid or Senior),Penn Medicine,"Philadelphia, PA 19104",2024-10-22,Demonstrates knowledge of data analysis and data modeling; Understands data governance; can use data to “tell a story” and to support recommendations from leadership group.,"Benefits: Tuition reimbursement
Schedules: Monday to Friday",https://www.indeed.com/m/viewjob?jk=65730954463b5591,IndeedScraperUSAEng_65730954463b5591,IndeedScraperUSAEng,Data,USA_ENGLISH,,UNKNOWN
NEW,Data Visualization Specialist,Eigen X,"King of Prussia, PA 19406",2024-10-13,"The ideal candidate will possess a strong background in data analytics, with a particular emphasis on visualizing data effectively through charts, graphs, and dashboards.",,https://www.indeed.com/m/viewjob?jk=c63423a00320ac17,IndeedScraperUSAEng_c63423a00320ac17,IndeedScraperUSAEng,Data,USA_ENGLISH,,UNKNOWN
NEW,Staff Data Scientist,StubHub,"New York, NY",2024-10-13,"Passionate about working with non-technical stakeholders to understand, anticipate, and deliver on their data needs. Drive growth of junior team members and the data organization through venues such…","Benefits: Health insurance, Dental insurance, 401(k), Vision insurance",https://www.indeed.com/m/viewjob?jk=94ee6596319b8f97,IndeedScraperUSAEng_94ee6596319b8f97,IndeedScraperUSAEng,Data,USA_ENGLISH,$240000 - $350000 yearly,UNKNOWN
NEW,Data Entry Representative,Programs for Parents,"Newark, NJ 07102",2024-10-13,Entering data into internal and external databases. Ability to enter data with high degree of speed and accuracy speed and accuracy. As a Data Entry Representative you will be responsible for entering…,"Job types: Full-time
Job types cc: Full-time",https://www.indeed.com/m/viewjob?jk=81ce109774c5f157,IndeedScraperUSAEng_81ce109774c5f157,IndeedScraperUSAEng,Data,USA_ENGLISH,$37000 - $37000 yearly,UNKNOWN
NEW,WAGE SUBSIDY PROCESSING CLERK,HRA/DEPT OF SOCIAL SERVICES,"Manhattan, NY 10038",2024-10-13,Ensure that required corrective action is taken to correct data-entry errors. Verify the accuracy of data-entered material by comparing turnaround (b and other documents against source documents.,"Job types: Full-time
Benefits: Loan forgiveness
Job types cc: Full-time",https://www.indeed.com/m/viewjob?jk=2b14bfdd1833607a,IndeedScraperUSAEng_2b14bfdd1833607a,IndeedScraperUSAEng,Data,USA_ENGLISH,$39763 - $45728 yearly,UNKNOWN
NEW,Data Analyst,AppLab Systems,"Princeton, NJ",2024-10-13,Acquire data from primary or secondary data sources and conduct detailed analysis to determine misaligned or erroneous data and determining the correct alignment.,,https://www.indeed.com/m/viewjob?jk=46c111e79071571d,IndeedScraperUSAEng_46c111e79071571d,IndeedScraperUSAEng,Data,USA_ENGLISH,$132000 - $135000 yearly,UNKNOWN
NEW,Clinical Data Manager I,Perceptive,"New Haven, CT",2024-10-16,Managing all data management deliverables for assigned studies Ensures the plan for data management is properly executed by: Reviewing data and identifying errors/inconsistencies.,"Job types: Full-time
Benefits: Paid holidays, Disability insurance, Health insurance, Dental insurance, 401(k), Flexible spending account, Paid time off, Vision insurance
Job types cc: Full-time",https://www.indeed.com/m/viewjob?jk=6d2ac9a521f23f92,IndeedScraperUSAEng_6d2ac9a521f23f92,IndeedScraperUSAEng,Data,USA_ENGLISH,,UNKNOWN
NEW,"Product Manager, Ads Platform (Data and API)",Netflix,"New York, NY",2024-10-17,"Technical Acumen: Deep understanding of the advertising data ecosystem, and familiarity with data privacy and governance. Experience: 7+ years of Product Management experience with a proven track…","Job types: Full-time
Benefits: Stock options, Paid holidays, Health insurance, Flexible spending account, Paid time off, 401(k) matching
Job types cc: Full-time",https://www.indeed.com/m/viewjob?jk=4048830df99db0df,IndeedScraperUSAEng_4048830df99db0df,IndeedScraperUSAEng,Data,USA_ENGLISH,$240000 - $725000 yearly,UNKNOWN
NEW,Senior Data Journalist,PEI Group,"New York, NY 10036",2024-10-13,"Using data analytical tools to identify trends and anomalies within the data collection. Training other journalists to advance their skills in data journalism and programming; help develop workflow,…","Job types: Full-time
Benefits: Health insurance, 401(k), Paid time off, Employee assistance program, 401(k) matching, Prescription drug insurance
Job types cc: Full-time",https://www.indeed.com/m/viewjob?jk=6fce1d43e52ffadb,IndeedScraperUSAEng_6fce1d43e52ffadb,IndeedScraperUSAEng,Data,USA_ENGLISH,$100000 - $120000 yearly,UNKNOWN
NEW,Data Analyst,NYC HOUSING AUTHORITY,"Manhattan, NY",2024-11-09,"Perform regular data reviews to ensure accuracy and completeness of data. The Data Analyst will make the department’s data more organized, accessible, and understandable, and will deliver the data in…","Job types: Full-time
Benefits: Loan forgiveness
Job types cc: Full-time",https://www.indeed.com/m/viewjob?jk=cb5c5f7e53efd8ae,IndeedScraperUSAEng_cb5c5f7e53efd8ae,IndeedScraperUSAEng,Data,USA_ENGLISH,$59503 - $82184 yearly,UNKNOWN
NEW,Data Analyst,Public Health Solutions,"New York, NY 10013",2024-11-09,"Support teams with data management, data cleaning, data analysis, and data visualization in order to carry out day-to-day monitoring and quality improvement. Be a compelling data storyteller.","Job types: Full-time
Benefits: 403(b) matching, Commuter assistance, Paid holidays, Disability insurance, Health insurance, Dental insurance, Flexible spending account, Paid time off, Vision insurance, 403(b), Life insurance
Job types cc: Full-time
Schedules: Monday to Friday",https://www.indeed.com/m/viewjob?jk=085b81373d02f79f,IndeedScraperUSAEng_085b81373d02f79f,IndeedScraperUSAEng,Data,USA_ENGLISH,$70000 - $70000 yearly,UNKNOWN
NEW,"Educator, Data Scientist",BrainStation,"New York, NY",2024-10-13,"Practical experience designing and applying data science processes to conduct experiments using a variety of tools and methods, and can speak to their complexities in a simple and logical manner.","Benefits: Health insurance, Work from home, Parental leave, Flexible schedule",https://www.indeed.com/m/viewjob?jk=3d52906eadb7ea78,IndeedScraperUSAEng_3d52906eadb7ea78,IndeedScraperUSAEng,Data,USA_ENGLISH,$90000 - $120000 yearly,UNKNOWN
NEW,Senior Data Scientist,Amazee Global Ventures Inc,"Florida, NY",2024-10-28,"Experience solving analytics problems in the healthcare domain using clinical data. Experience using natural language processing (NLP), including large language models (LLMs), to extract insights from…","Job types: Full-time, Contract
Job types cc: Full-time, Contract",https://www.indeed.com/m/viewjob?jk=6af65c4b695777f9,IndeedScraperUSAEng_6af65c4b695777f9,IndeedScraperUSAEng,Data,USA_ENGLISH,$55 - $60 hourly,UNKNOWN
NEW,Data Scientist - Marketing Analytics and Reporting,Aveva,"Philadelphia, PA",2024-10-13,Collaborate with data engineers and data architects to ensure seamless integration of data sources into the CDP. Utilize data science methodologies to analyze and extract insights from customer data…,"Job types: Full-time
Benefits: Paid parental leave, Health insurance, Flexible spending account, Tuition reimbursement, Paid time off, Parental leave, 401(k) 6% Match, 401(k) matching, Gym membership
Job types cc: Full-time",https://www.indeed.com/m/viewjob?jk=d0c1e8da97fa3645,IndeedScraperUSAEng_d0c1e8da97fa3645,IndeedScraperUSAEng,Data,USA_ENGLISH,$97100 - $161900 yearly,UNKNOWN
NEW,Data Scientist I - Hybrid,Radian,"New York, NY 10016",2024-10-13,"Knowledge of SAS, R, C++ or python for data analysis and modeling. The Data Scientist I, Mortgage Insurance and Risk Services (MIRS) primary functions will be data modeling and analysis, analytical…","Job types: Full-time
Benefits: Health savings account, Employee stock purchase plan, Paid holidays, Health insurance, Dental insurance, 401(k), Flexible spending account, Paid time off, Parental leave, Vision insurance, 401(k) matching, Life insurance
Job types cc: Full-time",https://www.indeed.com/m/viewjob?jk=b1b4daa5454ed16e,IndeedScraperUSAEng_b1b4daa5454ed16e,IndeedScraperUSAEng,Data,USA_ENGLISH,$78700 - $112400 yearly,UNKNOWN
NEW,Research Data Associate - Neurosurgery,NYU Langone,"New York, NY 10016",2024-11-08,"NYU Grossman School of Medicine is one of the nation's top-ranked medical schools. For 175 years, NYU Grossman School of Medicine has trained thousands of physicians and scientists who have helped…","Job types: Full-time
Job types cc: Full-time",https://www.indeed.com/m/viewjob?jk=6f48ce2f2fe91826,IndeedScraperUSAEng_6f48ce2f2fe91826,IndeedScraperUSAEng,Data,USA_ENGLISH,$51243.96 - $55120 yearly,UNKNOWN
NEW,Clinical Database Programmer Analyst - Center for Biostatistics,Mount Sinai,"New York, NY 10029",2024-10-15,Hands on experience with development of research data capture system (REDCap preferred) and data management. Maintain documentation and data quality management guidelines.,,https://www.indeed.com/m/viewjob?jk=ca4b0425b7a4bf26,IndeedScraperUSAEng_ca4b0425b7a4bf26,IndeedScraperUSAEng,Data,USA_ENGLISH,$67500 - $101640 yearly,UNKNOWN
NEW,"Data Scientist, Ads Sales Analytics",Apple,"New York, NY",2024-11-08,"Drive the generation of insights and identify trends from large, complex data in support of our global sales organization - Support the rollout of sales strategies by building foundational data sets…","Benefits: Employee stock purchase plan, Health insurance, Dental insurance, RSU, Retirement plan",https://www.indeed.com/m/viewjob?jk=25b7b6548432ce87,IndeedScraperUSAEng_25b7b6548432ce87,IndeedScraperUSAEng,Data,USA_ENGLISH,$136300 - $248700 yearly,UNKNOWN
NEW,Data Analytics Manager,Kiss Products,"Port Washington, NY",2024-11-09,"Data Governance: Implement best practices for data governance, data quality, and data security to ensure the accuracy and reliability of all analytics outputs. Paid Time Off (PTO) based on seniority.","Job types: Full-time
Benefits: Paid holidays, Health insurance, 401(k), Paid time off, Employee discount, Referral program
Job types cc: Full-time",https://www.indeed.com/m/viewjob?jk=57f793cb506f6ac6,IndeedScraperUSAEng_57f793cb506f6ac6,IndeedScraperUSAEng,Data,USA_ENGLISH,$69000 - $137000 yearly,UNKNOWN
NEW,Data Manager,New York County District Attorney's Office,"New York, NY",2024-10-13,"Map new data sets and sources into predefined data model or develop new data models as needed, while maintaining data integrity. Experience with data management tools such as data cataloging tools,…","Job types: Full-time
Benefits: Loan forgiveness
Job types cc: Full-time
Schedules: Monday to Friday",https://www.indeed.com/m/viewjob?jk=5197a5da951b7db7,IndeedScraperUSAEng_5197a5da951b7db7,IndeedScraperUSAEng,Data,USA_ENGLISH,$71920 - $71920 yearly,UNKNOWN
NEW,Litigation Support Data Analyst,The Reliable Companies,"Philadelphia, PA 19103",2024-10-13,"Handle complex ESI collections, data processing and transfer, database setup, and attorney review. Reliable’s customers gain the benefit of our single-source expertise in electronic discovery,…",,https://www.indeed.com/m/viewjob?jk=08ee4f92bd53fcde,IndeedScraperUSAEng_08ee4f92bd53fcde,IndeedScraperUSAEng,Data,USA_ENGLISH,,UNKNOWN
NEW,Data Engineer,Dashlane,"New York, NY 10010",2024-10-13,"You have experience administrating, ingesting, and monitoring data in data warehouses such as Amazon Redshift. You have 5+ years of experience as a data engineer, analytics engineer, or in a data…",Remote: Hybrid work,https://www.indeed.com/m/viewjob?jk=84caf08509007ce6,IndeedScraperUSAEng_84caf08509007ce6,IndeedScraperUSAEng,Data,USA_ENGLISH,$120000 - $145000 yearly,TEMPORARILY_REMOTE
NEW,"Analyst, ESG Data",Revlon Consumer Products LLC,"New York, NY 10041",2024-10-13,Ensuring integrity of data and data collection streams. 3+ years of experience with sustainability related data and reporting. Engaging with cross-functional teams and external partners around…,"Job types: Full-time
Benefits: Paid holidays, Disability insurance, Health insurance, Dental insurance, Flexible spending account, Vision insurance, Life insurance
Job types cc: Full-time",https://www.indeed.com/m/viewjob?jk=ef090aa94f70316e,IndeedScraperUSAEng_ef090aa94f70316e,IndeedScraperUSAEng,Data,USA_ENGLISH,$70000 - $80000 yearly,UNKNOWN
NEW,Sr. Data Analyst,Zen & Art,"New York, NY 11226",2024-10-13,"You will work closely with business partners, data engineers, and software developers to identify data needs, develop data models, and create insightful reports and dashboards using Power BI.","Job types: Contract
Shifts: 8 hour shift
Remote: Hybrid work
Job types cc: Contract
Schedules: 8 hour shift",https://www.indeed.com/m/viewjob?jk=6606786bc4b31d9c,IndeedScraperUSAEng_6606786bc4b31d9c,IndeedScraperUSAEng,Data,USA_ENGLISH,$66.09 - $90.73 hourly,TEMPORARILY_REMOTE
NEW,Data Quality Engineer,Princeton IT Services,"Princeton, NJ 08540",2024-10-14,"Strong understanding of data management principles, data governance, and data stewardship. Utilize data quality tools such as Atacama and Collibra for data profiling, validation, and governance.","Job types: Full-time, Contract
Benefits: Health insurance, Dental insurance, 401(k)
Job types cc: Full-time, Contract",https://www.indeed.com/m/viewjob?jk=8ee3c7d2c882a8ce,IndeedScraperUSAEng_8ee3c7d2c882a8ce,IndeedScraperUSAEng,Data,USA_ENGLISH,$45 - $50 hourly,UNKNOWN
