status,title,company,location,date,blurb,tags,link,id,provider,query,locale,wage,remotenessNEW,Senior Software Engineer - Query Compiler,Snowflake,"San Mateo, CA",2024-10-24,Highly-scalable and reliable data processing platform that runs on hundreds and thousands of machines. Every Snowflake employee is expected to follow the company’s confidentiality and security…,"Job types: Full-time
Job types cc: Full-time",https://www.indeed.com/m/viewjob?jk=dd22561443ff69a8,IndeedScraperUSAEng_dd22561443ff69a8,IndeedScraperUSAEng,Data,USA_ENGLISH,,UNKNOWN
NEW,"Software Developer, AI Frameworks & Readiness Team",Oracle,"San Francisco, CA 94111",2024-10-03,"Design, develop, troubleshoot and debug. Artificial Intelligence (AI) Frameworks & Customer Readiness team identifies developer and operation friction areas with OCI's GPU adoption by incubating and…","Job types: Full-time
Job types cc: Full-time",https://www.indeed.com/m/viewjob?jk=b1732d86946cf065,IndeedScraperUSAEng_b1732d86946cf065,IndeedScraperUSAEng,Data,USA_ENGLISH,,UNKNOWN
NEW,"Lead Applied Scientist, IR/NLP",Thomson Reuters,"San Francisco, CA 94111",2024-10-03,"Develop in-depth knowledge of customer problems and data. Thomson Reuters Labs in the USA is seeking scientists with a passion for solving problems using state-of-the-art information retrieval,…","Job types: Full-time
Remote: Remote
Benefits: Commuter assistance, Health savings account, AD&D insurance, Employee stock purchase plan, Paid holidays, Disability insurance, Dental insurance, Tuition reimbursement, Paid time off, Parental leave, Employee assistance program, Vision insurance, 401(k) matching, Gym membership, Life insurance
Job types cc: Full-time",https://www.indeed.com/m/viewjob?jk=95bd91bcb18099a7,IndeedScraperUSAEng_95bd91bcb18099a7,IndeedScraperUSAEng,Data,USA_ENGLISH,$137900 - $281700 yearly,FULLY_REMOTE
NEW,"Sr. GTM Specialist, GenAI, AI/ML, Healthcare Life Sciences","Amazon Web Services, Inc.","San Francisco, CA",2024-10-03,"- Bachelor's degree or equivalent in chemistry, biology, physics, statistics, or computer science - 5-10 years experience working in a biopharmaceutical, health-tech, university research, or hospital…","Job types: Full-time
Job types cc: Full-time",https://www.indeed.com/m/viewjob?jk=0ce1259eca0bd812,IndeedScraperUSAEng_0ce1259eca0bd812,IndeedScraperUSAEng,Data,USA_ENGLISH,$133200 - $220200 yearly,UNKNOWN
NEW,Sr Marketing Applied Scientist,Uber,"San Francisco, CA",2024-10-03,Experience with big data using technologies like Spark and Hive. Ability to use Python or R to work efficiently at scale with large data sets. Collaborate with the Product and/or Engineering teams to…,"Job types: Full-time
Job types cc: Full-time",https://www.indeed.com/m/viewjob?jk=b89ca8bdd6331aee,IndeedScraperUSAEng_b89ca8bdd6331aee,IndeedScraperUSAEng,Data,USA_ENGLISH,$174000 - $193500 yearly,UNKNOWN
NEW,Principal Software Developer - UI Developer - Oracle Data Safe,Oracle,"Redwood City, CA 94065",2024-10-03,"Oracle Database helps reduce the risk of a data breach and simplifies regulatory compliance with security solutions for encryption and key management, granular access controls, flexible data masking,…","Job types: Full-time
Job types cc: Full-time",https://www.indeed.com/m/viewjob?jk=1dcf9b0ad95b8649,IndeedScraperUSAEng_1dcf9b0ad95b8649,IndeedScraperUSAEng,Data,USA_ENGLISH,,UNKNOWN
NEW,"Specialist, Data and AI",World Economic Forum LLC,"San Francisco, CA",2024-10-16,"Two years experience in work related to data and AI ecosystems and/or policy. The Specialist will support content development and dissemination, along with coordination and community building efforts…","Job types: Full-time
Job types cc: Full-time",https://www.indeed.com/m/viewjob?jk=a32fcdc1a0e53f88,IndeedScraperUSAEng_a32fcdc1a0e53f88,IndeedScraperUSAEng,Data,USA_ENGLISH,$80000 - $85000 yearly,UNKNOWN
NEW,RESEARCH DATA SUPERVISOR I,Department of Industrial Relations,"San Francisco County, CA",2024-10-26,"Ability to evaluate technical and methodological problems that may arise in connection with the collection, processing and analysis of statistical data. Classification: RESEARCH DATA SUPERVISOR I.","Job types: Full-time
Benefits: Paid holidays, Dental insurance, 401(k), Employee assistance program, Vision insurance
Job types cc: Full-time
Schedules: Monday to Friday",https://www.indeed.com/m/viewjob?jk=8d925449e201c1d9,IndeedScraperUSAEng_8d925449e201c1d9,IndeedScraperUSAEng,Data,USA_ENGLISH,$7311 - $9083 monthly,UNKNOWN
NEW,"Senior Machine Learning Engineer, Ranking and Recommendations",Uber,"San Francisco, CA",2024-10-03,"Experience with taking on vague business problems, translating them into ML + Optimization formulation, identifying the right features, model structure and optimization constraints, and delivering…","Job types: Full-time
Job types cc: Full-time",https://www.indeed.com/m/viewjob?jk=8a709685470476f0,IndeedScraperUSAEng_8a709685470476f0,IndeedScraperUSAEng,Data,USA_ENGLISH,$185000 - $205500 yearly,UNKNOWN
NEW,"Staff Machine Learning Engineer, Robot Learning",Path Robotics,"San Francisco Bay Area, CA",2024-10-25,"Craft strategies for the entire solution's lifecycle including but not limited to data collection and fleet learning learning. The ideal candidate will have a strong background in robotics, with a…","Benefits: Paid parental leave, Dental insurance, 401(k), Paid time off, Parental leave, Vision insurance, Referral program, Food provided",https://www.indeed.com/m/viewjob?jk=862fdc2c7923be7a,IndeedScraperUSAEng_862fdc2c7923be7a,IndeedScraperUSAEng,Data,USA_ENGLISH,,UNKNOWN
NEW,"Senior, Data Scientist - Advertising Measurement",Walmart,"San Bruno, CA 94066",2024-10-03,"Position Summary... What you'll do... About Walmart Connect At Walmart, we've led retail for over 60 years by keeping our customers' needs at the center of everything we do. Our latest…","Benefits: Paid jury duty, Disability insurance, Relocation assistance, Health insurance, Dental insurance, 401(k), Military leave, Paid time off, Family leave, Parental leave, Vision insurance, Life insurance, Paid sick time",https://www.indeed.com/m/viewjob?jk=5eb1a07176881901,IndeedScraperUSAEng_5eb1a07176881901,IndeedScraperUSAEng,Data,USA_ENGLISH,$108000 - $234000 yearly,UNKNOWN
NEW,"Senior Applied Scientist, ML DSP",Gridware,"San Francisco, CA",2024-10-03,4+ years of professional experience with physical sensors and time series data modeling. Design and build physically-informed data augmentation and domain randomization algorithms.,"Job types: Full-time
Remote: Hybrid work
Benefits: Paid training, Paid parental leave, Dental insurance, Parental leave, Vision insurance, Flexible schedule
Job types cc: Full-time",https://www.indeed.com/m/viewjob?jk=f3c0b29232089b8f,IndeedScraperUSAEng_f3c0b29232089b8f,IndeedScraperUSAEng,Data,USA_ENGLISH,,TEMPORARILY_REMOTE
NEW,Research Data Analysis,University of California San Francisco,"San Francisco, CA 94143",2024-10-03,"Graduate degree in statistics, biostatistics, epidemiology or related field and/or two to three years of experience in practical data analysis or an equivalent combination of education and experience.","Job types: Full-time
Shifts: 8 hour shift, Day shift
Job types cc: Full-time
Schedules: 8 hour shift, Day shift, Monday to Friday",https://www.indeed.com/m/viewjob?jk=b659aae6cc0bf19f,IndeedScraperUSAEng_b659aae6cc0bf19f,IndeedScraperUSAEng,Data,USA_ENGLISH,$67000 - $94200 yearly,UNKNOWN
NEW,Prompt Engineer - Remote India,LeewayHertz,"San Francisco, CA 94111",2024-10-16,"Work closely with data scientists, engineers, and product teams to integrate prompt engineering into product development. As a Prompt Engineer, you will be responsible for designing and optimizing…","Job types: Full-time
Remote: Remote
Job types cc: Full-time",https://www.indeed.com/m/viewjob?jk=11ea095996ecc968,IndeedScraperUSAEng_11ea095996ecc968,IndeedScraperUSAEng,Data,USA_ENGLISH,,FULLY_REMOTE
NEW,Lead Technical Engineer,Data Select,United States,2024-10-03,"Responsible for the development, implementation, and maintenance of the analytic, modeling, and simulation support function. Supports all design teams to ensure integrity of analytic models and…","Job types: Full-time
Shifts: 8 hour shift
Benefits: Relocation assistance, Health insurance, Dental insurance, 401(k), Tuition reimbursement, Paid time off, Vision insurance, 401(k) matching, Professional development assistance, Life insurance, Retirement plan
Job types cc: Full-time
Schedules: 8 hour shift",https://www.indeed.com/m/viewjob?jk=59ef7b8547c2a635,IndeedScraperUSAEng_59ef7b8547c2a635,IndeedScraperUSAEng,Data,USA_ENGLISH,$130000 - $150000 yearly,UNKNOWN
NEW,Data Center Energy Strategic Negotiator,Google,"San Francisco, CA",2024-10-31,Experience working in a data center energy agreement. Bachelor's degree or equivalent practical experience. 6 years of experience negotiating and structuring agreements or leading business development…,"Job types: Full-time
Job types cc: Full-time",https://www.indeed.com/m/viewjob?jk=8004189f270d34d3,IndeedScraperUSAEng_8004189f270d34d3,IndeedScraperUSAEng,Data,USA_ENGLISH,,UNKNOWN
NEW,Senior/Staff Data Scientist - Collision Avoidance System,Zoox,"Foster City, CA",2024-10-11,"You will work closely with software engineers, data engineers, and data scientists to develop metrics and tools for analyzing errors and guiding improvements in our systems.","Job types: Full-time
Benefits: Disability insurance, Health insurance, RSU, Paid time off, Life insurance
Job types cc: Full-time",https://www.indeed.com/m/viewjob?jk=7aa55d13abf16e86,IndeedScraperUSAEng_7aa55d13abf16e86,IndeedScraperUSAEng,Data,USA_ENGLISH,$217000 - $309000 yearly,UNKNOWN
NEW,Forensics - Discovery Data Scientist - Manager (AI Responsibility),EY,"San Francisco, CA 94105",2024-10-03,"Strong data science and/or data engineering experience. Solving problems by incorporating data into decision making. Familiarity with regulatory frameworks and standards related to AI ethics, privacy,…","Benefits: Paid holidays, Health insurance, Dental insurance, 401(k), Paid time off",https://www.indeed.com/m/viewjob?jk=3cb8e76c60a23233,IndeedScraperUSAEng_3cb8e76c60a23233,IndeedScraperUSAEng,Data,USA_ENGLISH,$124300 - $259000 yearly,UNKNOWN
NEW,"Engineering Manager, Database Platform",Snowflake,"San Mateo, CA",2024-10-24,Experience in SQL and data analysis is a big plus. Every Snowflake employee is expected to follow the company’s confidentiality and security standards for handling sensitive data.,"Job types: Full-time
Job types cc: Full-time",https://www.indeed.com/m/viewjob?jk=530ec9924fc717e6,IndeedScraperUSAEng_530ec9924fc717e6,IndeedScraperUSAEng,Data,USA_ENGLISH,,UNKNOWN
NEW,AI/ML Services - Software Engineer,GSK,"San Francisco, CA",2024-10-03,"Site Name: Seattle Sixth Ave, San Francisco Posted Date: Oct 4 2024 At GSK, we see a world in which advanced applications of Machine Learning and AI will allow us to develop transformational…","Benefits: Paid holidays, Health insurance, Parental leave, Retirement plan",https://www.indeed.com/m/viewjob?jk=448ba844bb8024ed,IndeedScraperUSAEng_448ba844bb8024ed,IndeedScraperUSAEng,Data,USA_ENGLISH,$130900 - $177100 yearly,UNKNOWN
NEW,"Principal, Data Quality Specialist (Flexible location)",PG&E Corporation,"Oakland, CA 94612",2024-10-03,Collaborate with data stewards and data owners to address data issues on an ongoing basis. Lead data profiling and assessments to understand the current state of data quality.,"Job types: Full-time
Remote: Hybrid work
Job types cc: Full-time",https://www.indeed.com/m/viewjob?jk=695c14bbe0155acf,IndeedScraperUSAEng_695c14bbe0155acf,IndeedScraperUSAEng,Data,USA_ENGLISH,$123000 - $207000 yearly,TEMPORARILY_REMOTE
NEW,Machine Learning Engineer - AutoML,Zoox,"Foster City, CA",2024-10-03,Design large-scale optimization problems and analyze results using driving data. Zoox is looking for machine learning and software engineers to help improve autonomous driving quality using large…,"Job types: Full-time
Benefits: Disability insurance, Health insurance, RSU, Paid time off, Life insurance
Job types cc: Full-time",https://www.indeed.com/m/viewjob?jk=95be6a46e84e58c9,IndeedScraperUSAEng_95be6a46e84e58c9,IndeedScraperUSAEng,Data,USA_ENGLISH,$180000 - $256000 yearly,UNKNOWN
NEW,"Principal Data Scientist, Proteomics",CALICO,"South San Francisco, CA",2024-10-03,"Expertise in statistical data analysis. Invent and develop data analysis strategies, write algorithms, and broadly support the analysis of proteomics data, in particular data from large patient…",,https://www.indeed.com/m/viewjob?jk=7fa27363e7a16681,IndeedScraperUSAEng_7fa27363e7a16681,IndeedScraperUSAEng,Data,USA_ENGLISH,$199000 - $203000 yearly,UNKNOWN
NEW,AI/ML Services - Full Stack Engineer,GSK,"South San Francisco, CA 94080",2024-10-03,Experience with data visualization libraries such as D3.js or Chart.js is also desirable. Candidates not meeting these academic requirements will be considered if demonstrating 8+ years of industry…,"Benefits: Paid holidays, Health insurance, Parental leave, Retirement plan",https://www.indeed.com/m/viewjob?jk=a95587f2f16778ae,IndeedScraperUSAEng_a95587f2f16778ae,IndeedScraperUSAEng,Data,USA_ENGLISH,$130900 - $177100 yearly,UNKNOWN
NEW,"Sr. WW Specialist SA, In-Memory Database , WWSO","Amazon Web Services, Inc.","San Francisco, CA",2024-10-03,"5+ years experience in In-memory data architectures. As a trusted advisor and strategic leader with technical expertise in In-Memory/NoSQL database systems, you will share recommendations around…","Job types: Full-time
Job types cc: Full-time",https://www.indeed.com/m/viewjob?jk=6fc63e966dfdd197,IndeedScraperUSAEng_6fc63e966dfdd197,IndeedScraperUSAEng,Data,USA_ENGLISH,$138200 - $239000 yearly,UNKNOWN
NEW,Senior Architect - Data Engineering and Analytics,West Monroe Experienced,"San Francisco Bay Area, CA",2024-11-02,Ensure that data integrity issues are addressed. Provide data management expertise to our clients in evaluating requirements and developing data architecture and performing platform selection and…,Remote: Remote,https://www.indeed.com/m/viewjob?jk=5bdcf91dd2497d25,IndeedScraperUSAEng_5bdcf91dd2497d25,IndeedScraperUSAEng,Data,USA_ENGLISH,$199100 - $223400 yearly,FULLY_REMOTE
NEW,Data Scientist II - Experimentation,Warner Bros. Discovery,"San Francisco, CA 94108",2024-10-12,Capture business requirements for data science solutions and communicate data science output and recommendations to inform business strategies. Study and fully understand WBD data sources and develop…,"Benefits: Wellness program, Paid holidays, Disability insurance, Health insurance, Retirement plan",https://www.indeed.com/m/viewjob?jk=9976f45352b3627b,IndeedScraperUSAEng_9976f45352b3627b,IndeedScraperUSAEng,Data,USA_ENGLISH,$109200 - $202800 yearly,UNKNOWN
NEW,"Senior Engineer, Data Platform & Reporting",Sephora,"San Francisco, CA 94105",2024-11-01,"Experience performing data analysis and data exploration. Designs & builds frameworks for various common data engineering processes like ingestions, mastering, data cleansing, and data masking.","Job types: Full-time
Remote: Hybrid work
Benefits: Commuter assistance, Disability insurance, Health insurance, Dental insurance, Flexible spending account, Paid time off, Vision insurance, Employee discount, Life insurance, Referral program
Job types cc: Full-time",https://www.indeed.com/m/viewjob?jk=c7cf11a8ab95c190,IndeedScraperUSAEng_c7cf11a8ab95c190,IndeedScraperUSAEng,Data,USA_ENGLISH,$142020 - $175300 yearly,TEMPORARILY_REMOTE
NEW,Principal AI Engineer,Cerebellum Network,"San Francisco, CA",2024-10-03,Advanced Knowledge: Strong data science and computational modeling skills (PhD preferred). Hybrid Role: 2 days a week in-office (full-time commitment).,"Job types: Full-time
Remote: Hybrid work
Job types cc: Full-time",https://www.indeed.com/m/viewjob?jk=57ce5645dfff5f90,IndeedScraperUSAEng_57ce5645dfff5f90,IndeedScraperUSAEng,Data,USA_ENGLISH,,TEMPORARILY_REMOTE
NEW,"Manager, Data Analytics, Insight Support (Omni/Store), Walmart Connect",Walmart,"San Bruno, CA 94066",2024-10-17,"Previous data analytics experience and familiarity with complex data sets along with the ability to interpret and manipulate data to identify patterns, particularly in Media & Advertising, eCommerce…","Benefits: Paid jury duty, Paid parental leave, Employee stock purchase plan, Disability insurance, Health insurance, Dental insurance, 401(k), Military leave, Paid time off, Family leave, Parental leave, Vision insurance, 401(k) matching, Life insurance, Paid sick time",https://www.indeed.com/m/viewjob?jk=d96a8c43a45a11ee,IndeedScraperUSAEng_d96a8c43a45a11ee,IndeedScraperUSAEng,Data,USA_ENGLISH,$104000 - $202000 yearly,UNKNOWN
NEW,Senior Data Center Site Negotiator,Google,"San Francisco, CA",2024-10-17,"This role may also be located in our Playa Vista, CA campus. Note: By applying to this position you will have an opportunity to share your preferred working location from the following: Sunnyvale, CA…","Job types: Full-time
Job types cc: Full-time",https://www.indeed.com/m/viewjob?jk=4cbf00d8dec35380,IndeedScraperUSAEng_4cbf00d8dec35380,IndeedScraperUSAEng,Data,USA_ENGLISH,,UNKNOWN
NEW,Senior Clinical Data Manager II (Oncology),"Exelixis, Inc.","Alameda, CA 94502",2024-10-29,Develop and execute procedures for data quality review and data acceptance prior to data analyses and/or database lock. Prepare recommendations for new or improved processes for data management and…,"Job types: Full-time
Benefits: Paid holidays, Disability insurance, Health insurance, Dental insurance, 401(k), Flexible spending account, Vision insurance
Job types cc: Full-time",https://www.indeed.com/m/viewjob?jk=d8db4778344f5432,IndeedScraperUSAEng_d8db4778344f5432,IndeedScraperUSAEng,Data,USA_ENGLISH,$143000 - $203000 yearly,UNKNOWN
NEW,"Business Analyst, Expert",PG&E Corporation,"Oakland, CA 94612",2024-10-15,Develops innovative data solutions to address complex business issues. Performs analysis on highly complex data models that have cross- functional impact. Job Category: Business Operations / Strategy.,"Job types: Full-time
Remote: Hybrid work
Job types cc: Full-time",https://www.indeed.com/m/viewjob?jk=1b211d6af9d39c11,IndeedScraperUSAEng_1b211d6af9d39c11,IndeedScraperUSAEng,Data,USA_ENGLISH,$114000 - $182000 yearly,TEMPORARILY_REMOTE
NEW,Lead Data Engineer,Nuna,"San Francisco Bay Area, CA",2024-10-10,"You will join an interdisciplinary group spanning data science, machine learning, data analytics, actuarial science, and data engineering. Deep knowledge of modern data infrastructure best practices.","Remote: Remote
Benefits: Health insurance, Paid time off, Life insurance, Retirement plan",https://www.indeed.com/m/viewjob?jk=ae8c202069c5ac7f,IndeedScraperUSAEng_ae8c202069c5ac7f,IndeedScraperUSAEng,Data,USA_ENGLISH,$188000 - $230750 yearly,FULLY_REMOTE
NEW,Research Data Analyst (6256U) 73987,University of California Berkeley,"Berkeley, CA 94720",2024-10-30,"Support the integration of data across multiple platforms, ensuring data consistency, security, and integrity. Designs and implements data pipelines to collect, clean, and process raw data from…",,https://www.indeed.com/m/viewjob?jk=49d19294d9ce3547,IndeedScraperUSAEng_49d19294d9ce3547,IndeedScraperUSAEng,Data,USA_ENGLISH,$34.77 - $61.78 hourly,UNKNOWN
NEW,"Senior Product Manager, Data Marketplace",Verily,"San Bruno, CA",2024-10-03,"On any given day you may be solving problems in areas such as data access control, data discovery both outside and inside Verily product experiences, go to market strategies, data license enforcement,…","Job types: Full-time
Job types cc: Full-time",https://www.indeed.com/m/viewjob?jk=714439a2ec6d5920,IndeedScraperUSAEng_714439a2ec6d5920,IndeedScraperUSAEng,Data,USA_ENGLISH,$129000 - $184000 yearly,UNKNOWN
NEW,AI Engineer - Sr. Manager Level (IC),Capital One,"San Francisco, CA 94108",2024-10-24,"Partner with a cross-functional team of engineers, research scientists, technical program managers, and product managers to deliver AI-powered products that change how our associates work and how our…","Job types: Full-time
Remote: Hybrid work
Benefits: Health insurance
Job types cc: Full-time",https://www.indeed.com/m/viewjob?jk=2d57b95efcd2938b,IndeedScraperUSAEng_2d57b95efcd2938b,IndeedScraperUSAEng,Data,USA_ENGLISH,,TEMPORARILY_REMOTE
NEW,Senior AI Performance Engineer,Genmo,"San Francisco, CA",2024-10-22,"Experience in entire development pipeline from data processing, preparation & data loading to training and inference. Your expertise will ensure that our models run efficiently on clusters, leveraging…","Job types: Full-time
Job types cc: Full-time",https://www.indeed.com/m/viewjob?jk=af35b22b07b1fdb0,IndeedScraperUSAEng_af35b22b07b1fdb0,IndeedScraperUSAEng,Data,USA_ENGLISH,,UNKNOWN
NEW,Clinical Data Management,Katalyst Healthcares & Life Sciences,"Emeryville, CA 94608",2024-10-03,Ensures the quality of clinical data within the EDC and other databases through data review and data reconciliation processes and communicates any outstanding issues.,"Job types: Contract
Job types cc: Contract",https://www.indeed.com/m/viewjob?jk=e9ce30284daadab7,IndeedScraperUSAEng_e9ce30284daadab7,IndeedScraperUSAEng,Data,USA_ENGLISH,,UNKNOWN
NEW,"Senior Data Scientist, Machine Learning, Fulfilment",Lyft,"San Francisco Bay Area, CA",2024-10-15,Perform exploratory data analysis to gain a deeper understanding of the problem. Analyze experimental and observational data; communicate findings; facilitate launch decisions.,"Remote: Hybrid work
Benefits: Commuter assistance, Paid parental leave, Health insurance, Unlimited paid time off, Dental insurance, 401(k), Paid time off, Parental leave, Vision insurance",https://www.indeed.com/m/viewjob?jk=7206c1c60467a1e8,IndeedScraperUSAEng_7206c1c60467a1e8,IndeedScraperUSAEng,Data,USA_ENGLISH,$144000 - $180000 yearly,TEMPORARILY_REMOTE
NEW,Senior Staff Software Engineer - Data Infrastructure,Rippling,"San Francisco, CA 94104",2024-10-03,"About Rippling Rippling gives businesses one place to run HR, IT, and Finance. It brings together all of the workforce systems that are normally scattered across a company, like payroll, expenses,…","Job types: Full-time
Job types cc: Full-time",https://www.indeed.com/m/viewjob?jk=9510f011884d72e9,IndeedScraperUSAEng_9510f011884d72e9,IndeedScraperUSAEng,Data,USA_ENGLISH,$186000 - $325500 yearly,UNKNOWN
NEW,Staff Data Scientist,Lawrence Berkeley National Laboratory,"San Francisco Bay Area, CA",2024-11-02,Contribute to/prepare publications based on results and analysis of data. Strong skills to effectively execute and process the data from thousands of earthquake simulations on massively parallel…,"Job types: Full-time
Job types cc: Full-time",https://www.indeed.com/m/viewjob?jk=d03e83ce663ca1ee,IndeedScraperUSAEng_d03e83ce663ca1ee,IndeedScraperUSAEng,Data,USA_ENGLISH,$10829 - $18273 monthly,UNKNOWN
NEW,Staff Data Scientist,Abbott Laboratories,"Alameda, CA",2024-10-08,"Develop machine learning models to apply test data algorithms to future data. Experience in applying data analysis techniques to a large set of data using big data systems such as Hadoop, Spark,…","Job types: Full-time
Benefits: Health insurance, Tuition reimbursement, Retirement plan
Job types cc: Full-time",https://www.indeed.com/m/viewjob?jk=34c2386b99fa03a7,IndeedScraperUSAEng_34c2386b99fa03a7,IndeedScraperUSAEng,Data,USA_ENGLISH,$109300 - $218500 yearly,UNKNOWN
NEW,"Security Analyst (7338U), Campus Applications & Data - 71148",University of California Berkeley,"Berkeley, CA 94720",2024-10-03,Knowledge of data encryption techniques. Demonstrated experience selecting and applying appropriate data encryption technologies. Use DataPower to obfuscate or redact data according to security…,"Job types: Full-time
Job types cc: Full-time",https://www.indeed.com/m/viewjob?jk=68aa9f653e989199,IndeedScraperUSAEng_68aa9f653e989199,IndeedScraperUSAEng,Data,USA_ENGLISH,$88900 - $114449 yearly,UNKNOWN
NEW,"Senior Software Developer Oracle Data Safe - Redwood City, CA",Oracle,"Redwood City, CA 94065",2024-10-03,"We are seeking a Senior Software Engineer with strong programming skills with the depth and breadth to evaluate complex environments and technology stacks, and build/code/maintain efficient services…","Job types: Full-time
Job types cc: Full-time",https://www.indeed.com/m/viewjob?jk=578836304ed6550c,IndeedScraperUSAEng_578836304ed6550c,IndeedScraperUSAEng,Data,USA_ENGLISH,,UNKNOWN
NEW,"Data Reporting and Analytics Consultant III, Programming",Kaiser Permanente,"Oakland, CA",2024-10-23,Prepares data for analytic efforts by consolidating data; reviewing data for quality and accuracy; profiling data inaccuracies; and cleaning and creating final data set(s) for analysis.,"Job types: Full-time
Shifts: Day shift
Job types cc: Full-time
Schedules: Day shift",https://www.indeed.com/m/viewjob?jk=4557e9e55b7207f6,IndeedScraperUSAEng_4557e9e55b7207f6,IndeedScraperUSAEng,Data,USA_ENGLISH,$104500 - $135190 yearly,UNKNOWN
NEW,"Senior Software Engineer, Data Platform (Data Trust)",Lyft,"San Francisco Bay Area, CA",2024-10-03,"The team owns components including Verity as data quality tooling, Amundsen as data discovery tooling and data governance. The Data Trust team within Data Platform is responsible for empowering Lyft…","Remote: Hybrid work
Benefits: Commuter assistance, Paid parental leave, Health insurance, Unlimited paid time off, Dental insurance, 401(k), Paid time off, Parental leave, Vision insurance",https://www.indeed.com/m/viewjob?jk=96f427cc44ff303b,IndeedScraperUSAEng_96f427cc44ff303b,IndeedScraperUSAEng,Data,USA_ENGLISH,$144000 - $198000 yearly,TEMPORARILY_REMOTE
