status,title,company,location,date,blurb,tags,link,id,provider,query,locale,wage,remotenessNEW,Preconstruction Manager (Data Centers) - Austin Commercial,Austin Commercial,"Dallas, TX 75204",2024-10-20,"Leads Austin Commercial's preconstruction efforts on Digital Infrastructure/Mission Critical/Data Center projects including conceptual estimating, detailed estimating, scheduling, constructability…","Job types: Full-time
Benefits: Disability insurance, Health insurance, Dental insurance, 401(k) matching, Employee stock ownership plan
Job types cc: Full-time",https://www.indeed.com/m/viewjob?jk=b9edd433e6b4f3c6,IndeedScraperUSAEng_b9edd433e6b4f3c6,IndeedScraperUSAEng,Data,USA_ENGLISH,,UNKNOWN
NEW,Program Assistant Director of Development Data and Technologies,University of Texas at Arlington,"Arlington, TX 76013",2024-11-05,Proficient in the use of Oracle Analytics or similar data visualization tool. Assist with the management and future development of the Technology Team SmartSheets that are used to manage team data…,"Job types: Full-time
Benefits: Health insurance, Paid time off, Retirement plan
Job types cc: Full-time
Schedules: Monday to Friday",https://www.indeed.com/m/viewjob?jk=98defe88b0114789,IndeedScraperUSAEng_98defe88b0114789,IndeedScraperUSAEng,Data,USA_ENGLISH,,UNKNOWN
NEW,Project Architect | Data Centers,Corgan,"Dallas, TX 75202",2024-11-07,"Overview: At Corgan we are passionate about great design but the best thing we build is each other. Here, you’ll find camaraderie and collaboration as abundantly as curiosity and creativity. Corgan…","Job types: Full-time
Job types cc: Full-time",https://www.indeed.com/m/viewjob?jk=dbe3b687836d93d1,IndeedScraperUSAEng_dbe3b687836d93d1,IndeedScraperUSAEng,Data,USA_ENGLISH,,UNKNOWN
NEW,Project Architect | Data Centers,Corgan,"Dallas, TX 75202",2024-11-07,"Overview: At Corgan we are passionate about great design but the best thing we build is each other. Here, you’ll find camaraderie and collaboration as abundantly as curiosity and creativity. Corgan…","Job types: Full-time
Job types cc: Full-time",https://www.indeed.com/m/viewjob?jk=c984899a901adb97,IndeedScraperUSAEng_c984899a901adb97,IndeedScraperUSAEng,Data,USA_ENGLISH,,UNKNOWN
NEW,Technical Project Lead (FTP to SFTP Migration),NTT DATA,"Dallas, TX 75215",2024-11-14,"Where required by law, NTT DATA provides a reasonable range of compensation for specific roles. This position may also be eligible for incentive compensation based on individual and/or company…","Remote: Remote
Benefits: Health savings account, AD&D insurance, Disability insurance, Health insurance, Dental insurance, Paid time off, Vision insurance, 401(k) matching",https://www.indeed.com/m/viewjob?jk=2a5404bcfb0f11b8,IndeedScraperUSAEng_2a5404bcfb0f11b8,IndeedScraperUSAEng,Data,USA_ENGLISH,$60 - $70 hourly,FULLY_REMOTE
NEW,Finance Manager,"International Data Group, Inc.","West, TX",2024-10-20,"Proven ability to analyze complex financial data and provide actionable insights. The Sales Finance Manager will be responsible for supporting the sales team with financial insights, budgeting,…","Job types: Full-time
Remote: Remote
Job types cc: Full-time",https://www.indeed.com/m/viewjob?jk=d8a525fccc40b857,IndeedScraperUSAEng_d8a525fccc40b857,IndeedScraperUSAEng,Data,USA_ENGLISH,$137000 - $157000 yearly,FULLY_REMOTE
NEW,Release Train Engineer,NTT DATA,"Dallas, TX 75207",2024-11-07,"The Release Train Engineer (RTE) is a servant leader and coach for the Agile Release Train (ART). The RTE facilitates Agile Release Train processes and execution, escalates impediments, manages risk,…",Remote: Hybrid work,https://www.indeed.com/m/viewjob?jk=17440bcc72e73927,IndeedScraperUSAEng_17440bcc72e73927,IndeedScraperUSAEng,Data,USA_ENGLISH,,TEMPORARILY_REMOTE
NEW,Architectural Program Manager | Data Centers,Corgan,"Dallas, TX 75202",2024-10-20,"Lead and organize multiple project pursuits for large client accounts, establish familiarity with client preferences for formatting and submission. Establish and manage Critical Path project schedules…","Job types: Full-time
Job types cc: Full-time",https://www.indeed.com/m/viewjob?jk=a773df2a6df1b606,IndeedScraperUSAEng_a773df2a6df1b606,IndeedScraperUSAEng,Data,USA_ENGLISH,,UNKNOWN
NEW,Associate Civil Project Manager - Data Center,Olsson,"Fort Worth, TX",2024-10-20,"This position is involved in the full project life cycle and is responsible for ensuring timely completion of projects in accordance with established scope, schedule, and budget.","Job types: Full-time
Remote: Hybrid work
Benefits: Wellness program, Health insurance, Dental insurance, Paid time off, Vision insurance, 401(k) matching, Employee stock ownership plan
Job types cc: Full-time",https://www.indeed.com/m/viewjob?jk=1e32c3ece05f8168,IndeedScraperUSAEng_1e32c3ece05f8168,IndeedScraperUSAEng,Data,USA_ENGLISH,,TEMPORARILY_REMOTE
NEW,Licensing Renewals Processor,Integrity Marketing Group,"Dallas, TX 75202",2024-10-25,We are seeking a detail-oriented Licensing Renewal Processor to support our licensing team in the timely and accurate processing of license renewals across our subsidiaries.,"Job types: Full-time
Job types cc: Full-time",https://www.indeed.com/m/viewjob?jk=b853dab1651e7e4f,IndeedScraperUSAEng_b853dab1651e7e4f,IndeedScraperUSAEng,Data,USA_ENGLISH,,UNKNOWN
NEW,Bus. Systems Analysis Senior Analyst,NTT DATA,"Irving, TX",2024-11-14,"This is an Analyst role focused on S/4 HANA Finance , with experience in SAP Project Systems. The successful candidate will perform work that is highly complex, varied in nature, and span multiple…","Remote: Remote
Benefits: Health savings account, AD&D insurance, Disability insurance, Health insurance, Dental insurance, Paid time off, Vision insurance, 401(k) matching",https://www.indeed.com/m/viewjob?jk=9865014b8ca63d81,IndeedScraperUSAEng_9865014b8ca63d81,IndeedScraperUSAEng,Data,USA_ENGLISH,,FULLY_REMOTE
NEW,Zscaler / Cyber Security L2 Support,NTT DATA,"Irving, TX 75039",2024-10-20,"We have a Zscaler Cyber Security Support position for 6-12 months and ONSITE/HYBRID. Provide operational support for cybersecurity technologies, Zscaler, Proxy Broadcom, Active Directory.",,https://www.indeed.com/m/viewjob?jk=a38f605c9462cab6,IndeedScraperUSAEng_a38f605c9462cab6,IndeedScraperUSAEng,Data,USA_ENGLISH,$50 - $50 hourly,UNKNOWN
NEW,Data Management Manager - Independent Testing & Validation,Wells Fargo,"Irving, TX",2024-10-20,"Understanding of source code repository requirements, data retention standards, data usage standards, and data classification. 4+ years of SAS and / or SQL development with a deep understanding of…","Job types: Full-time
Remote: Hybrid work
Benefits: Commuter assistance, Caregiver leave, Disability insurance, Dependent care reimbursement, Health insurance, Tuition reimbursement, Paid time off, Parental leave, Life insurance
Job types cc: Full-time",https://www.indeed.com/m/viewjob?jk=b23ba039d11a337b,IndeedScraperUSAEng_b23ba039d11a337b,IndeedScraperUSAEng,Data,USA_ENGLISH,$111100 - $197500 yearly,TEMPORARILY_REMOTE
NEW,Assistant Project Manager,T5 Data Centers,"Denton, TX",2024-10-20,"On site management of data center projects. The Assistant Project Manager is responsible for assisting in coordinating the activities of a project to ensure cost, schedule, document control and…","Job types: Full-time
Benefits: Paid holidays, Health insurance, Dental insurance, Paid time off, Vision insurance, 401(k) matching
Job types cc: Full-time",https://www.indeed.com/m/viewjob?jk=3b7c56cfe320512d,IndeedScraperUSAEng_3b7c56cfe320512d,IndeedScraperUSAEng,Data,USA_ENGLISH,,UNKNOWN
NEW,Vice President - Enterprise Data Management,Fisher Investments,"Plano, TX",2024-10-20,"Experience delivering and supporting enterprise data platforms; data architecture & governance; analytics, data integration architectures and tools; Microsoft Azure; along with knowledge of SOX, GDPR,…","Job types: Full-time
Benefits: Caregiver leave, Paid holidays, Health insurance, Dental insurance, Paid time off, Work from home, Vision insurance, 401(k) matching
Job types cc: Full-time",https://www.indeed.com/m/viewjob?jk=756d41d05382b827,IndeedScraperUSAEng_756d41d05382b827,IndeedScraperUSAEng,Data,USA_ENGLISH,,UNKNOWN
NEW,"Duck Creek Agile Business Analyst, Senior Associate",PRICE WATERHOUSE COOPERS,"Dallas, TX",2024-10-31,We focus on improving apps or developing new apps for traditional and mobile devices as well as conducting usability testing to find ways to improve our clients’ user experience.,"Benefits: Paid holidays, Health insurance, Dental insurance, 401(k), Vision insurance",https://www.indeed.com/m/viewjob?jk=542678151b6d2982,IndeedScraperUSAEng_542678151b6d2982,IndeedScraperUSAEng,Data,USA_ENGLISH,$84000 - $202000 yearly,UNKNOWN
NEW,Sr. DevOps Engineer,NTT DATA,"Irving, TX 75039",2024-10-26,"NTT DATA's Client is seeking a Senior DevOps Engineer with around 7-10 year of experience. Experience in Linux shell scripting and commands. Experience with middleware tools i.e. WebSphere, Tomcat.","Benefits: Health savings account, AD&D insurance, Disability insurance, Health insurance, Dental insurance, Paid time off, Vision insurance, 401(k) matching",https://www.indeed.com/m/viewjob?jk=365484f716681351,IndeedScraperUSAEng_365484f716681351,IndeedScraperUSAEng,Data,USA_ENGLISH,$60 - $70 hourly,UNKNOWN
NEW,Kong API Gateway Engineer,NTT DATA,"Irving, TX 75039",2024-10-20,"API Gateway Management: Oversee the development and maintenance of the Kong API gateway, ensuring high availability, reliability, and performance. API Development: Design, implement, and maintain Kong…",Remote: Hybrid work,https://www.indeed.com/m/viewjob?jk=788462897dc22ca4,IndeedScraperUSAEng_788462897dc22ca4,IndeedScraperUSAEng,Data,USA_ENGLISH,,TEMPORARILY_REMOTE
NEW,Construction Project Manager,NTT DATA,"Garland, TX 75044",2024-10-21,"Ensure project data integrity and documentation is accurate, timely and coordinated. This position requires work to be done onsite at a data center facility and may require use of a personal mobile…","Job types: Full-time
Benefits: Disability insurance, Health insurance, Dental insurance, 401(k), Flexible spending account, Paid time off, Vision insurance
Job types cc: Full-time",https://www.indeed.com/m/viewjob?jk=8db08d9df82659b3,IndeedScraperUSAEng_8db08d9df82659b3,IndeedScraperUSAEng,Data,USA_ENGLISH,$135500 - $169000 yearly,UNKNOWN
NEW,S/4HANA FSCM Analyst - Fluent in Korean - REMOTE,NTT DATA,"Dallas, TX 75215",2024-10-20,The S/4HANA FSCM Receivables Analyst must be fluent in both Korean and English language and should be able to work in the shift to cover 4 hours of Korean business hours (4pm to 9PM CST US hours ).,Remote: Remote,https://www.indeed.com/m/viewjob?jk=fb4f8ba48736713f,IndeedScraperUSAEng_fb4f8ba48736713f,IndeedScraperUSAEng,Data,USA_ENGLISH,$86040 - $179250 yearly,FULLY_REMOTE
NEW,Data Privacy Technology Lead,Blackstone Technology Group,"Dallas, TX 75287",2024-10-29,"Experience with data loss prevention (DLP) and data classification tools. 5+ years of experience in data privacy, data governance, or information security. Full Time or Part Time: true.","Job types: Part-time, Full-time
Job types cc: Permanent, Part-time, Full-time",https://www.indeed.com/m/viewjob?jk=cb4c81c1aeddc7cf,IndeedScraperUSAEng_cb4c81c1aeddc7cf,IndeedScraperUSAEng,Data,USA_ENGLISH,$125000 - $140000 yearly,UNKNOWN
NEW,Infrastructure Solutions Architect,NTT DATA,"Irving, TX 75039",2024-10-20,"With the goal to design strategic target state architecture, using defined standards to maximize performance and capacity, while driving IT costs down. Familiar with Private Cloud platforms (PaaS).","Benefits: Health savings account, AD&D insurance, Disability insurance, Health insurance, Dental insurance, Paid time off, Vision insurance, 401(k) matching",https://www.indeed.com/m/viewjob?jk=3fe62a3398e5f5d9,IndeedScraperUSAEng_3fe62a3398e5f5d9,IndeedScraperUSAEng,Data,USA_ENGLISH,$65 - $80 hourly,UNKNOWN
NEW,"Business Analyst, Senior",Caliber Holdings LLC,"Lewisville, TX 75067",2024-10-20,"Observational skills, to validate data obtained via other techniques and expose new areas of opportunity. Assist in the acquisition and merger process to include data conversions and process re…","Job types: Full-time
Benefits: Health insurance, Dental insurance, 401(k), Vision insurance, Opportunities for advancement
Job types cc: Full-time",https://www.indeed.com/m/viewjob?jk=3994c64334320a05,IndeedScraperUSAEng_3994c64334320a05,IndeedScraperUSAEng,Data,USA_ENGLISH,,UNKNOWN
NEW,Americas Tax Technology Group - Business Analyst - Manager - OPEN LOCATIONS,EY,"Dallas, TX 75219",2024-10-21,"ATTG professionals will partner with our Tax professionals to develop supporting technology such as digital/mobile tools to improve internal operations, application of Robotics Process Automation (RPA…","Benefits: Paid holidays, Health insurance, Dental insurance, 401(k), Paid time off",https://www.indeed.com/m/viewjob?jk=6590863aacfe806f,IndeedScraperUSAEng_6590863aacfe806f,IndeedScraperUSAEng,Data,USA_ENGLISH,$85700 - $222500 yearly,UNKNOWN
NEW,นักเขียนอิสระไทย,Outlier,"Arlington, TX",2024-11-19,You should contact your tax and/or immigration advisor with specific questions regarding your circumstances.,"Job types: Contract
Job types cc: Contract, Freelance",https://www.indeed.com/m/viewjob?jk=f5df8747c25a7fe6,IndeedScraperUSAEng_f5df8747c25a7fe6,IndeedScraperUSAEng,Data,USA_ENGLISH,,UNKNOWN
NEW,Sr Data Steward/ Data Governance,Bright Vision Technologies,"Plano, TX 75025",2024-11-16,"Strong data management background who understands data, how to ingest data, proper data use/consumption, data quality, and stewardship. Advanced data analytical skills, including identification,…","Job types: Contract
Job types cc: Contract",https://www.indeed.com/m/viewjob?jk=e1cd16444c29b3bf,IndeedScraperUSAEng_e1cd16444c29b3bf,IndeedScraperUSAEng,Data,USA_ENGLISH,,UNKNOWN
NEW,Data Center Infrastructure Engineer,Zones LLC.,"Dallas, TX",2024-10-20,"Ability to travel to the data centers and customer sites when required. Operating in more than 120 countries, leveraging a robust portfolio, and utilizing the highest certification levels from key…","Job types: Full-time
Remote: Hybrid work
Benefits: Health insurance, Dental insurance, Paid time off, Vision insurance, 401(k) matching, Life insurance
Job types cc: Full-time",https://www.indeed.com/m/viewjob?jk=e6eb2347a1b0bcd7,IndeedScraperUSAEng_e6eb2347a1b0bcd7,IndeedScraperUSAEng,Data,USA_ENGLISH,$155000 - $170000 yearly,TEMPORARILY_REMOTE
NEW,Azure Event Hub & Data Engineer 5489975,Accenture,"Irving, TX 75039",2024-11-12,"Strong understanding of data modeling and working with data warehouses. Proficiency in data governance, data security, and compliance best practices within Azure.","Job types: Full-time
Job types cc: Full-time",https://www.indeed.com/m/viewjob?jk=ef136673558de026,IndeedScraperUSAEng_ef136673558de026,IndeedScraperUSAEng,Data,USA_ENGLISH,,UNKNOWN
NEW,IT Controls Analyst,D.R. Horton,"Arlington, TX",2024-10-20,The right candidate will work as a part of the IT Security Team and IT Controls Team reporting directly to the IT Cyber Security Risk Officer. It is engaged in the construction and sale of high…,"Job types: Full-time
Remote: Hybrid work
Benefits: Employee stock purchase plan, Health insurance, Dental insurance, 401(k), Vision insurance, Life insurance
Job types cc: Full-time
Schedules: On call",https://www.indeed.com/m/viewjob?jk=a57e72044ede02ac,IndeedScraperUSAEng_a57e72044ede02ac,IndeedScraperUSAEng,Data,USA_ENGLISH,,TEMPORARILY_REMOTE
NEW,IT Business Lead Analyst - VP,Citi,"Irving, TX",2024-10-20,"Proficiency in MS Office (Word, Excel, Visio, PowerPoint) with extensive experience using Excel for data analysis. The IT Business Business Lead Analyst is responsible for liaising between business…","Job types: Full-time
Benefits: Paid holidays, Disability insurance, Health insurance, Dental insurance, 401(k), Paid time off, Vision insurance
Job types cc: Full-time",https://www.indeed.com/m/viewjob?jk=25f6f64ded9cfc85,IndeedScraperUSAEng_25f6f64ded9cfc85,IndeedScraperUSAEng,Data,USA_ENGLISH,$114720 - $172080 yearly,UNKNOWN
NEW,Data Science Manager - Travel & Hospitality,Accenture,"Irving, TX 75039",2024-10-20,"Develop custom prescriptive and AI/ML models based on in-depth understanding of underlying data, data structures, and business problems to ensure analytics deliverables meet client needs.","Job types: Full-time
Job types cc: Full-time",https://www.indeed.com/m/viewjob?jk=9903095bd6f228df,IndeedScraperUSAEng_9903095bd6f228df,IndeedScraperUSAEng,Data,USA_ENGLISH,,UNKNOWN
NEW,DB Specialist,amdocs,"Plano, TX",2024-10-20,"Must have 6+ years’ experience on Oracle database installation, upgrade, migrate, data guard, backup/recovery as an Oracle DBA and SQL knowledge. The DB specialist have the ultimate responsibility of…",,https://www.indeed.com/m/viewjob?jk=6800777cf7b09430,IndeedScraperUSAEng_6800777cf7b09430,IndeedScraperUSAEng,Data,USA_ENGLISH,,UNKNOWN
NEW,Info Governance and Privacy - Data Governance & Data Engineering Manager,PRICE WATERHOUSE COOPERS,"Dallas, TX",2024-10-20,Knowing how to load data into data model; Having experience deploying data lineage and data flow inventory solutions; Demonstrating experience implementing structured data archiving and data lifecycle…,"Benefits: Paid holidays, Health insurance, Dental insurance, 401(k), Vision insurance",https://www.indeed.com/m/viewjob?jk=60fd91fe956a0d99,IndeedScraperUSAEng_60fd91fe956a0d99,IndeedScraperUSAEng,Data,USA_ENGLISH,$100000 - $232000 yearly,UNKNOWN
NEW,Principal Data/AI Enterprise Architect,ServiceNow,"Addison, TX 75001",2024-10-21,"Expertise in data management technologies, including data lakes, data warehouses, ETL processes, and big data platforms. Collaborate with business leaders, data scientists, data engineers, and…","Job types: Full-time
Job types cc: Full-time",https://www.indeed.com/m/viewjob?jk=f601995924f9f1c0,IndeedScraperUSAEng_f601995924f9f1c0,IndeedScraperUSAEng,Data,USA_ENGLISH,,UNKNOWN
NEW,Database Engineer with ACTIVE Top Secret security clearance,Geologics Corporation,"Richardson, TX 75080",2024-11-13,"RATE RANGE: $75/hr - $89/hr W2 (no health benefits while on contract). In this position you would be familiar with creating, updating, and managing Postgres databases and the code that interacts with…",Job types cc: Temp-to-hire,https://www.indeed.com/m/viewjob?jk=ed1c8835d79eeadc,IndeedScraperUSAEng_ed1c8835d79eeadc,IndeedScraperUSAEng,Data,USA_ENGLISH,$75 - $89 hourly,UNKNOWN
NEW,Power Market Analyst - 24321D,Enverus,"Dallas, TX 75201",2024-10-20,"Investigate and solve the underlying reasons behind data anomalies, errors, and inconsistencies in the data and services. Develop and maintain comprehensive benchmarks and quality standards across…","Job types: Full-time
Benefits: Opportunities for advancement
Job types cc: Full-time",https://www.indeed.com/m/viewjob?jk=338bc6afb7430758,IndeedScraperUSAEng_338bc6afb7430758,IndeedScraperUSAEng,Data,USA_ENGLISH,,UNKNOWN
NEW,Senior Data Engineer,Capgemini,"Irving, TX",2024-11-13,Ingested data from S3 into Snowflake Designing data pipelines. Design code and develop large projects using Oracle SQL Oracle Forms and PL/SQL Implement data storage solutions perform data modeling…,"Benefits: Paid parental leave, Paid holidays, Dental insurance, 401(k), Paid time off, Adoption assistance, Parental leave, Vision insurance",https://www.indeed.com/m/viewjob?jk=9767ef3be339c01a,IndeedScraperUSAEng_9767ef3be339c01a,IndeedScraperUSAEng,Data,USA_ENGLISH,,UNKNOWN
NEW,SEO Developer,NTT DATA,"Irving, TX 75039",2024-10-31,"Req ID: 302272 NTT DATA strives to hire exceptional, innovative and passionate individuals who want to grow with us. If you want to be part of an inclusive, adaptable, and forward-thinking…","Job types: Full-time
Job types cc: Full-time",https://www.indeed.com/m/viewjob?jk=1624c0b70b385587,IndeedScraperUSAEng_1624c0b70b385587,IndeedScraperUSAEng,Data,USA_ENGLISH,,UNKNOWN
NEW,Senior Linux Engineer,NTT DATA,"Irving, TX 75039",2024-10-20,"Great understanding of modern Linux operating system (RHEL distribution preferred),. OS performance tuning and troubleshooting, good grasp of Linux security, networking, auditing, and compliance…","Benefits: Health savings account, AD&D insurance, Disability insurance, Health insurance, Dental insurance, Paid time off, Vision insurance, 401(k) matching",https://www.indeed.com/m/viewjob?jk=45d2617d3911b99a,IndeedScraperUSAEng_45d2617d3911b99a,IndeedScraperUSAEng,Data,USA_ENGLISH,$70 - $70 hourly,UNKNOWN
NEW,Technical Project Manager,NTT DATA,"Irving, TX 75039",2024-11-13,Ability to work with people different countries in different Responsible to maintain data hygiene of JIRA items and other Project Management tools from Client. Data Ingestion/Framework/ETL tools.,Remote: Hybrid work,https://www.indeed.com/m/viewjob?jk=5f39c02c16d5fcfb,IndeedScraperUSAEng_5f39c02c16d5fcfb,IndeedScraperUSAEng,Data,USA_ENGLISH,,TEMPORARILY_REMOTE
NEW,"Tax-Data Governance, Analytics & Business Intelligence - Dallas-Vice President",Goldman Sachs,"Dallas, TX 75201",2024-10-21,"Tax analyzes and supports the activities, operations, reporting obligations and transactions of the firm’s business lines. We’re a team of specialists charged with managing the firm’s worldwide taxes…",,https://www.indeed.com/m/viewjob?jk=bea1b671d59e7cc9,IndeedScraperUSAEng_bea1b671d59e7cc9,IndeedScraperUSAEng,Data,USA_ENGLISH,,UNKNOWN
NEW,Senior UAS Pilot/Data Analyst,Weston Solutions,"Frisco, TX 75034",2024-11-06,A background in geospatial and data analysis is required specifically with mapping data captured as part of UAS missions. This position requires a strong technical knowledge of the entire lifecycle of…,"Job types: Full-time
Benefits: Paid holidays, Health insurance, Dental insurance, Paid time off, Parental leave, Vision insurance, 401(k) matching
Job types cc: Full-time",https://www.indeed.com/m/viewjob?jk=3b2edea9117b4686,IndeedScraperUSAEng_3b2edea9117b4686,IndeedScraperUSAEng,Data,USA_ENGLISH,,UNKNOWN
NEW,AEM Software Development Specialist,NTT DATA,"Irving, TX 75039",2024-10-29,"About NTT DATA: NTT DATA is a $30 billion trusted global innovator of business and technology services. We serve 75% of the Fortune Global 100 and are committed to helping clients innovate,…","Benefits: Health savings account, AD&D insurance, Disability insurance, Health insurance, Dental insurance, Paid time off, Vision insurance, 401(k) matching",https://www.indeed.com/m/viewjob?jk=99a7064df520cfc3,IndeedScraperUSAEng_99a7064df520cfc3,IndeedScraperUSAEng,Data,USA_ENGLISH,$62 - $62 hourly,UNKNOWN
NEW,General Manager-LGS Media & Data,Sabre,"Dallas-Fort Worth, TX",2024-10-20,"Sabre is a technology company that powers the global travel industry. By leveraging next-generation technology, we create global technology solutions that take on the biggest opportunities and solve…","Job types: Full-time
Remote: Remote
Job types cc: Full-time",https://www.indeed.com/m/viewjob?jk=cba428504c88e59a,IndeedScraperUSAEng_cba428504c88e59a,IndeedScraperUSAEng,Data,USA_ENGLISH,,FULLY_REMOTE
NEW,Pricing Specialist,Republic National Distributing Company,"Grand Prairie, TX 75050",2024-11-05,"Perform Data Maintenance: Conduct routine data cleanup tasks to uphold the quality and integrity of pricing data, including creating and ending deals and managing discontinued items.","Benefits: Paid training, Paid parental leave, Paid holidays, Disability insurance, Health insurance, Dental insurance, Happy hour, Paid time off, Parental leave, Vision insurance, 401(k) matching, Life insurance",https://www.indeed.com/m/viewjob?jk=a39110a7894c3dab,IndeedScraperUSAEng_a39110a7894c3dab,IndeedScraperUSAEng,Data,USA_ENGLISH,$39300 - $56200 yearly,UNKNOWN
NEW,"Data Center Engineer, IT Infrastructure",Intone Networks,"Fort Worth, TX 76155",2024-10-20,"Data Center Engineer, IT Infrastructure IT - Product Data Center (5-7 years of experience) All candidates will need the following. • Familiarity with workflow and ITSM tools and ticketing systems •…",,https://www.indeed.com/m/viewjob?jk=6effb2f9ee129f27,IndeedScraperUSAEng_6effb2f9ee129f27,IndeedScraperUSAEng,Data,USA_ENGLISH,,UNKNOWN
NEW,Implementation Developer Technical Lead,Smart Data Solutions LLC,"Plano, TX 75024",2024-10-20,Smart Data Solutions (SDS) is a technology leader in healthcare process automation and interoperability. We are seeking to add an Implementation Developer Technical Lead to our rapidly growing…,"Benefits: Paid holidays, Disability insurance, Health insurance, Paid time off, 401(k) matching",https://www.indeed.com/m/viewjob?jk=5476194400cbe463,IndeedScraperUSAEng_5476194400cbe463,IndeedScraperUSAEng,Data,USA_ENGLISH,,UNKNOWN
NEW,Data Center Electrical Design Engineer,Critical Project Services LLC,"Dallas, TX 75248",2024-11-16,The Date Center Electrical Design Engineer will develop and manage the design of electrical infrastructure and related systems for complex data centers. The incumbent will coordinate and support the…,"Job types: Full-time
Job types cc: Full-time",https://www.indeed.com/m/viewjob?jk=bfea84d62cbd4e6c,IndeedScraperUSAEng_bfea84d62cbd4e6c,IndeedScraperUSAEng,Data,USA_ENGLISH,,UNKNOWN
