status,title,company,location,date,blurb,tags,link,id,provider,query,locale,wage,remotenessNEW,Logistics Business Analyst,Temco Logistics,"Dallas, TX",2024-10-20,"Ability to review the region’s performance metrics, inventory, and track the location’s vehicle fleet, then analyze the data and present findings. Temco Logistics has been an experienced provider of…","Job types: Full-time
Shifts: 8 hour shift
Benefits: Health insurance, Dental insurance, 401(k), Vision insurance, 401(k) matching, Life insurance
Job types cc: Full-time
Schedules: 8 hour shift, Monday to Friday",https://www.indeed.com/m/viewjob?jk=db86670042fa9b34,IndeedScraperUSAEng_db86670042fa9b34,IndeedScraperUSAEng,Data,USA_ENGLISH,$90000 - $95000 yearly,UNKNOWN
NEW,"Manager, Strategic Sourcing - Commodities & Data Analytics","7-Eleven, Inc.","Irving, TX 75063",2024-10-20,"Support of Indirect Sourcing Team in RFx, Negotiations with data analytics etc. Experience: Minimum of 5 years in utilizing data analytics to drive business decisions.","Job types: Full-time
Job types cc: Full-time",https://www.indeed.com/m/viewjob?jk=25d3c33898e26863,IndeedScraperUSAEng_25d3c33898e26863,IndeedScraperUSAEng,Data,USA_ENGLISH,,UNKNOWN
NEW,Data Entry/Customer Service,Loyalty Methods Inc,"Irving, TX 75038",2024-11-08,"Utilize Microsoft Office applications, including Excel, for data entry tasks, including the use of pivot tables for data analysis. Perform regular audits of data to ensure integrity and accuracy.","Job types: Full-time
Shifts: 10 hour shift
Benefits: Vision insurance
Job types cc: Full-time
Schedules: 10 hour shift, Monday to Friday",https://www.indeed.com/m/viewjob?jk=500e955ddbd70b0e,IndeedScraperUSAEng_500e955ddbd70b0e,IndeedScraperUSAEng,Data,USA_ENGLISH,$16.45 - $17.35 hourly,UNKNOWN
NEW,Data Steward,Knauf Insulation,"McGregor, TX",2024-10-20,Maintain documentation related to master data creation and maintenance. Review material master data on a regular basis to identify and correct inaccuracies.,"Job types: Full-time
Benefits: Paid parental leave, Health insurance, Dental insurance, Tuition reimbursement, Parental leave, Employee assistance program, Vision insurance, 401(k) matching, Life insurance
Job types cc: Full-time",https://www.indeed.com/m/viewjob?jk=9c8cd284c03d932d,IndeedScraperUSAEng_9c8cd284c03d932d,IndeedScraperUSAEng,Data,USA_ENGLISH,$26.4 - $26.4 hourly,UNKNOWN
NEW,Software & Data Developer,"Gemini, Inc.","Garland, TX 75041",2024-11-09,"You’ll be proficient in PHP, web development technologies, and have a strong foundation in database design and data modeling. You’ll work with many teams to design, develop, test and document the…","Job types: Full-time
Benefits: Profit sharing, Paid holidays, Disability insurance, Health insurance, Dental insurance, Tuition reimbursement, Paid time off, Vision insurance, Life insurance
Job types cc: Full-time",https://www.indeed.com/m/viewjob?jk=5795271c9d2a2d73,IndeedScraperUSAEng_5795271c9d2a2d73,IndeedScraperUSAEng,Data,USA_ENGLISH,,UNKNOWN
NEW,Data Analyst (Aviation Analytics),DFW Airport,"Dallas-Fort Worth, TX 75261",2024-11-02,"Organizes trade statistics, airport data and research findings into narrative and graphic reports for presentation to airport management. Bachelor's degree in marketing, international business,…",,https://www.indeed.com/m/viewjob?jk=1f053a0c07c173db,IndeedScraperUSAEng_1f053a0c07c173db,IndeedScraperUSAEng,Data,USA_ENGLISH,,UNKNOWN
NEW,Operations Supervisor--Data Center (Dallas),NTI Connect LLC,"Dallas, TX 75247",2024-10-20,We are currently seeking an Operations Supervisor - Datacenter that will be a critical member of a U.S.-based global systems integrator providing technology solutions and services for commercial and…,"Job types: Full-time
Job types cc: Permanent, Full-time",https://www.indeed.com/m/viewjob?jk=50a9ec1e42bec960,IndeedScraperUSAEng_50a9ec1e42bec960,IndeedScraperUSAEng,Data,USA_ENGLISH,$35 - $45 hourly,UNKNOWN
NEW,Associate Civil Project Manager - Data Center,Olsson,"Plano, TX",2024-10-20,The large hyperscale data center campuses we design throughout the U.S. will give you the opportunity to work on some of the largest and most complex engineering-driven projects being built today.,"Job types: Full-time
Remote: Hybrid work
Benefits: Wellness program, Health insurance, Dental insurance, Paid time off, Vision insurance, 401(k) matching, Employee stock ownership plan
Job types cc: Full-time",https://www.indeed.com/m/viewjob?jk=d835d70b6cd03772,IndeedScraperUSAEng_d835d70b6cd03772,IndeedScraperUSAEng,Data,USA_ENGLISH,,TEMPORARILY_REMOTE
NEW,Data Scientist,L&T Technology Services,"Plano, TX",2024-10-20,"5+ years of experience in Python using common data science libraries such as scikit-learn and Databricks. 3+ years of experience applying NLP (transformers, gpt, etc) in a production setting using…",,https://www.indeed.com/m/viewjob?jk=493724232038bceb,IndeedScraperUSAEng_493724232038bceb,IndeedScraperUSAEng,Data,USA_ENGLISH,,UNKNOWN
NEW,Data and Technology Manager - Tax,Caterpillar,"Irving, TX",2024-11-16,"Experience working with data, including SQL, data warehouses and various dashboard applications. Develop and maintain data strategy and governance, including control checks with system leads for…","Job types: Full-time
Remote: Hybrid work
Benefits: Paid holidays, Health insurance, Dental insurance, 401(k), Vision insurance, Benefits from day one
Job types cc: Full-time",https://www.indeed.com/m/viewjob?jk=eaeba75038ac73e8,IndeedScraperUSAEng_eaeba75038ac73e8,IndeedScraperUSAEng,Data,USA_ENGLISH,,TEMPORARILY_REMOTE
NEW,Customer Database Engineer,At Home,"Coppell, TX 75019",2024-10-23,"The ideal candidate will possess strong data engineering skills, including the design and development of data pipelines for seamless data ingestion. This individual will also ensure data validation to…","Job types: Full-time
Job types cc: Full-time",https://www.indeed.com/m/viewjob?jk=facfd2d49c7bedc2,IndeedScraperUSAEng_facfd2d49c7bedc2,IndeedScraperUSAEng,Data,USA_ENGLISH,,UNKNOWN
NEW,Data Integration Specialist,The Potter's House,"Dallas, TX 75236",2024-10-31,"Handle complex data requests, reports, and predictive data modeling. Collaborate with cross-functional teams to understand data requirements and implement automated data pipelines.","Job types: Full-time
Shifts: 8 hour shift
Benefits: Health insurance, Dental insurance, 401(k), Flexible spending account, Tuition reimbursement, Paid time off, Employee assistance program, Vision insurance, 401(k) matching, Life insurance
Job types cc: Full-time
Schedules: 8 hour shift, Monday to Friday",https://www.indeed.com/m/viewjob?jk=719a332bb9f2d9f2,IndeedScraperUSAEng_719a332bb9f2d9f2,IndeedScraperUSAEng,Data,USA_ENGLISH,,UNKNOWN
NEW,"Director, Data Architecture",Fidelity Investments,"Westlake, TX 76262",2024-10-20,"Proficiency at understanding enterprise data architecture concepts, data modeling, lineage, data governance and design techniques. Deep technical foundation: Drives the data architecture technology…",,https://www.indeed.com/m/viewjob?jk=e593f9f3d59fbd0c,IndeedScraperUSAEng_e593f9f3d59fbd0c,IndeedScraperUSAEng,Data,USA_ENGLISH,,UNKNOWN
NEW,Enterprise Geospatial Data Administrator,H-E-B,"Dallas, TX 75220",2024-10-20,"Demonstrated expertise in designing data schemas/architecture that meet geographic data standards. Serves as the senior technical lead on GIS data architecture, deployment strategies, and Geospatial…","Job types: Full-time
Job types cc: Full-time
Schedules: Extended hours",https://www.indeed.com/m/viewjob?jk=e0a072916426baaf,IndeedScraperUSAEng_e0a072916426baaf,IndeedScraperUSAEng,Data,USA_ENGLISH,,UNKNOWN
NEW,Data Scientist,Sally Beauty Holdings,"Denton, TX",2024-10-31,"Work closely with data engineers and platform architects to implement robust data pipelines, enabling real-time and batch decisioning solutions. Proven experience in building scalable data pipelines…","Remote: Hybrid work
Benefits: Store discount, Paid holidays, Health insurance, Dental insurance, Tuition reimbursement, Vision insurance, 401(k) matching, Life insurance",https://www.indeed.com/m/viewjob?jk=b59347b51c226f22,IndeedScraperUSAEng_b59347b51c226f22,IndeedScraperUSAEng,Data,USA_ENGLISH,,TEMPORARILY_REMOTE
NEW,Data Scientist,ITCommence Inc,"Dallas, TX 75202",2024-11-18,"Familiarity with big data tools like Apache Spark, Hadoop, or Hive for large-scale data processing. Ability to communicate complex data insights to stakeholders at all levels and collaborate…","Job types: Full-time, Contract
Shifts: 8 hour shift
Benefits: Health insurance, Dental insurance, 401(k), Paid time off, Vision insurance, Referral program
Job types cc: Full-time, Contract
Schedules: 8 hour shift",https://www.indeed.com/m/viewjob?jk=485ae86577c26b22,IndeedScraperUSAEng_485ae86577c26b22,IndeedScraperUSAEng,Data,USA_ENGLISH,$75000 - $85000 yearly,UNKNOWN
NEW,Space Planning Analyst,7-Eleven,"Irving, TX",2024-10-23,Expert knowledge of Excel or other data management/analysis technologies. Ability to communicate/translate complicated data analysis insights into actions.,,https://www.indeed.com/m/viewjob?jk=ef6fec8cd95ce7b1,IndeedScraperUSAEng_ef6fec8cd95ce7b1,IndeedScraperUSAEng,Data,USA_ENGLISH,,UNKNOWN
NEW,"Data Center Project Lead (Dallas, TX)",Network Connex,"Dallas, TX 75247",2024-10-29,"By harnessing regional strengths and operational synergies, our teams deliver digital communications infrastructure services for fiber and wireless network service providers, data center operators,…","Benefits: AD&D insurance, Paid holidays, Dental insurance, 401(k), Tuition reimbursement, Paid time off, Life insurance",https://www.indeed.com/m/viewjob?jk=dded98de88817942,IndeedScraperUSAEng_dded98de88817942,IndeedScraperUSAEng,Data,USA_ENGLISH,$30 - $37 hourly,UNKNOWN
NEW,Senior Data Scientist- React and Java,JPMorganChase,"Plano, TX 75024",2024-10-20,"The team encompasses a variety of disciplines from data governance and strategy to reporting, data science and machine learning. Help to develop frameworks to ensure cross-platform data & logic…","Job types: Full-time
Remote: Hybrid work
Benefits: Health insurance, Tuition reimbursement, Work from home, Retirement plan
Job types cc: Full-time
Schedules: Monday to Friday",https://www.indeed.com/m/viewjob?jk=599c61f418c23ae2,IndeedScraperUSAEng_599c61f418c23ae2,IndeedScraperUSAEng,Data,USA_ENGLISH,,TEMPORARILY_REMOTE
NEW,SR. STATISTICAL PROGRAMMER ANALYST,TruMinds Clinical,"Frisco, TX 75034",2024-10-20,"DUTIES: Create tables, lists, and figures as needed for clinical research using SAS GRAPH, SAS MACRO, SAS STAT, SAS ODS, Python, and Tableau; Using SAS Compare procedures, validate SAS programs, logs,…","Job types: Full-time
Job types cc: Full-time
Schedules: Monday to Friday",https://www.indeed.com/m/viewjob?jk=bf0577cc86f779ed,IndeedScraperUSAEng_bf0577cc86f779ed,IndeedScraperUSAEng,Data,USA_ENGLISH,$81286 - $-1 yearly,UNKNOWN
NEW,Clinical Data Manager I,Cook Children's Health Care System,"Fort Worth, TX 76104",2024-11-06,The Clinical Data Manager I manages all aspects of clinical data. This individual Acts as a resource for other research staff evaluating study-related data. First Shift (United States of America).,"Job types: Full-time
Job types cc: Full-time",https://www.indeed.com/m/viewjob?jk=3684848dcba4a189,IndeedScraperUSAEng_3684848dcba4a189,IndeedScraperUSAEng,Data,USA_ENGLISH,,UNKNOWN
NEW,Real Estate Data Analyst,McKesson,"Irving, TX 75039",2024-11-09,"Exposure to data governance programs to optimize data freshness, quality, and accuracy. The RE Data Analyst will also support the Director of Operations Technology with requirements gathering for new…",,https://www.indeed.com/m/viewjob?jk=d9a8ab51533e7bbd,IndeedScraperUSAEng_d9a8ab51533e7bbd,IndeedScraperUSAEng,Data,USA_ENGLISH,$79900 - $133100 yearly,UNKNOWN
NEW,Superintendent,T5 Data Centers,"Dallas, TX",2024-11-02,"The Superintendent is responsible for providing on-site coordination for all phases of T5 Data Center construction projects, including coordinating subcontractors, material and equipment, ensuring…","Job types: Full-time
Benefits: Paid holidays, Health insurance, Dental insurance, Paid time off, Vision insurance, 401(k) matching
Job types cc: Full-time",https://www.indeed.com/m/viewjob?jk=2d412db43e324829,IndeedScraperUSAEng_2d412db43e324829,IndeedScraperUSAEng,Data,USA_ENGLISH,,UNKNOWN
NEW,Marketing data entry,Loyalty Methods Inc,"Irving, TX 75038",2024-11-05,Collect and organize data for reporting purposes. Basic math skills for data verification and calculations. Input and update data into databases with high accuracy.,"Job types: Full-time
Shifts: 10 hour shift, Day shift
Benefits: Paid time off
Job types cc: Full-time
Schedules: 10 hour shift, Day shift",https://www.indeed.com/m/viewjob?jk=d3dcd124fcd6aca9,IndeedScraperUSAEng_d3dcd124fcd6aca9,IndeedScraperUSAEng,Data,USA_ENGLISH,$16.45 - $17.35 hourly,UNKNOWN
NEW,Analytics Lead - A6726,Nisum,"Plano, TX",2024-10-20,"Collaborate and assist the IT Technical team with the management of data sources; ensure data quality, and optimize the data retrieval processes. Core experience would include - ingesting the data…","Job types: Full-time
Benefits: AD&D insurance, Paid holidays, Disability insurance, Health insurance, Dental insurance, Paid time off, Vision insurance, 401(k) matching, Employee discount
Job types cc: Full-time",https://www.indeed.com/m/viewjob?jk=6cd4c474dc53ef8f,IndeedScraperUSAEng_6cd4c474dc53ef8f,IndeedScraperUSAEng,Data,USA_ENGLISH,$130000 - $140000 yearly,UNKNOWN
NEW,Data Engineer,Charles Schwab,"Southlake, TX",2024-11-16,"2+ years writing automated unit tests for data interfaces & data pipelines. Ability to translate relational and non-relational data into dimensional data models. Health, dental, and vision insurance.","Remote: Hybrid work
Benefits: Paid parental leave, Employee stock purchase plan, Health insurance, Dental insurance, Tuition reimbursement, Parental leave, Vision insurance, 401(k) matching, Sabbatical",https://www.indeed.com/m/viewjob?jk=1468bf8a9b098f89,IndeedScraperUSAEng_1468bf8a9b098f89,IndeedScraperUSAEng,Data,USA_ENGLISH,$87800 - $195200 yearly,TEMPORARILY_REMOTE
NEW,Electrical Superintendent- Data Center,Miller Electric Company,"Dallas, TX 75234",2024-10-28,"The Field Superintendent must be motivated, be willing to lead and instruct others, and be participatory in a team environment. This position requires routine interaction and communication between…","Benefits: Profit sharing, AD&D insurance, Paid holidays, Disability insurance, Health insurance, Dental insurance, Flexible spending account, Tuition reimbursement, Life insurance, Prescription drug insurance",https://www.indeed.com/m/viewjob?jk=677cc80e59a5d4bc,IndeedScraperUSAEng_677cc80e59a5d4bc,IndeedScraperUSAEng,Data,USA_ENGLISH,,UNKNOWN
NEW,Master Data Lead Escalations Analyst,McKesson,"Irving, TX 75039",2024-11-14,"Business Experience – 2+ years’ experience in master data or data governance, process improvement experience. Provide feedback to team, management, and stakeholders on processes impacting compliance…",,https://www.indeed.com/m/viewjob?jk=b356eaed3c01b4ca,IndeedScraperUSAEng_b356eaed3c01b4ca,IndeedScraperUSAEng,Data,USA_ENGLISH,$91400 - $152300 yearly,UNKNOWN
NEW,Customer Service/Data Entry,"KB Industries, Inc.","Plano, TX 75074",2024-11-12,"Tell us about your data entry experience. Receive inbound phone calls, data entry, customer support, and troubleshooting simple equipment and software issues over the phone (training provided).","Job types: Full-time
Shifts: 8 hour shift, No nights, Day shift
Benefits: Employee discount, Referral program, Retirement plan
Job types cc: Full-time
Schedules: 8 hour shift, No weekends, No nights, Day shift, Monday to Friday, Weekends & holidays off",https://www.indeed.com/m/viewjob?jk=976bc8ebe263daa3,IndeedScraperUSAEng_976bc8ebe263daa3,IndeedScraperUSAEng,Data,USA_ENGLISH,$16.5 - $20 hourly,UNKNOWN
NEW,GIS Data Administrator,NCTCOG,"Arlington, TX 76005",2024-10-24,"Experience with geospatial data including writing original queries of data in a geospatial environment for presentation, reporting, and analysis. Review logs, perform data queries, recreate steps, and…","Job types: Full-time
Remote: Hybrid work
Benefits: Health insurance, Dental insurance, Vision insurance, Flexible schedule, Retirement plan
Job types cc: Full-time
Schedules: Evenings as needed",https://www.indeed.com/m/viewjob?jk=b230ad3f3ecafe67,IndeedScraperUSAEng_b230ad3f3ecafe67,IndeedScraperUSAEng,Data,USA_ENGLISH,$76950 - $88100 yearly,TEMPORARILY_REMOTE
NEW,Data Center Technician,Vertafore,"Dallas, TX",2024-10-20,"Familiarity with data center operations. Located in and around Vertafore’s data center in DFW area. The person will support physical hardware, network devices and cables, the storage hardware and…","Job types: Full-time
Remote: Hybrid work
Benefits: Commuter assistance, Health savings account, AD&D insurance, Disability insurance, Health insurance, Dental insurance, 401(k), Flexible spending account, Tuition reimbursement, Adoption assistance, Work from home, Parental leave, Employee assistance program, Vision insurance, 401(k) matching, Pet insurance
Job types cc: Full-time
Schedules: On call",https://www.indeed.com/m/viewjob?jk=2d3f94445dd99c3a,IndeedScraperUSAEng_2d3f94445dd99c3a,IndeedScraperUSAEng,Data,USA_ENGLISH,$50000 - $50000 yearly,TEMPORARILY_REMOTE
NEW,"Senior Analyst, Data Science",Toyota,"Plano, TX 75024",2024-11-06,Hands-on experience building and optimizing data solutions using Python. Participate actively in project planning and prioritization sessions to ensure data initiatives align with business goals.,"Job types: Full-time
Remote: Hybrid work
Benefits: Paid holidays, Relocation assistance, Health insurance, Flexible spending account, Tuition reimbursement, Paid time off, Flextime, 401(k) matching
Job types cc: Full-time
Schedules: Flextime",https://www.indeed.com/m/viewjob?jk=78db30062a9f6595,IndeedScraperUSAEng_78db30062a9f6595,IndeedScraperUSAEng,Data,USA_ENGLISH,,TEMPORARILY_REMOTE
NEW,Analyst - Membership,"Vizient, Inc.","Irving, TX",2024-10-20,"Research relevant data sources to avoid inputting duplicated data. You will ensure data quality of provider data, including provider demographics, classification, pharmacy designation, and other…",,https://www.indeed.com/m/viewjob?jk=661105fb5c178bbd,IndeedScraperUSAEng_661105fb5c178bbd,IndeedScraperUSAEng,Data,USA_ENGLISH,$51900 - $82900 yearly,UNKNOWN
NEW,Director AI Delivery - CARE Commercial Enterprise Delivery,Southwest Airlines,"Dallas, TX 75235",2024-11-13,"Data pipeline, data science and/or relevant programming. Data analysis, advanced analytics, data science, machine learning, artificial intelligence, and automation project experience.","Job types: Full-time
Remote: Hybrid work
Benefits: Health insurance, 401(k) matching
Job types cc: Full-time",https://www.indeed.com/m/viewjob?jk=7f01c8e70e00a0de,IndeedScraperUSAEng_7f01c8e70e00a0de,IndeedScraperUSAEng,Data,USA_ENGLISH,$198100 - $220100 yearly,TEMPORARILY_REMOTE
NEW,Sr. Data Scientist - Healthcare AI & Analytics,MedeAnalytics,"Dallas, TX",2024-10-20,"Data Cleaning and Exploration: Select appropriate datasets, process and cleanse data for analysis, and develop data structures to organize, collect, and standardize data.","Benefits: AD&D insurance, Paid holidays, Disability insurance, Health insurance, Dental insurance, Paid time off, Employee assistance program, Vision insurance, 401(k) matching, Referral program",https://www.indeed.com/m/viewjob?jk=b3219c8bcd10fbe9,IndeedScraperUSAEng_b3219c8bcd10fbe9,IndeedScraperUSAEng,Data,USA_ENGLISH,$140000 - $180000 yearly,UNKNOWN
NEW,Application Management Specialist,NTT DATA,"Plano, TX 75024",2024-11-11,"This resource will be an integral part of daily development and service work for our programs. Strong mainframe Cobol development skills. Knowledge of batch job scheduling tools and processes (i.e.,…","Remote: Remote
Benefits: Health savings account, AD&D insurance, Disability insurance, Health insurance, Dental insurance, Paid time off, Vision insurance, 401(k) matching",https://www.indeed.com/m/viewjob?jk=8968c53da3f58aa6,IndeedScraperUSAEng_8968c53da3f58aa6,IndeedScraperUSAEng,Data,USA_ENGLISH,$45 - $52 hourly,FULLY_REMOTE
NEW,Lead Advanced Analytics,AT&T,"Dallas, TX",2024-11-19,"This position analyzes data from multiple sources including data lakes, internal/external data, data warehouses, etc. Demonstrates the ability to extract, load, and transform data from multiple…","Job types: Full-time
Benefits: Paid parental leave, Caregiver leave, Paid holidays, Health insurance, Dental insurance, 401(k), Tuition reimbursement, Paid time off, Parental leave, Employee assistance program, Vision insurance, Employee discount
Job types cc: Full-time",https://www.indeed.com/m/viewjob?jk=c8a160879776e23c,IndeedScraperUSAEng_c8a160879776e23c,IndeedScraperUSAEng,Data,USA_ENGLISH,$130700 - $196100 yearly,UNKNOWN
NEW,"Director, Data Modeling",Fidelity Investments,"Westlake, TX 76262",2024-10-20,"The Team, Workplace Investments data modeling team, partners with the project teams to deliver practical & resilient data models and database designs that meet business needs while adhering to…",,https://www.indeed.com/m/viewjob?jk=04db540f54577c8f,IndeedScraperUSAEng_04db540f54577c8f,IndeedScraperUSAEng,Data,USA_ENGLISH,,UNKNOWN
NEW,Data Governance Manager,McKesson,"Irving, TX 75038",2024-10-20,"This role collaborates across departments to maintain data consistency and quality, contributing to the development of data governance and standards policies.",,https://www.indeed.com/m/viewjob?jk=1d3cf96ffb1d6666,IndeedScraperUSAEng_1d3cf96ffb1d6666,IndeedScraperUSAEng,Data,USA_ENGLISH,$111300 - $185500 yearly,UNKNOWN
NEW,Data Processing & Fraud Specialist,Point Bank,"Denton, TX 76201",2024-10-25,"Includes conducting fraud investigations, analyzing data, and maintaining accurate fraud tracking reports to ensure monthly metrics are accurately reported. Identify and escalate priority issues.","Job types: Full-time
Job types cc: Full-time",https://www.indeed.com/m/viewjob?jk=d69e83b57f76f24b,IndeedScraperUSAEng_d69e83b57f76f24b,IndeedScraperUSAEng,Data,USA_ENGLISH,,UNKNOWN
NEW,"Software Engineer, AI Engine / HPC",Topaz Labs,"Dallas, TX 75254",2024-11-14,"54,000 new photos are taken every second, and 600 hours of video are uploaded every minute. At Topaz Labs, we help over 1 million paying customers (including teams at Apple, Netflix, and NASA)…","Job types: Full-time
Benefits: Profit sharing, Health insurance, Dental insurance, Paid time off, Vision insurance, 401(k) matching
Job types cc: Full-time",https://www.indeed.com/m/viewjob?jk=12a109574aa87f07,IndeedScraperUSAEng_12a109574aa87f07,IndeedScraperUSAEng,Data,USA_ENGLISH,$110000 - $150000 yearly,UNKNOWN
NEW,Sr. Data Architect,McKesson,"Irving, TX 75039",2024-11-15,"Manage creation of data design deliverables including data models, data diagrams, data flows and corresponding data dictionary documentation. Influence projects to make decisions related to data…",,https://www.indeed.com/m/viewjob?jk=3260d0a74c8b6054,IndeedScraperUSAEng_3260d0a74c8b6054,IndeedScraperUSAEng,Data,USA_ENGLISH,$130400 - $217300 yearly,UNKNOWN
NEW,Data Scientist,Cyborgwave,"Dallas, TX",2024-10-24,"Conduct exploratory data analysis to identify patterns, correlations, and anomalies in data, driving data-driven decision-making within the organization.",,https://www.indeed.com/m/viewjob?jk=6f19577a289a0792,IndeedScraperUSAEng_6f19577a289a0792,IndeedScraperUSAEng,Data,USA_ENGLISH,,UNKNOWN
NEW,Senior Data Engineer,McKesson,"Irving, TX 75063",2024-10-20,"Good understanding of data engineering principles, data architecture, and database management. Work on a small team to design and implement scalable and eAicient data pipelines to support various data…",,https://www.indeed.com/m/viewjob?jk=163f187933ecc739,IndeedScraperUSAEng_163f187933ecc739,IndeedScraperUSAEng,Data,USA_ENGLISH,$110800 - $184600 yearly,UNKNOWN
NEW,Reporting Analyst - Salesforce,"Alacura Medical Transportation Management, LLC","Dallas, TX 75243",2024-11-13,Conduct deep data analysis and data quality checklists utilizing SalesForce CRM Analytics. Knowledge of APIs and understanding of data exchange between systems.,"Job types: Full-time
Shifts: 8 hour shift, Day shift
Remote: Hybrid work
Benefits: Health insurance, Dental insurance, 401(k), Paid time off, Vision insurance, 401(k) matching, Life insurance
Job types cc: Full-time
Schedules: 8 hour shift, Day shift, Monday to Friday",https://www.indeed.com/m/viewjob?jk=edd9375906725d52,IndeedScraperUSAEng_edd9375906725d52,IndeedScraperUSAEng,Data,USA_ENGLISH,$70000 - $90000 yearly,TEMPORARILY_REMOTE
NEW,Entry-Level Business Analyst,Upen Group Inc,"Irving, TX 75038",2024-11-19,Start Your Journey as a Business Analyst at Upen Group. We’re seeking an Entry-Level Business Analyst* who’s ready to support projects and help improve business processes.,"Job types: Contract
Shifts: 8 hour shift
Remote: Hybrid work
Job types cc: Contract
Schedules: 8 hour shift",https://www.indeed.com/m/viewjob?jk=11637917c7154441,IndeedScraperUSAEng_11637917c7154441,IndeedScraperUSAEng,Data,USA_ENGLISH,$40000 - $60000 yearly,TEMPORARILY_REMOTE
