status,title,company,location,date,blurb,tags,link,id,provider,query,locale,wage,remoteness
NEW,Consumer & Community Horticulture Program Manager – Plant Database and Online Learning,North Carolina State University,"Raleigh, NC",2024-10-26,Working Title Consumer & Community Horticulture Program Manager – Plant Database and Online Learning. Anticipated Hiring Range Commensurate with Experience. Required License(s) or Certification(s).,"Job types: Full-time
Job types cc: Full-time
Schedules: Weekends as needed, Evenings as needed",https://www.indeed.com/m/viewjob?jk=7b6f9cd382ce30ef,IndeedScraperUSAEng_7b6f9cd382ce30ef,IndeedScraperUSAEng,Data,USA_ENGLISH,,UNKNOWN
NEW,Salesforce Analyst,Pearson,"Durham, NC 27722",2024-10-16,"Oversee data integrity in Salesforce by implementing data quality best practices, including data deduplication, cleansing, and validation. Knowledge of Salesforce reporting, dashboards, and data…",,https://www.indeed.com/m/viewjob?jk=6281a3f59e24681f,IndeedScraperUSAEng_6281a3f59e24681f,IndeedScraperUSAEng,Data,USA_ENGLISH,,UNKNOWN
NEW,Data Review Specialist,Eurofins USA PSS Insourcing Solutions,"Winston-Salem, NC",2024-10-14,Perform mathematical calculations as part of data review. Responsible for ensuring the integrity of laboratory data. Maintain the highest level of proficiency in terms of those duties and…,"Job types: Full-time
Benefits: Paid holidays, Disability insurance, Health insurance, Dental insurance, Vision insurance, 401(k) matching
Job types cc: Full-time
Schedules: Overtime, Monday to Friday",https://www.indeed.com/m/viewjob?jk=932405dc6a3a769a,IndeedScraperUSAEng_932405dc6a3a769a,IndeedScraperUSAEng,Data,USA_ENGLISH,,UNKNOWN
NEW,Data Management Specialist,ABB,"Cary, NC 27511",2024-10-29,"Each day, you will act as the US HR Data's point of contact and support master data management processes. Documenting, reviewing, and updating all work procedures pertaining to all aspects of data…","Job types: Full-time
Remote: Hybrid work
Job types cc: Full-time
Schedules: Monday to Friday",https://www.indeed.com/m/viewjob?jk=6f072609ebf842c0,IndeedScraperUSAEng_6f072609ebf842c0,IndeedScraperUSAEng,Data,USA_ENGLISH,,TEMPORARILY_REMOTE
NEW,"HR Shared Services Data Analyst - Raleigh, NC",Gilead Sciences,"Raleigh, NC",2024-10-31,"Ability to provide business analysis of data insights, data reporting and data analytics. We are looking for a candidate who enjoys helping employees and business stakeholders find answers to their HR…","Job types: Full-time
Benefits: Health insurance, Dental insurance, Paid time off, Vision insurance, Life insurance
Job types cc: Full-time",https://www.indeed.com/m/viewjob?jk=c26fc64a35dd3422,IndeedScraperUSAEng_c26fc64a35dd3422,IndeedScraperUSAEng,Data,USA_ENGLISH,$97495 - $126170 yearly,UNKNOWN
NEW,"Principal Statistical Programmer (Oncology), FSP",Fortrea,"Durham, NC",2024-11-02,"As a leading global contract research organization (CRO) with a passion for scientific rigor and decades of clinical development experience, Fortrea provides pharmaceutical, biotechnology, and medical…","Job types: Full-time
Remote: Remote
Benefits: Employee stock purchase plan, Disability insurance, Health insurance, Dental insurance, 401(k), Paid time off, Vision insurance
Job types cc: Full-time",https://www.indeed.com/m/viewjob?jk=e18c7982956514e8,IndeedScraperUSAEng_e18c7982956514e8,IndeedScraperUSAEng,Data,USA_ENGLISH,$110000 - $145000 yearly,FULLY_REMOTE
NEW,"Certified Pharmacy Technician (CPhT), Long Term Care, Data-Entry Technician","Windsor Point Pharmacy, Inc.","Clayton, NC 27520",2024-10-14,The ideal candidate will have a passion for patient care and possess the necessary skills to excel in a fast-paced healthcare environment. Assist pharmacists in preparing and dispensing medications.,"Job types: Full-time
Shifts: 8 hour shift, No nights, Day shift
Benefits: Free parking, Store discount, Health insurance, Dental insurance, Paid time off, Vision insurance, Employee discount, Life insurance, Prescription drug insurance, Paid sick time
Job types cc: Full-time
Schedules: 8 hour shift, No weekends, No nights, Day shift, Monday to Friday, Weekends & holidays off",https://www.indeed.com/m/viewjob?jk=26876b22ad7e7377,IndeedScraperUSAEng_26876b22ad7e7377,IndeedScraperUSAEng,Data,USA_ENGLISH,$16 - $20 hourly,UNKNOWN
NEW,Lead Business Intelligence Consultant,Wells Fargo,"Raleigh, NC",2024-11-07,"Perform data discovery and investigation to ensure that the data meets the business objectives. In this role, you will use your technical skills and knowledge of banking data to perform data…","Job types: Full-time
Remote: Hybrid work
Job types cc: Full-time
Schedules: Weekends as needed, Holidays",https://www.indeed.com/m/viewjob?jk=ecfc5cb0d88b73d4,IndeedScraperUSAEng_ecfc5cb0d88b73d4,IndeedScraperUSAEng,Data,USA_ENGLISH,,TEMPORARILY_REMOTE
NEW,HCM Business Analyst,North Carolina State University,"Raleigh, NC",2024-11-12,"Knowledge of relevant technical standards such as OIT change management/source control, Section 508 (accessibility), NC Records Retention and Disposition Standards, NC IT audit standards and any…","Job types: Full-time
Remote: Hybrid work
Job types cc: Full-time
Schedules: Weekends as needed, Monday to Friday",https://www.indeed.com/m/viewjob?jk=ae2899e697a7ba42,IndeedScraperUSAEng_ae2899e697a7ba42,IndeedScraperUSAEng,Data,USA_ENGLISH,$110000 - $118000 yearly,TEMPORARILY_REMOTE
NEW,Sr. IT Business Analyst - Corporate,Allucent,"Cary, NC 27513",2024-10-14,"Oversee data integrity, ensure proper data governance practices are followed, and support reporting needs for corporate systems. Experience with reporting tools and data analysis is a plus.","Job types: Full-time
Remote: Hybrid work
Benefits: Flexible schedule, Referral program
Job types cc: Full-time",https://www.indeed.com/m/viewjob?jk=c575685f6ec6384e,IndeedScraperUSAEng_c575685f6ec6384e,IndeedScraperUSAEng,Data,USA_ENGLISH,,TEMPORARILY_REMOTE
NEW,Senior Data Scientist I,RELX,"Raleigh, NC 27606",2024-10-14,Work with product leaders to apply data science solutions. Experience and ability to design and work within complex data models. Train robust NLP-based models a very large corpus of news and financial…,"Job types: Full-time
Job types cc: Full-time",https://www.indeed.com/m/viewjob?jk=ee637ea187ccec79,IndeedScraperUSAEng_ee637ea187ccec79,IndeedScraperUSAEng,Data,USA_ENGLISH,,UNKNOWN
NEW,"Sr Infrastructure Engineer - Winston Salem, NC Data Center - Onsite",Lowe's,"Winston-Salem, NC",2024-10-14,"2 Years Experience working in a data center. Move throughout all areas of a store, distribution, or data center facility with or without a reasonable accommodation.","Job types: Full-time
Job types cc: Full-time",https://www.indeed.com/m/viewjob?jk=03ea843b79f5941f,IndeedScraperUSAEng_03ea843b79f5941f,IndeedScraperUSAEng,Data,USA_ENGLISH,$92300 - $175400 yearly,UNKNOWN
NEW,Data Office Domain Lead,UCB,"Raleigh, NC 27617",2024-10-14,"Strong understanding of data management best practices, including data quality, data security, and data privacy. The successful candidate will implement best practices for data operations, data…",,https://www.indeed.com/m/viewjob?jk=07696e159c2c6b49,IndeedScraperUSAEng_07696e159c2c6b49,IndeedScraperUSAEng,Data,USA_ENGLISH,$142000 - $186000 yearly,UNKNOWN
NEW,Business Analyst - Reimbursement,WakeMed Health & Hospitals,"Raleigh, NC 27604",2024-10-31,"Overview: The Business Analyst, Reimbursement is responsible for audit and analysis of accounts receivable, reserves, gross revenue and patient revenue deductions.","Job types: Full-time
Job types cc: Full-time",https://www.indeed.com/m/viewjob?jk=1fef8538ae1b9ec6,IndeedScraperUSAEng_1fef8538ae1b9ec6,IndeedScraperUSAEng,Data,USA_ENGLISH,,UNKNOWN
NEW,Supervisor of ERP Data Engineer & Analytics,Labcorp,"Burlington, NC 27215",2024-10-14,"Collaborate with data professionals and analysts to understand data requirements and implement solutions for data modeling, analysis, and visualization. Proficiency in SQL, MySQL, and PLSQL.","Job types: Full-time
Remote: Hybrid work
Benefits: Employee stock purchase plan, Disability insurance, Health insurance, Dental insurance, 401(k), Paid time off, Vision insurance
Job types cc: Full-time",https://www.indeed.com/m/viewjob?jk=455c84e2af990a46,IndeedScraperUSAEng_455c84e2af990a46,IndeedScraperUSAEng,Data,USA_ENGLISH,$90000 - $110000 yearly,TEMPORARILY_REMOTE
NEW,Data Management Technician - Corporate and Continuing Education,Fayetteville Technical Community College (E),"Fayetteville, NC",2024-11-06,Operate computer systems to produce a variety of statistical reports and summary data; update and maintain data files; operate associated peripheral equipment. Cafeteria Plan (IRS Code Section 125).,"Job types: Full-time
Benefits: Paid holidays, Health insurance, Dental insurance, Employee assistance program, Vision insurance, Retirement plan
Job types cc: Full-time",https://www.indeed.com/m/viewjob?jk=0984bd38d90eeaca,IndeedScraperUSAEng_0984bd38d90eeaca,IndeedScraperUSAEng,Data,USA_ENGLISH,$46811 - $-1 yearly,UNKNOWN
NEW,Data Science Programmer – NCCT CTMC,Wake Forest Baptist Health,"Winston-Salem, NC 27101",2024-11-13,"Familiarity with medical data, standards, and terminology a plus. Develop data preprocessing pipelines to ensure high-quality input for models and algorithms.","Job types: Full-time
Job types cc: Full-time",https://www.indeed.com/m/viewjob?jk=0ec9b91cf38c0e32,IndeedScraperUSAEng_0ec9b91cf38c0e32,IndeedScraperUSAEng,Data,USA_ENGLISH,,UNKNOWN
NEW,"Analyst, IT - OASIS Application Analyst",Duke University,"Durham, NC 27710",2024-10-14,"Ability to synthesize data from multiple (appropriate) sources and make sound decisions. Analyze data and prepare reports setting forth progress, trends, and recommendations.",,https://www.indeed.com/m/viewjob?jk=ad5cf25d741fa486,IndeedScraperUSAEng_ad5cf25d741fa486,IndeedScraperUSAEng,Data,USA_ENGLISH,,UNKNOWN
NEW,CSV and Data Integrity,Katalyst Healthcares & Life Sciences,"Durham, NC 27517",2024-10-14,"Strong knowledge of data integrity principles related to the FDA, MHRA, and EMEA guidelines. Evaluate computerized systems (including equipment with computerized components) for data integrity risks…","Job types: Contract
Job types cc: Contract",https://www.indeed.com/m/viewjob?jk=d642bdf23eb4762b,IndeedScraperUSAEng_d642bdf23eb4762b,IndeedScraperUSAEng,Data,USA_ENGLISH,,UNKNOWN
NEW,HCT & Cell Therapy Data Coord - Winston Salem,Novant Health,"Winston-Salem, NC 27103",2024-10-26,Travel Required: Charlotte & Winston-Salem. The HCT and Cellular Therapy Quality/Data Coordinators are an essential part of the quality assurance and process improvement activities of the…,,https://www.indeed.com/m/viewjob?jk=517b58b90d74c924,IndeedScraperUSAEng_517b58b90d74c924,IndeedScraperUSAEng,Data,USA_ENGLISH,,UNKNOWN
NEW,DATA MANAGER II,Guilford County Schools,"Greensboro, NC 27402",2024-11-04,Fair Labor Standards Act Classification: Non-Exempt. Starting Salary: $16.36 per hour.,"Job types: Full-time
Job types cc: Full-time",https://www.indeed.com/m/viewjob?jk=477fe992ab814bc5,IndeedScraperUSAEng_477fe992ab814bc5,IndeedScraperUSAEng,Data,USA_ENGLISH,$16.36 - $16.36 hourly,UNKNOWN
NEW,IT Business Intelligence/Data Analyst III,Winston-Salem State University,"Winston-Salem, NC 27110",2024-10-30,"Responsible for validating institutional data, identifying gaps in data, researching and recommending appropriate transformations of relevant data elements, research methods, and/or software tools to…","Job types: Full-time
Job types cc: Full-time
Schedules: Monday to Friday",https://www.indeed.com/m/viewjob?jk=c8c0aca02bd049b9,IndeedScraperUSAEng_c8c0aca02bd049b9,IndeedScraperUSAEng,Data,USA_ENGLISH,$87518 - $100000 yearly,UNKNOWN
NEW,Business Analyst Information Services,WakeMed Health & Hospitals,"Raleigh, NC 27604",2024-10-31,Overview: The Business Analyst is the financial liaison to operating managers and directors throughout the health system regarding planning for IT capital and/or major IT operational purchases.,"Job types: Full-time
Job types cc: Full-time",https://www.indeed.com/m/viewjob?jk=49c626a7ecd35b67,IndeedScraperUSAEng_49c626a7ecd35b67,IndeedScraperUSAEng,Data,USA_ENGLISH,,UNKNOWN
NEW,Sr Data Scientist,CVS Health,"Raleigh, NC 27601",2024-11-01,"Defines data science initiatives by utilizing data mining, data modeling, natural language processing, and machine learning techniques to extract data from multiple sources and deliver predictive…","Job types: Full-time
Remote: Remote
Benefits: Store discount, Employee stock purchase plan, Paid holidays, Disability insurance, Health insurance, Dental insurance, 401(k), Tuition reimbursement, Paid time off, Vision insurance, Employee discount, Life insurance
Job types cc: Full-time",https://www.indeed.com/m/viewjob?jk=80de402285ca15c1,IndeedScraperUSAEng_80de402285ca15c1,IndeedScraperUSAEng,Data,USA_ENGLISH,$83430 - $166860 yearly,FULLY_REMOTE
NEW,Data Manager,Sampson County Schools,"Rose Hill, NC 28458",2024-11-04,Able to make decisions and solve problems with school data and information provided. Maintains data for academic and attendance to support the North Carolina State Automated Driver’s License (NC SADLS…,"Job types: Full-time
Job types cc: Full-time",https://www.indeed.com/m/viewjob?jk=6327240d48e1d228,IndeedScraperUSAEng_6327240d48e1d228,IndeedScraperUSAEng,Data,USA_ENGLISH,,UNKNOWN
NEW,EMR Indexer,"FirstHealth of the Carolinas, Inc.","Pinehurst, NC 28374",2024-10-14,"EMR Indexers prepare, scan, and index incoming paper charts from the hospital clinical areas as well as the ambulatory clinics. They are required to index incoming electronic records via the document…","Job types: Part-time
Job types cc: Part-time",https://www.indeed.com/m/viewjob?jk=6a3571fb1dfdd9ed,IndeedScraperUSAEng_6a3571fb1dfdd9ed,IndeedScraperUSAEng,Data,USA_ENGLISH,,UNKNOWN
NEW,Master Data Management Design and Development Engineer,Truist Bank,"Raleigh, NC 27604",2024-10-16,"Partners with engineers, data scientists, and the data office leadership to define and refine data architecture and technology choices. Experience with change data capture and data replication…","Job types: Full-time
Benefits: AD&D insurance, Paid holidays, Dental insurance, 401(k), RSU, Vision insurance, Life insurance
Job types cc: Full-time
Schedules: Overtime",https://www.indeed.com/m/viewjob?jk=ebb783fc9a12fae5,IndeedScraperUSAEng_ebb783fc9a12fae5,IndeedScraperUSAEng,Data,USA_ENGLISH,,UNKNOWN
NEW,"Account Manager, Data Center Colocations",HITACHI ENERGY USA INC,"Raleigh, NC 27603",2024-11-06,We are seeking a seasoned sales professional to serve our Hitachi Energy business as an Account Manager and contribute to our Sales team focused on Data Center Colocation facilities customers.,"Job types: Full-time
Job types cc: Full-time",https://www.indeed.com/m/viewjob?jk=f3a4f7f1fba97267,IndeedScraperUSAEng_f3a4f7f1fba97267,IndeedScraperUSAEng,Data,USA_ENGLISH,,UNKNOWN
NEW,Data Discovery and Enrichment Expert II (Hybrid or Remote),LexisNexis,"Raleigh, NC",2024-10-15,"They partner with data scientists, data engineers, and product managers to create cutting-edge artificial intelligence solutions with legal data. LexisNexis is a data and analytics company with 10,500…","Job types: Full-time
Remote: Remote, Hybrid work
Benefits: Employee stock purchase plan, Disability insurance, Health insurance, Flexible spending account, Retirement plan
Job types cc: Full-time",https://www.indeed.com/m/viewjob?jk=84195f01bcbea196,IndeedScraperUSAEng_84195f01bcbea196,IndeedScraperUSAEng,Data,USA_ENGLISH,,UNKNOWN
NEW,Statistician Investigator,University of North Carolina at Chapel Hill,"Chapel Hill, NC 27599",2024-10-31,"In addition to analyses of these data, the statistician will also analyze data from longitudinal data collected as part of many other past and current observational studies going on in the institute,…","Job types: Full-time
Benefits: Health insurance, Retirement plan
Job types cc: Full-time",https://www.indeed.com/m/viewjob?jk=763e942164730582,IndeedScraperUSAEng_763e942164730582,IndeedScraperUSAEng,Data,USA_ENGLISH,,UNKNOWN
NEW,Data Discovery and Enrichment Expert I - Hybrid or Remote,LexisNexis,"Raleigh, NC",2024-10-15,"They partner with data scientists, data engineers, and product managers to create cutting-edge artificial intelligence solutions with legal data. LexisNexis is a data and analytics company with 10,500…","Job types: Full-time
Remote: Remote, Hybrid work
Benefits: Employee stock purchase plan, Disability insurance, Health insurance, Flexible spending account, Retirement plan
Job types cc: Full-time",https://www.indeed.com/m/viewjob?jk=8d5ea93606dc033e,IndeedScraperUSAEng_8d5ea93606dc033e,IndeedScraperUSAEng,Data,USA_ENGLISH,,UNKNOWN
NEW,Data Center Manager,Computer World Services,"Durham, NC",2024-10-14,Technical proficiency in data center infrastructure. Ensure regular deep cleaning of data center spaces by certified providers. Implement and enforce approved policies and procedures for data center…,"Job types: Full-time
Job types cc: Full-time
Schedules: Weekends as needed, Holidays",https://www.indeed.com/m/viewjob?jk=85251db4a35267c1,IndeedScraperUSAEng_85251db4a35267c1,IndeedScraperUSAEng,Data,USA_ENGLISH,,UNKNOWN
NEW,Program Clinical Data Manager,Worldwide Clinical Trials,"Research Triangle Park, NC",2024-11-02,Manage each of the data management projects to which assigned; provide leadership to the corresponding data management teams. Excellent attention to detail and is questioning the validity of the data…,"Job types: Full-time
Job types cc: Full-time",https://www.indeed.com/m/viewjob?jk=74303715bd12c5a7,IndeedScraperUSAEng_74303715bd12c5a7,IndeedScraperUSAEng,Data,USA_ENGLISH,,UNKNOWN
NEW,Operational Business Analyst,Volvo Group,"Greensboro, NC 27409",2024-11-02,"Knowledge of where to find relevant logistics data, how to retrieve it, and how to validate the data in terms of relevance, correctness and completeness. 3 to 5 years of relevant experience preferred.",,https://www.indeed.com/m/viewjob?jk=e9fa180b2b1a0bab,IndeedScraperUSAEng_e9fa180b2b1a0bab,IndeedScraperUSAEng,Data,USA_ENGLISH,,UNKNOWN
NEW,Microbiology Data Reviewer/Specialist I,KBI Biopharma,"Durham, NC",2024-10-14,Assists with trending of Environmental Monitoring data. Reviews data associated with method verifications/validations/ qualifications of microbiological methods and testing of in-process and drug…,"Job types: Full-time
Job types cc: Full-time",https://www.indeed.com/m/viewjob?jk=944e8a1f4e0d40a6,IndeedScraperUSAEng_944e8a1f4e0d40a6,IndeedScraperUSAEng,Data,USA_ENGLISH,,UNKNOWN
NEW,Scientist Product Data Management,Reynolds American Inc,"Winston-Salem, NC 27104",2024-11-09,"Collaborating with various departments and groups to ensure data is accurate, complete, and approved in a timely manner. Creating and maintaining manufacturing specifications and relevant data in…","Benefits: Paid jury duty, Paid parental leave, Health savings account, AD&D insurance, Disability insurance, Health insurance, Dental insurance, 401(k), Flexible spending account, Tuition reimbursement, Military leave, Cell phone reimbursement, On-the-job training, Parental leave, Employee assistance program, Vision insurance, Bereavement leave, Life insurance",https://www.indeed.com/m/viewjob?jk=a9f39109b84d1b26,IndeedScraperUSAEng_a9f39109b84d1b26,IndeedScraperUSAEng,Data,USA_ENGLISH,,UNKNOWN
NEW,Digital Business Analyst,Royal Bank of Canada,"Raleigh, NC 27617",2024-10-14,"Do you have a toolbox full of techniques, knowledge, and experience? RBC Bank provides full banking services supporting Canadian customers with their cross-border needs.","Job types: Full-time
Remote: Hybrid work
Benefits: Opportunities for advancement
Job types cc: Full-time",https://www.indeed.com/m/viewjob?jk=ff47b0d94acd885f,IndeedScraperUSAEng_ff47b0d94acd885f,IndeedScraperUSAEng,Data,USA_ENGLISH,,TEMPORARILY_REMOTE
NEW,JSOC J8 DATA ANALYST,"RDR, INC.","Fort Liberty, NC 28310",2024-10-14,Monitoring data quality and removing corrupt data. Performing statistical analysis of data. Experience with distributed data systems. Organizing and transforming data into comprehensible structures.,"Job types: Full-time
Job types cc: Full-time",https://www.indeed.com/m/viewjob?jk=77855ed9470542f6,IndeedScraperUSAEng_77855ed9470542f6,IndeedScraperUSAEng,Data,USA_ENGLISH,,UNKNOWN
NEW,Data Management SME,Prescient Edge Federal,"Jacksonville, NC 28540",2024-10-14,"Prescient Edge is seeking a Data Management SME to support a federal government client. A competitive salary with performance bonus opportunities. Comprehensive healthcare benefits, including medical,…","Job types: Full-time
Benefits: Health insurance, Dental insurance, Tuition reimbursement, On-the-job training, Vision insurance, Retirement plan
Job types cc: Full-time",https://www.indeed.com/m/viewjob?jk=613e7a7ed56bc9a2,IndeedScraperUSAEng_613e7a7ed56bc9a2,IndeedScraperUSAEng,Data,USA_ENGLISH,,UNKNOWN
NEW,Data Architect – R01543614,Brillio,"Durham, NC",2024-11-09,"This position involves evaluating the current state of data usage and ETL processes, developing the future data architecture, and influencing the overall data strategy.",,https://www.indeed.com/m/viewjob?jk=e5f9efc7b69331ba,IndeedScraperUSAEng_e5f9efc7b69331ba,IndeedScraperUSAEng,Data,USA_ENGLISH,$160000 - $170000 yearly,UNKNOWN
NEW,JReview & EDC System Business Analyst - 5516830,Accenture,"Raleigh, NC",2024-11-13,"Accenture Flex offers you the flexibility of local fixed-duration project-based work powered by Accenture, a leading global professional services company. Research, gather, and synthesize information.","Job types: Full-time
Remote: Remote
Job types cc: Full-time",https://www.indeed.com/m/viewjob?jk=8d23a8dbe17fe8a3,IndeedScraperUSAEng_8d23a8dbe17fe8a3,IndeedScraperUSAEng,Data,USA_ENGLISH,,FULLY_REMOTE
NEW,Database and Application Coordinator,NATIONAL BOARD FOR CERTIFIED COUNSELORS INC.,"Greensboro, NC 27403",2024-10-14,"The ideal candidate will possess a comprehensive understanding of SQL databases, and a proven track record in IT initiatives. The Database and Application Coordinator will work with business managers…","Job types: Full-time
Benefits: Profit sharing, Health savings account, Paid holidays, Health insurance, Dental insurance, 401(k), Flexible spending account, Paid time off, Vision insurance
Job types cc: Full-time",https://www.indeed.com/m/viewjob?jk=3b72a2bbac91c998,IndeedScraperUSAEng_3b72a2bbac91c998,IndeedScraperUSAEng,Data,USA_ENGLISH,,UNKNOWN
NEW,Multilingual Learner (ML) Data Specialist,Alamance-Burlington Schools,"Burlington, NC 27217",2024-10-25,Fulfilling ML data requests from Director and other key personnel. Collaborate with ML Director and other ML team members for data-specific needs and requests.,"Job types: Full-time
Job types cc: Full-time
Schedules: Monday to Friday",https://www.indeed.com/m/viewjob?jk=a061f8977fc30427,IndeedScraperUSAEng_a061f8977fc30427,IndeedScraperUSAEng,Data,USA_ENGLISH,,UNKNOWN
NEW,Data Collector - Temp Fulltime - Ritchwood,Wake Forest Baptist Health,"Winston-Salem, NC 27157",2024-10-14,"Assists in data analyses and preparation of charts, graphs, and reports obtained from research data. Assists in the design and testing of questionnaires, data input sheets, and other data collection…","Job types: Full-time
Job types cc: Full-time",https://www.indeed.com/m/viewjob?jk=e356f32d44cad2c5,IndeedScraperUSAEng_e356f32d44cad2c5,IndeedScraperUSAEng,Data,USA_ENGLISH,,UNKNOWN
NEW,"Instructor, Artificial Intelligence (AI) - Machine Learning (Part-Time Temp)",Wake Technical Community College,"Raleigh, NC 27603",2024-10-19,"Supports the Department, Division, and College goals, providing requested data in a timely manner. Wake Technical Community College is seeking to expand the pool of part-time faculty to teach one or…","Job types: Part-time
Job types cc: Part-time",https://www.indeed.com/m/viewjob?jk=78703c0b1dfa87e4,IndeedScraperUSAEng_78703c0b1dfa87e4,IndeedScraperUSAEng,Data,USA_ENGLISH,,UNKNOWN
NEW,Data Integration Developer,Local Government Federal Credit Union,"Raleigh, NC 27609",2024-11-07,"Creates and maintains documentation of current state data processes covering information such as interfaces, data stores, transport technologies and the source and destination of data at both a…","Benefits: Opportunities for advancement
Schedules: Weekends as needed",https://www.indeed.com/m/viewjob?jk=304a010076bb689d,IndeedScraperUSAEng_304a010076bb689d,IndeedScraperUSAEng,Data,USA_ENGLISH,,UNKNOWN
NEW,Commercial Analyst,Enviva,"Raleigh, NC",2024-10-14,High level of comfort visualizing data in an easy-to-understand manner and drawing out relevant insights that can inform decision-making processes. This position reports to the Senior Business Analyst…,,https://www.indeed.com/m/viewjob?jk=29e8d6f95944efad,IndeedScraperUSAEng_29e8d6f95944efad,IndeedScraperUSAEng,Data,USA_ENGLISH,,UNKNOWN
NEW,"Instructor, Data Analytics (Part-Time Temp)",Wake Technical Community College,"Raleigh, NC 27603",2024-10-26,"Supports the Department, Division, and College goals, providing requested data in a timely manner. Wake Technical Community College is seeking to expand the pool of part-time faculty to teach one or…","Job types: Part-time
Job types cc: Part-time",https://www.indeed.com/m/viewjob?jk=f98faff02f1df27d,IndeedScraperUSAEng_f98faff02f1df27d,IndeedScraperUSAEng,Data,USA_ENGLISH,,UNKNOWN
