status,title,company,location,date,blurb,tags,link,id,provider,query,locale,wage,remotenessNEW,Web Application & Database Developer (contingent),Helios Defense Solutions LLC,"Aberdeen, NC",2024-10-29,Ensuring Compliance and Security with DoD data security standards. Perform various statistical analyses on candidate data to support program validation efforts. Possess a minimum of SECRET clearance.,"Job types: Contract
Remote: Hybrid work
Job types cc: Contract",https://www.indeed.com/m/viewjob?jk=1b858ffa869c0f9d,IndeedScraperUSAEng_1b858ffa869c0f9d,IndeedScraperUSAEng,Data,USA_ENGLISH,,TEMPORARILY_REMOTE
NEW,Database Programmer - NCCT CTMC,Wake Forest Baptist Health,"Winston-Salem, NC 27101",2024-11-13,"Document processes, data dictionaries, data lineages and collect metrics. The Database Programmer will be part of a team that provides informatics expertise including data discovery, extraction,…","Job types: Full-time
Job types cc: Full-time",https://www.indeed.com/m/viewjob?jk=f3be71eee24d47d1,IndeedScraperUSAEng_f3be71eee24d47d1,IndeedScraperUSAEng,Data,USA_ENGLISH,,UNKNOWN
NEW,Programmer / Database Specialist,Banknote Corp of America,"Browns Summit, NC 27214",2024-11-12,"Implement and maintain data security measures to protect sensitive information. Write reports using SQL, Crystal Reports, Telerik or other reporting tools to extract and analyze data for business…","Job types: Full-time
Shifts: Night shift, Day shift
Job types cc: Full-time
Schedules: Night shift, Day shift, Monday to Friday",https://www.indeed.com/m/viewjob?jk=97fa5d16debbe7c0,IndeedScraperUSAEng_97fa5d16debbe7c0,IndeedScraperUSAEng,Data,USA_ENGLISH,,UNKNOWN
NEW,Manager of ERP Business Reporting & Analytics,Labcorp,"Burlington, NC 27215",2024-10-14,"2-3 years of experience in program/project management, data analytics, and data visualization. Expertise in data preparation and ETL processes. The Manager of ERP Business Reporting & Analytics is…","Job types: Full-time
Remote: Hybrid work
Benefits: Employee stock purchase plan, Disability insurance, Health insurance, Dental insurance, 401(k), Paid time off, Vision insurance
Job types cc: Full-time",https://www.indeed.com/m/viewjob?jk=9c79983307a95a55,IndeedScraperUSAEng_9c79983307a95a55,IndeedScraperUSAEng,Data,USA_ENGLISH,$110000 - $115000 yearly,TEMPORARILY_REMOTE
NEW,AI Product Analyst,S&P Global,"Raleigh, NC 27601",2024-11-13,"Experience in data manipulation, data visualization, and statistical analysis. This role is limited to persons with indefinite right to work in the United States. Grade Level (for internal use): 12.","Remote: Remote
Benefits: Health insurance, Referral program",https://www.indeed.com/m/viewjob?jk=c992154bb1cd06e6,IndeedScraperUSAEng_c992154bb1cd06e6,IndeedScraperUSAEng,Data,USA_ENGLISH,,FULLY_REMOTE
NEW,Sales Managing Director - Data Analytics,Evalueserve,"Raleigh, NC 27601",2024-11-06,Experience in selling data solutions around use cases with GCP. 12+ years proven experience in meeting or exceeding multi-million-dollar quotas selling data solutions to Fortune 1000 companies.,,https://www.indeed.com/m/viewjob?jk=cc02b79a2eb990bc,IndeedScraperUSAEng_cc02b79a2eb990bc,IndeedScraperUSAEng,Data,USA_ENGLISH,,UNKNOWN
NEW,Senior Clinical Data Manager I,SpringWorks Therapeutics,"Durham, NC",2024-11-12,"Creates data management plans and documentation as applicable. This individual will aid in ensuring clean and valid clinical study data is delivered to biostatistics, through the EDC build,…",Remote: Hybrid work,https://www.indeed.com/m/viewjob?jk=5b356102f232fbec,IndeedScraperUSAEng_5b356102f232fbec,IndeedScraperUSAEng,Data,USA_ENGLISH,$114330 - $150000 yearly,TEMPORARILY_REMOTE
NEW,Clinical & Regulatory Data Lake Business Analyst - 5516829,Accenture,"Raleigh, NC",2024-11-13,"Accenture Flex employees work in their local metro area onsite at the project, significantly reducing and/or eliminating the demands to travel. As a Business Analyst, you will be responsible for…","Job types: Full-time
Remote: Remote
Job types cc: Full-time",https://www.indeed.com/m/viewjob?jk=8fee91a7794add42,IndeedScraperUSAEng_8fee91a7794add42,IndeedScraperUSAEng,Data,USA_ENGLISH,,FULLY_REMOTE
NEW,Literacy Education Information System (LEIS) Data Specialist,James Sprunt Community College,"Kenansville, NC",2024-10-25,"This includes pre/post-testing data, registration data, and graduation data for students completing their High School Equivalency diploma or Adult High School diploma.","Job types: Full-time
Job types cc: Full-time",https://www.indeed.com/m/viewjob?jk=48da7f810d76178a,IndeedScraperUSAEng_48da7f810d76178a,IndeedScraperUSAEng,Data,USA_ENGLISH,,UNKNOWN
NEW,"Director, Programming and Data Analysis - Health Care Model Implementation",RTI International,"Durham, NC 27703",2024-11-13,"The program provides analytic data development and statistical programming expertise. Familiarity with Center for Medicare & Medicaid Services computer systems, data (particularly Medicare, Medicaid,…","Job types: Full-time
Benefits: Paid parental leave, Disability insurance, Dental insurance, Paid time off, Parental leave, Employee assistance program
Job types cc: Full-time",https://www.indeed.com/m/viewjob?jk=823994f8c969a4bc,IndeedScraperUSAEng_823994f8c969a4bc,IndeedScraperUSAEng,Data,USA_ENGLISH,$184000 - $227000 yearly,UNKNOWN
NEW,AI/ML Applied Scientist,Infinia ML,"Durham, NC 27703",2024-11-07,"3+ years experience in machine learning, data science, data engineering, and/or computational software development. Curating, processing, characterizing, and managing business-critical data.","Job types: Full-time
Remote: Hybrid work
Job types cc: Full-time",https://www.indeed.com/m/viewjob?jk=d27f0e8b82666c9e,IndeedScraperUSAEng_d27f0e8b82666c9e,IndeedScraperUSAEng,Data,USA_ENGLISH,,TEMPORARILY_REMOTE
NEW,Lead Consultant – BA for Agri Domain,Infosys,"Raleigh, NC",2024-10-23,We offer business and domain leadership while addressing client problems and partnering with them in their digital journey navigating the next. The person must have relevant Protocol/ Experimentation…,,https://www.indeed.com/m/viewjob?jk=a1220dc509495ceb,IndeedScraperUSAEng_a1220dc509495ceb,IndeedScraperUSAEng,Data,USA_ENGLISH,,UNKNOWN
NEW,Principal AI Performance Architect,Qualcomm,"Raleigh, NC",2024-11-12,"Qualcomm envisions making AI ubiquitous - expanding beyond mobile and powering other end devices, data centers, vehicles, and things. Engineering Group, Engineering Group > Machine Learning…",Benefits: RSU,https://www.indeed.com/m/viewjob?jk=eba09ca9f16760df,IndeedScraperUSAEng_eba09ca9f16760df,IndeedScraperUSAEng,Data,USA_ENGLISH,$180700 - $332400 yearly,UNKNOWN
NEW,Senior Data Scientist II,RELX,"Raleigh, NC 27606",2024-10-14,"Mentoring junior data scientists and provide guidance on AI and machine learning best practices. Possess advanced programming skills in Python, R, or other relevant languages for data analysis.","Job types: Full-time
Benefits: Disability insurance, Health insurance, Dental insurance, Flexible spending account, Parental leave, Employee assistance program, Vision insurance, 401(k) matching, Flexible schedule
Job types cc: Full-time",https://www.indeed.com/m/viewjob?jk=5d779bf3a3302a2e,IndeedScraperUSAEng_5d779bf3a3302a2e,IndeedScraperUSAEng,Data,USA_ENGLISH,,UNKNOWN
NEW,Business Development Executive – Real-world Data Solutions,Labcorp,"Burlington, NC 27215",2024-11-02,"Analytical mindset with experience in data analysis, reporting, and identifying the “so what” behind the data. Leverage Salesforce.com and other data sources for commercial sales metrics and customer…","Job types: Full-time
Remote: Remote
Benefits: Employee stock purchase plan, Disability insurance, Health insurance, Dental insurance, 401(k), Tuition reimbursement, Paid time off, Vision insurance
Job types cc: Full-time",https://www.indeed.com/m/viewjob?jk=a819314f041e2fb5,IndeedScraperUSAEng_a819314f041e2fb5,IndeedScraperUSAEng,Data,USA_ENGLISH,$120000 - $140000 yearly,FULLY_REMOTE
NEW,Data Scientist,Amentum,"Fort Liberty, NC 28307",2024-10-25,"Formulate and lead guided, multifaceted analytic studies against large volumes of data to interpret and analyze data using exploratory mathematic and statistical techniques based on the scientific…","Job types: Full-time
Job types cc: Full-time",https://www.indeed.com/m/viewjob?jk=a2c3c03ad4c00c46,IndeedScraperUSAEng_a2c3c03ad4c00c46,IndeedScraperUSAEng,Data,USA_ENGLISH,,UNKNOWN
NEW,Enterprise Data Warehouse Architect,North Carolina State University,"Raleigh, NC",2024-11-04,"Ensure compliance with data management processes in collaboration with data governance teams. Expertise in data warehouse design concepts, data modeling, and ETL. Job Open Date 09/12/2024.","Job types: Full-time
Remote: Hybrid work
Job types cc: Full-time
Schedules: Monday to Friday",https://www.indeed.com/m/viewjob?jk=a23c119006f7ee4e,IndeedScraperUSAEng_a23c119006f7ee4e,IndeedScraperUSAEng,Data,USA_ENGLISH,$120000 - $130000 yearly,TEMPORARILY_REMOTE
NEW,Healthcare Business Analyst Intermediate,Novant Health,"Winston-Salem, NC 27101",2024-10-14,Ability to translate clinical data and information to a technical team. Requires a moderately advanced understanding of clinical/nonclinical relational databases and large clinical/nonclinical data…,,https://www.indeed.com/m/viewjob?jk=d7fb55ab37c3829d,IndeedScraperUSAEng_d7fb55ab37c3829d,IndeedScraperUSAEng,Data,USA_ENGLISH,,UNKNOWN
NEW,Commercial Analyst,Enviva,"Raleigh, NC",2024-10-25,High level of comfort visualizing data in an easy-to-understand manner and drawing out relevant insights that can inform decision-making processes. This position reports to the Senior Business Analyst…,,https://www.indeed.com/m/viewjob?jk=8474b67f7bd78a38,IndeedScraperUSAEng_8474b67f7bd78a38,IndeedScraperUSAEng,Data,USA_ENGLISH,,UNKNOWN
NEW,Data Science Programs Manager (Remote),Susan G. Komen,"Raleigh, NC",2024-11-02,"Deep understanding of health data standards, data structure and data quality; experience implementing CDISC Standards and/or experience working with EMR systems. Generous Paid Time Off Plan.","Job types: Full-time
Remote: Remote
Benefits: Work from home stipend, Dental insurance, Tuition reimbursement, Paid time off, Work from home, Parental leave, Vision insurance, Retirement plan
Job types cc: Full-time",https://www.indeed.com/m/viewjob?jk=e44ba092afead44b,IndeedScraperUSAEng_e44ba092afead44b,IndeedScraperUSAEng,Data,USA_ENGLISH,$56000 - $75000 yearly,FULLY_REMOTE
NEW,Data Architect,Hyster-Yale Group,"Greenville, NC 27834",2024-10-14,"In lieu of degree, 5+ years of relevant data analyst experience. Create all necessary documentation for data engineers and business personnel to agree on the accepted solution.","Job types: Full-time
Remote: Hybrid work
Benefits: Profit sharing, Health insurance, Dental insurance, 401(k), Tuition reimbursement, Paid time off, Vision insurance, Life insurance
Job types cc: Full-time",https://www.indeed.com/m/viewjob?jk=eba9c354390fc965,IndeedScraperUSAEng_eba9c354390fc965,IndeedScraperUSAEng,Data,USA_ENGLISH,,TEMPORARILY_REMOTE
NEW,Database Specialist,North Carolina Dept of Health and Human Services,"Wake County, NC",2024-11-07,"Must demonstrate working experience of methods and techniques used in data collection, data quality, data analysis, and interpretation of information related to public health or health-related data.","Job types: Full-time
Job types cc: Full-time",https://www.indeed.com/m/viewjob?jk=afc2f7548b17d213,IndeedScraperUSAEng_afc2f7548b17d213,IndeedScraperUSAEng,Data,USA_ENGLISH,$51616 - $90328 yearly,UNKNOWN
NEW,Director of Data Privacy and Cybersecurity Program,North Carolina Central University,"Durham, NC 27707",2024-10-14,Demonstrated expertise in data privacy or cybersecurity law. The Director of Data Privacy and Cybersecurity Program will work with the Associate Dean of Technology and Innovation and the Center’s…,"Job types: Full-time
Job types cc: Full-time",https://www.indeed.com/m/viewjob?jk=8c400a312b2f8224,IndeedScraperUSAEng_8c400a312b2f8224,IndeedScraperUSAEng,Data,USA_ENGLISH,,UNKNOWN
NEW,"Director, Data Engineering",American Red Cross,"Durham, NC 27701",2024-10-18,"Collaborate with analytics and business teams to improve data consumed by business intelligence tools, enhancing data accessibility and fostering data-driven decision making. 401K with up to 5% Match.","Job types: Full-time
Remote: Remote
Benefits: Health insurance, Dental insurance, Flexible spending account, Paid time off, Family leave, 401(k) 5% Match, Employee assistance program, Vision insurance, 401(k) matching
Job types cc: Full-time",https://www.indeed.com/m/viewjob?jk=e752e63bdee95631,IndeedScraperUSAEng_e752e63bdee95631,IndeedScraperUSAEng,Data,USA_ENGLISH,$165000 - $175000 yearly,FULLY_REMOTE
NEW,Data Analyst - Warehouse Operations,KBI Biopharma,"Durham, NC",2024-10-23,"2+ years of experience in analytics, data engineering, data science, or a related field. Transforms raw data into actionable insights and driving data-driven decision-making across the organization…","Job types: Full-time
Benefits: Paid holidays, Health insurance, Dental insurance, Paid time off, Vision insurance, 401(k) matching, Sabbatical
Job types cc: Full-time",https://www.indeed.com/m/viewjob?jk=254aa68aede252f4,IndeedScraperUSAEng_254aa68aede252f4,IndeedScraperUSAEng,Data,USA_ENGLISH,$75676 - $104055 yearly,UNKNOWN
NEW,DevOps Database Architect,UST Global,"Raleigh, NC",2024-11-13,"Ensure compliance with data protection regulations and internal security policies. Lead data partitioning, sharding, and load balancing to improve database efficiency.","Job types: Full-time
Benefits: Paid jury duty, Health savings account, Paid holidays, Disability insurance, Health insurance, Dental insurance, Flexible spending account, Vision insurance, 401(k) matching, Bereavement leave, Life insurance, Paid sick time
Job types cc: Full-time",https://www.indeed.com/m/viewjob?jk=7c1495158b6ad148,IndeedScraperUSAEng_7c1495158b6ad148,IndeedScraperUSAEng,Data,USA_ENGLISH,$115000 - $175000 yearly,UNKNOWN
NEW,Clinical Data Specialist,CEDENT,"Raleigh, NC",2024-10-31,"Reporting to the Clinical Data Manager, you will develop real-world data variables from structured and unstructured sources, design data capture forms, and establish procedures for data abstraction.","Job types: Full-time
Remote: Hybrid work
Benefits: Work from home
Job types cc: Full-time",https://www.indeed.com/m/viewjob?jk=2a51c4b8618f5a13,IndeedScraperUSAEng_2a51c4b8618f5a13,IndeedScraperUSAEng,Data,USA_ENGLISH,,TEMPORARILY_REMOTE
NEW,School Data Manager-High School (321520),Franklin County Schools,"Franklinton, NC 27525",2024-10-14,Manages students’ career planning data and all vocational education data to include VICE reports as well as other required reports. Requires the ability to prepare data sheets using prescribed format.,"Job types: Full-time
Job types cc: Full-time",https://www.indeed.com/m/viewjob?jk=b6c0e97b70e7df3f,IndeedScraperUSAEng_b6c0e97b70e7df3f,IndeedScraperUSAEng,Data,USA_ENGLISH,$3000.37 - $3000.37 monthly,UNKNOWN
NEW,Senior Data Engineer in Azure using Databricks for Scala/Python,UBS,"Raleigh, NC",2024-10-14,"Our crew is using the latest data platforms to further the group’s data strategy to realize the true potential of data as an asset through utilizing data lakes, data virtualization, for use with…","Job types: Full-time
Job types cc: Full-time",https://www.indeed.com/m/viewjob?jk=588fdaa674a24af5,IndeedScraperUSAEng_588fdaa674a24af5,IndeedScraperUSAEng,Data,USA_ENGLISH,,UNKNOWN
NEW,FMV/Imagery Analyst TS/SCI,A2 Federal,"Fort Liberty, NC 28307",2024-10-18,"Perform advanced level imagery analysis, imagery product production, intelligence systems architecture and evaluation of procedures, processes, techniques, models and/or methodologies used to develop…","Job types: Full-time
Benefits: Relocation assistance, Health insurance, Dental insurance, 401(k), Paid time off, Vision insurance, Flexible schedule, Life insurance
Job types cc: Full-time",https://www.indeed.com/m/viewjob?jk=f050f30f337d61f4,IndeedScraperUSAEng_f050f30f337d61f4,IndeedScraperUSAEng,Data,USA_ENGLISH,$73500 - $79500 yearly,UNKNOWN
NEW,Data Manager,Wake County Public School System,"Apex, NC 27502",2024-10-14,Performs data entry processes including analyzing data for students being served or potentially eligible for entry into WCPSS. Compiles and responds to large data requests from staff.,"Job types: Full-time
Job types cc: Full-time",https://www.indeed.com/m/viewjob?jk=667b5ee76e15c417,IndeedScraperUSAEng_667b5ee76e15c417,IndeedScraperUSAEng,Data,USA_ENGLISH,,UNKNOWN
NEW,PIM Specialist-Product Data,Carrier Enterprise,"Raleigh, NC 27604",2024-10-25,Experience with data entry systems or databases preferred. Detail-oriented with a commitment to data accuracy. Perform regular audits of product data to ensure ongoing accuracy.,,https://www.indeed.com/m/viewjob?jk=cdbec04dc2509ff0,IndeedScraperUSAEng_cdbec04dc2509ff0,IndeedScraperUSAEng,Data,USA_ENGLISH,,UNKNOWN
NEW,Data Coordinator,Early Years,"Durham, NC 27703",2024-10-14,Assist in generating monthly supplement payment data. Assist in data collection and analysis for departmental evaluations. Enter and maintain teacher data for the Durham PreK program.,"Job types: Full-time
Shifts: Day shift
Benefits: Health savings account, Paid holidays, Health insurance, Dental insurance, 401(k), Flexible spending account, Paid time off, Parental leave, Employee assistance program, Vision insurance, 401(k) matching, Flexible schedule, Life insurance, Retirement plan
Job types cc: Full-time
Schedules: Weekends as needed, Evenings as needed, Day shift, Monday to Friday",https://www.indeed.com/m/viewjob?jk=f8719680fb3368b3,IndeedScraperUSAEng_f8719680fb3368b3,IndeedScraperUSAEng,Data,USA_ENGLISH,$46268 - $64538 yearly,UNKNOWN
NEW,Data Specialist,MV Transportation,"Cary, NC 27607",2024-10-22,"Identifying data sources, collect data, and source missing data. Assess quality of data and remove or clean data. Organize data into usable formats. Analyze data to find answers to specific questions.","Job types: Full-time
Job types cc: Full-time",https://www.indeed.com/m/viewjob?jk=5a9b29da681ade5f,IndeedScraperUSAEng_5a9b29da681ade5f,IndeedScraperUSAEng,Data,USA_ENGLISH,,UNKNOWN
NEW,Data Engineer,Robert E. Mason & Associates,"Durham, NC 27703",2024-11-05,Ensure data quality and integrity across various data sources. The Data Engineer will play a crucial role in leveraging data analytics platforms to transform raw data into actionable insights.,"Remote: Hybrid work
Benefits: Paid jury duty, Paid parental leave, Paid holidays, Disability insurance, Health insurance, Dental insurance, Parental leave, Employee assistance program, Vision insurance, Employee stock ownership plan, Bereavement leave, Life insurance, Retirement plan",https://www.indeed.com/m/viewjob?jk=5aded5591e6b0061,IndeedScraperUSAEng_5aded5591e6b0061,IndeedScraperUSAEng,Data,USA_ENGLISH,,TEMPORARILY_REMOTE
NEW,Database Administrator II,Atlantic Casualty Insurance Company,"Raleigh, NC 27607",2024-11-05,Develops and conducts training for others on the programming staff and operations staff to educate them on the data model and data model access methods. Good interpersonal and organizational skills.,"Job types: Full-time
Job types cc: Full-time",https://www.indeed.com/m/viewjob?jk=df9245b38e2278a2,IndeedScraperUSAEng_df9245b38e2278a2,IndeedScraperUSAEng,Data,USA_ENGLISH,$80000 - $91000 yearly,UNKNOWN
NEW,Lead Data Discovery and Enrichment (Hybrid or Remote),RELX,"Raleigh, NC",2024-10-15,"They partner with data scientists, data engineers, and product managers to create cutting-edge artificial intelligence solutions with legal data. You will use your expertise in the legal domain, and…","Job types: Full-time
Remote: Remote, Hybrid work
Benefits: Disability insurance, Health insurance, Tuition reimbursement, Parental leave, Employee assistance program, Flexible schedule, Retirement plan
Job types cc: Full-time",https://www.indeed.com/m/viewjob?jk=b6e37efefe50731a,IndeedScraperUSAEng_b6e37efefe50731a,IndeedScraperUSAEng,Data,USA_ENGLISH,,UNKNOWN
NEW,Data Manager,Wake County Public School System,"Cary, NC 27519",2024-10-24,Performs data entry processes including analyzing data for students being served or potentially eligible for entry into WCPSS. Compiles and responds to large data requests from staff.,"Job types: Full-time
Job types cc: Full-time",https://www.indeed.com/m/viewjob?jk=4da1725cd5a81d9b,IndeedScraperUSAEng_4da1725cd5a81d9b,IndeedScraperUSAEng,Data,USA_ENGLISH,,UNKNOWN
NEW,"Business Analyst, PRCM",Inmar,"Winston-Salem, NC 27101",2024-10-14,"Developing and testing rules for client data (pre-process functions). At least four years of relevant experience involving customer service, computer usage, data entry and data analysis and a…","Job types: Full-time
Job types cc: Full-time",https://www.indeed.com/m/viewjob?jk=4cdf4425d94d0356,IndeedScraperUSAEng_4cdf4425d94d0356,IndeedScraperUSAEng,Data,USA_ENGLISH,,UNKNOWN
NEW,Field Data Collector,"Nash County, NC","Nashville, NC",2024-11-13,"Work includes preparing and entering real estate appraisal data into the data base, preparing and mailing appraisal notices, data entry of building permits, preparing and mailing sales questionnaires,…","Job types: Full-time
Job types cc: Full-time",https://www.indeed.com/m/viewjob?jk=dfece76d39dcf3ca,IndeedScraperUSAEng_dfece76d39dcf3ca,IndeedScraperUSAEng,Data,USA_ENGLISH,$39070 - $62918 yearly,UNKNOWN
NEW,Staff Software Engineer - Data Platform,Celonis SE,"Raleigh, NC",2024-11-12,Provide advice and guidance to data service consumer teams and junior engineers. Sound knowledge of best practices in database administration and modeling and data security.,"Benefits: Internal mobility program, RSU, Gym membership, Life insurance",https://www.indeed.com/m/viewjob?jk=0ccce689f192a98e,IndeedScraperUSAEng_0ccce689f192a98e,IndeedScraperUSAEng,Data,USA_ENGLISH,,UNKNOWN
NEW,UTS-Temporary Statistician Investigator at UNC Chapel Hill,North Carolina State University,"Raleigh, NC",2024-11-01,"In addition to analyses of these data, the statistician will also analyze data from longitudinal data collected as part of many other past and current R01 studies going on in the institute, as well as…","Job types: Temporary
Job types cc: Temporary",https://www.indeed.com/m/viewjob?jk=30c463694780169f,IndeedScraperUSAEng_30c463694780169f,IndeedScraperUSAEng,Data,USA_ENGLISH,$45 - $55 hourly,UNKNOWN
NEW,Data scientist(TS/SCI ),Business Integra Inc,"Fort Liberty, NC 28307",2024-10-22,Thoroughly clean data to discard irrelevant information and prepare the data for preprocessing and modeling. Perform exploratory data analysis (EDA) to determine how to handle missing data and to look…,"Job types: Contract
Shifts: 10 hour shift
Job types cc: Contract
Schedules: 10 hour shift",https://www.indeed.com/m/viewjob?jk=31d642e60731c8f2,IndeedScraperUSAEng_31d642e60731c8f2,IndeedScraperUSAEng,Data,USA_ENGLISH,$50 - $60 hourly,UNKNOWN
NEW,Housewares Processor / Warehouse Worker,Prime Time Leasing,"Clayton, NC 27520",2024-10-14,"Prime Time Leasing is looking for a hard-working individual to work out of our Clayton (Raleigh), North Carolina location to clean and pack housewares items for delivery to our customers.","Job types: Full-time
Benefits: Health insurance, Dental insurance, 401(k), Paid time off
Job types cc: Full-time
Schedules: Overtime, No weekends, Monday to Friday, Weekends & holidays off",https://www.indeed.com/m/viewjob?jk=5cfa9ccce85e7702,IndeedScraperUSAEng_5cfa9ccce85e7702,IndeedScraperUSAEng,Data,USA_ENGLISH,,UNKNOWN
NEW,Data Manager,Wake County Public School System,"Wendell, NC 27591",2024-10-26,Performs data entry processes including analyzing data for students being served or potentially eligible for entry into WCPSS. Compiles and responds to large data requests from staff.,"Job types: Full-time
Job types cc: Full-time",https://www.indeed.com/m/viewjob?jk=ec918135d76ddc0a,IndeedScraperUSAEng_ec918135d76ddc0a,IndeedScraperUSAEng,Data,USA_ENGLISH,,UNKNOWN
NEW,"Sr. Manager, Data Systems","Veloxis Pharmaceuticals, Inc.","Cary, NC",2024-11-11,"Manages the full spectrum of data lifecycle from raw data acquisition, through Extract/Transform/Loan (ETL) activities, data warehousing, and data mart generation. 2+ years’ SQL server experience.","Job types: Full-time
Benefits: Health insurance
Job types cc: Full-time",https://www.indeed.com/m/viewjob?jk=4caa8498d9ed034b,IndeedScraperUSAEng_4caa8498d9ed034b,IndeedScraperUSAEng,Data,USA_ENGLISH,,UNKNOWN
NEW,Customer Service/Data Entry,Alamance Foods,"Graham, NC 27253",2024-10-31,"Job Title: Customer Service Representative - Food Manufacturing. Alamance Foods, Inc. is a leading food manufacturing company committed to delivering. Ensure customer needs are met.",,https://www.indeed.com/m/viewjob?jk=c1a4072b1ff2f9b8,IndeedScraperUSAEng_c1a4072b1ff2f9b8,IndeedScraperUSAEng,Data,USA_ENGLISH,,UNKNOWN
NEW,Statistician,Zoetis,"Durham, NC",2024-10-14,"Knowledge of data handling and statistical analysis using JMP software. Knowledge of data handling and statistical analysis programming in PC-SAS. Knowledge of experimental design, mixed linear and…","Job types: Full-time
Job types cc: Full-time",https://www.indeed.com/m/viewjob?jk=849e37f3d0e411e6,IndeedScraperUSAEng_849e37f3d0e411e6,IndeedScraperUSAEng,Data,USA_ENGLISH,,UNKNOWN
