status,title,company,location,date,blurb,tags,link,id,provider,query,locale,wage,remotenessNEW,Data Office - Global Service Lead,UCB,"Raleigh, NC 27617",2024-10-14,"Strong understanding of data cataloging, data quality, data security, and data privacy and reference data standards. Experience with data modeling, data architecture, and data engineering.",,https://www.indeed.com/m/viewjob?jk=67640d83f1baf33d,IndeedScraperUSAEng_67640d83f1baf33d,IndeedScraperUSAEng,Data,USA_ENGLISH,$160000 - $186000 yearly,UNKNOWN
NEW,Senior Data Scientist,Inotiv,"Raleigh, NC 27560",2024-10-14,"Demonstrated proficiency in data extraction and data curation. They are expected to lead aspects of data analysis, including data curation, data management, data storage, and preparation for…","Job types: Full-time
Remote: Remote
Benefits: Paid parental leave, Disability insurance, Health insurance, Dental insurance, 401(k), Paid time off, Parental leave
Job types cc: Full-time",https://www.indeed.com/m/viewjob?jk=5a4804e58be09be4,IndeedScraperUSAEng_5a4804e58be09be4,IndeedScraperUSAEng,Data,USA_ENGLISH,,FULLY_REMOTE
NEW,Inventory Data Entry Check Point_ M-F _4:30am-3:00pm,American Air Filter International,"Smithfield, NC 27577",2024-10-14,"Ensure accurate data entry of inventory movements. Audit data entry and have corrections made. Warehouse, inventory control and/or data entry experience preferred. Must have basic math skills.","Job types: Full-time
Job types cc: Full-time
Schedules: Monday to Friday",https://www.indeed.com/m/viewjob?jk=4b77a92d05a576b0,IndeedScraperUSAEng_4b77a92d05a576b0,IndeedScraperUSAEng,Data,USA_ENGLISH,,UNKNOWN
NEW,Data Collector (Guilford County),University of North Carolina at Chapel Hill,"Chapel Hill, NC 27599",2024-11-09,Prepare equipment and collect data. Experience with data collection is a plus. Adhere to data collection procedures and safety protocol. The individual will need to maintain and organize data…,"Job types: Temporary, Part-time
Job types cc: Temporary, Part-time",https://www.indeed.com/m/viewjob?jk=d0e14451e913d174,IndeedScraperUSAEng_d0e14451e913d174,IndeedScraperUSAEng,Data,USA_ENGLISH,$15 - $15 hourly,UNKNOWN
NEW,Data Scientist- Top secret clearance,Business Integra Inc,"Fort Liberty, NC",2024-10-22,Thoroughly clean data to discard irrelevant information and prepare the data for preprocessing and modeling. Perform exploratory data analysis (EDA) to determine how to handle missing data and to look…,"Job types: Contract
Shifts: 8 hour shift
Benefits: Health insurance, Dental insurance, Life insurance
Job types cc: Contract
Schedules: 8 hour shift",https://www.indeed.com/m/viewjob?jk=849843cd85cbd7af,IndeedScraperUSAEng_849843cd85cbd7af,IndeedScraperUSAEng,Data,USA_ENGLISH,$48 - $90 hourly,UNKNOWN
NEW,"Senior Statistical Programmer (Oncology), FSP",Fortrea,"Durham, NC",2024-11-02,"As a leading global contract research organization (CRO) with a passion for scientific rigor and decades of clinical development experience, Fortrea provides pharmaceutical, biotechnology, and medical…","Job types: Full-time
Remote: Remote
Benefits: Employee stock purchase plan, Disability insurance, Health insurance, Dental insurance, 401(k), Paid time off, Vision insurance
Job types cc: Full-time",https://www.indeed.com/m/viewjob?jk=c7c0fe87474093ba,IndeedScraperUSAEng_c7c0fe87474093ba,IndeedScraperUSAEng,Data,USA_ENGLISH,$100000 - $135000 yearly,FULLY_REMOTE
NEW,Data Manager,Winston-Salem Forsyth County Schools,"Winston-Salem, NC",2024-11-08,"Ability to accurately enter and verify student information data. Knowledge of using multiple computer programs to enter and retrieve data. Data recording, location of information, and producing…","Job types: Full-time
Job types cc: Full-time",https://www.indeed.com/m/viewjob?jk=5e0c21228e79b596,IndeedScraperUSAEng_5e0c21228e79b596,IndeedScraperUSAEng,Data,USA_ENGLISH,$2838.63 - $2838.63 monthly,UNKNOWN
NEW,Azure Data Factory (ADF) Lead,Infosys,"Raleigh, NC",2024-11-05,"Must have 5+Years’ experience in Azure data factory, AIS, Data Lake, Big Data, Azure configurations. You will play an important role in creating the high level design artifacts.",,https://www.indeed.com/m/viewjob?jk=577d73bcf85d5e7a,IndeedScraperUSAEng_577d73bcf85d5e7a,IndeedScraperUSAEng,Data,USA_ENGLISH,,UNKNOWN
NEW,Data Technician III - PHASER,Institute for Medical Research,"Durham, NC 27705",2024-10-26,Recommend new methods for data processing & documentation. Perform scheduled audits of patient PGx results data entry. Act as a back-up for site coordinator results processing & data entry as needed.,"Benefits: 403(b) matching, Paid holidays, Health insurance",https://www.indeed.com/m/viewjob?jk=7f4fdfb159d1341e,IndeedScraperUSAEng_7f4fdfb159d1341e,IndeedScraperUSAEng,Data,USA_ENGLISH,$23.11 - $23.11 hourly,UNKNOWN
NEW,Developer - BI/Data Warehouse,Duke Health,"Durham, NC 27710",2024-10-24,The Developer builds and maintains custom data sets by translating data requirements into workable programming code. The Developer functions as a data and reporting expert for the Duke Health System…,"Job types: Full-time
Job types cc: Full-time",https://www.indeed.com/m/viewjob?jk=a456b54899084cba,IndeedScraperUSAEng_a456b54899084cba,IndeedScraperUSAEng,Data,USA_ENGLISH,,UNKNOWN
NEW,Major Account Manager- Real World Data,Clarivate,"Raleigh, NC 27601",2024-10-26,"Deep knowledge and experience with marketing and selling HEOR and Real World Data (RWD) offerings (Lab, Claims, Prescription, EMR, Hub, Specialty Pharmacy, SDOH data) into Life Sciences organizations.","Job types: Full-time
Remote: Remote
Job types cc: Full-time",https://www.indeed.com/m/viewjob?jk=96e02ff2bc03e9e7,IndeedScraperUSAEng_96e02ff2bc03e9e7,IndeedScraperUSAEng,Data,USA_ENGLISH,,FULLY_REMOTE
NEW,"Instructor, Databases, SQL (Part-Time Temp)",Wake Technical Community College,"Raleigh, NC 27603",2024-10-25,"Supports the Department, Division, and College goals, providing requested data in a timely manner. Wake Technical Community College is seeking to expand the pool of part-time faculty to teach one or…","Job types: Part-time
Job types cc: Part-time",https://www.indeed.com/m/viewjob?jk=f892ffa2ae4dacfa,IndeedScraperUSAEng_f892ffa2ae4dacfa,IndeedScraperUSAEng,Data,USA_ENGLISH,,UNKNOWN
NEW,Principal Data Scientist,Epic Games,"Cary, NC",2024-10-14,"Partner with data engineers to ensure efficient architecture for analytics needs. Use your expert experience in data & analytics to advance Epic's experimentation capabilities, drive rigorous product…","Benefits: Disability insurance, Health insurance, Unlimited paid time off, Dental insurance, Vision insurance, 401(k) matching, Sabbatical, Life insurance",https://www.indeed.com/m/viewjob?jk=86a0c16e088c0369,IndeedScraperUSAEng_86a0c16e088c0369,IndeedScraperUSAEng,Data,USA_ENGLISH,,UNKNOWN
NEW,Data Center Lead,ECCO Select,"Durham, NC 27703",2024-11-13,"Excellent problem-solving skills, with the ability to manage incidents and optimize data center performance. The Data Center Lead will oversee the daily operations, maintenance, and optimization of…","Job types: Full-time
Shifts: 8 hour shift
Benefits: Paid holidays, Health insurance, Dental insurance, 401(k), Paid time off, Vision insurance
Job types cc: Full-time
Schedules: 8 hour shift, Monday to Friday",https://www.indeed.com/m/viewjob?jk=507ece925ea56d16,IndeedScraperUSAEng_507ece925ea56d16,IndeedScraperUSAEng,Data,USA_ENGLISH,$45 - $60 hourly,UNKNOWN
NEW,Data Manager | January 2025 Start Date,Winston-Salem Forsyth County Schools,"Winston-Salem, NC",2024-11-01,"Ability to accurately enter and verify student information data. Knowledge of using multiple computer programs to enter and retrieve data. Data recording, location of information, and producing…","Job types: Full-time
Job types cc: Full-time",https://www.indeed.com/m/viewjob?jk=df414c6cd41969f9,IndeedScraperUSAEng_df414c6cd41969f9,IndeedScraperUSAEng,Data,USA_ENGLISH,$2838.63 - $2838.63 monthly,UNKNOWN
NEW,"Mission Data Scientist, Senior",Booz Allen,"Fort Liberty, NC",2024-10-17,"3+ years of experience with data analytics, software engineering, data engineering, data science, or machine learning engineering. Experience with Extract, Transform, and Load (ETL) tools, data…","Job types: Full-time
Benefits: Health insurance, Flexible spending account, Tuition reimbursement, Retirement plan
Job types cc: Full-time",https://www.indeed.com/m/viewjob?jk=ed3241381b12dadc,IndeedScraperUSAEng_ed3241381b12dadc,IndeedScraperUSAEng,Data,USA_ENGLISH,$96700 - $220000 yearly,UNKNOWN
NEW,Clinical Program Data Coordinator,"Lincoln Community Health Center, Inc.","Durham, NC 27704",2024-10-14,"Position requires graduation from High School supplemented by computer science/data management coursework. The position requires data entry, ability to generate reports and attention to detail.",,https://www.indeed.com/m/viewjob?jk=d6709418b07398b6,IndeedScraperUSAEng_d6709418b07398b6,IndeedScraperUSAEng,Data,USA_ENGLISH,,UNKNOWN
NEW,"Database Administrator (MySQL, Postgres)",IXL Learning,"Raleigh, NC",2024-10-14,"IXL Learning, developer of personalized learning products used by millions of people globally, is currently looking for a self-motivated MySQL and/or Postgres Database Administrator to join our team.","Job types: Full-time
Job types cc: Full-time",https://www.indeed.com/m/viewjob?jk=28facccc556580c1,IndeedScraperUSAEng_28facccc556580c1,IndeedScraperUSAEng,Data,USA_ENGLISH,,UNKNOWN
NEW,BI Developer III/Data Engineer III,Herbalife,"Winston-Salem, NC 27107",2024-10-26,"5+ years experience in data warehouse and schema design architecture. Proficiency in multiple connectors for BI application for data federation. Meet with decision makers, data owners, and end users…","Job types: Full-time
Benefits: Paid parental leave, Health savings account, AD&D insurance, Employee stock purchase plan, Disability insurance, Health insurance, Dental insurance, 401(k), Flexible spending account, Paid time off, Parental leave, Employee assistance program, Vision insurance, Bereavement leave, Pet insurance
Job types cc: Full-time",https://www.indeed.com/m/viewjob?jk=ceeb23dc7bd9e1d1,IndeedScraperUSAEng_ceeb23dc7bd9e1d1,IndeedScraperUSAEng,Data,USA_ENGLISH,,UNKNOWN
NEW,SAP Master Data Governance Sr Configuration Analyst,Kontoor Brands,"Greensboro, NC 27401",2024-10-31,"Engages in business process design for master data management, master data integration to all downstream systems, customer, vendor and material data management and application support of other non-SAP…","Job types: Full-time
Benefits: Paid parental leave, Health insurance, Dental insurance, Tuition reimbursement, Paid time off, Parental leave, 401(k) 6% Match, Employee assistance program, Vision insurance, 401(k) matching, Employee discount
Job types cc: Full-time",https://www.indeed.com/m/viewjob?jk=118a148b65a007bb,IndeedScraperUSAEng_118a148b65a007bb,IndeedScraperUSAEng,Data,USA_ENGLISH,$120973 - $146423 yearly,UNKNOWN
NEW,PowerSchool School-Based Data Manager/School Bookkeeper,Edgecombe County Public Schools,"Rocky Mount, NC 27801",2024-10-14,"Assists school-based personnel in implementing standards and operating procedures established for management of student data; Collects data from staff, consolidates and creates summary databases…","Job types: Full-time
Shifts: 8 hour shift
Job types cc: Full-time
Schedules: 8 hour shift",https://www.indeed.com/m/viewjob?jk=c23a75baa00be2bd,IndeedScraperUSAEng_c23a75baa00be2bd,IndeedScraperUSAEng,Data,USA_ENGLISH,,UNKNOWN
NEW,HUB IT Analyst,HITACHI ENERGY USA INC,"Raleigh, NC 27606",2024-11-06,"As IT Analyst you support the BST Management team by managing, monitor, and analyzing IT demand request, IT projects, as well as our Strategic Digital Transformation projects.","Job types: Full-time
Job types cc: Full-time",https://www.indeed.com/m/viewjob?jk=40f11b17fad80516,IndeedScraperUSAEng_40f11b17fad80516,IndeedScraperUSAEng,Data,USA_ENGLISH,,UNKNOWN
NEW,Senior Data Scientist I,LexisNexis,"Raleigh, NC 27606",2024-10-14,Work with product leaders to apply data science solutions. Experience and ability to design and work within complex data models. Train robust NLP-based models a very large corpus of news and financial…,"Job types: Full-time
Job types cc: Full-time",https://www.indeed.com/m/viewjob?jk=3fad238df062ad7d,IndeedScraperUSAEng_3fad238df062ad7d,IndeedScraperUSAEng,Data,USA_ENGLISH,,UNKNOWN
NEW,Payroll Data Entry,Premier Electrical Staffing,"Raleigh, NC",2024-10-14,This entry-level position has the primary responsibility of assisting with all payroll functions both in data entry as well as providing customer service to all company personnel.*.,"Job types: Temporary, Full-time, Contract
Shifts: 8 hour shift, Morning shift, Day shift
Benefits: Health insurance, Dental insurance, 401(k), Paid time off, Vision insurance, Flexible schedule
Job types cc: Temporary, Full-time, Contract
Schedules: 8 hour shift, Morning shift, Day shift",https://www.indeed.com/m/viewjob?jk=cf34b9679762cf39,IndeedScraperUSAEng_cf34b9679762cf39,IndeedScraperUSAEng,Data,USA_ENGLISH,$19.31 - $23.25 hourly,UNKNOWN
NEW,Data Engineer Programmer – NCCT CTMC,Wake Forest Baptist Health,"Winston-Salem, NC 27101",2024-11-13,"Prepares research data for ingestion and conversion to a unified data standard using ETL and automation tools. Owns data integrity, availability, documentation, and efficient access to data.","Job types: Full-time
Job types cc: Full-time",https://www.indeed.com/m/viewjob?jk=be3d846a836080e3,IndeedScraperUSAEng_be3d846a836080e3,IndeedScraperUSAEng,Data,USA_ENGLISH,,UNKNOWN
NEW,Master Data Specialist,Pepsi Bottling Ventures,"Raleigh, NC",2024-11-09,"Must enjoy analyzing data and problem solving, while providing a high level of customer service. Will be proactive in improving the integrity of master data to support Sales, Supply Chain and…","Job types: Full-time
Benefits: Wellness program, Health savings account, Paid holidays, Disability insurance, Health insurance, Dental insurance, Flexible spending account, Tuition reimbursement, Employee assistance program, Vision insurance, Life insurance
Job types cc: Full-time
Schedules: Weekends as needed",https://www.indeed.com/m/viewjob?jk=333184f30b15d19d,IndeedScraperUSAEng_333184f30b15d19d,IndeedScraperUSAEng,Data,USA_ENGLISH,,UNKNOWN
NEW,"Technical Product Owner, Data Engineering & Infrastructure",Bandwidth,"Raleigh, NC",2024-10-24,Enterprise data architecture or solution architecture. Analyze data to derive insights and inform product decisions. Understand and articulate technical concepts in data engineering and infrastructure…,"Benefits: Health insurance, Dental insurance, Paid time off, Vision insurance",https://www.indeed.com/m/viewjob?jk=1f2dc3f8eadf2e39,IndeedScraperUSAEng_1f2dc3f8eadf2e39,IndeedScraperUSAEng,Data,USA_ENGLISH,,UNKNOWN
NEW,"Clinical Data Manager, Senior",Duke University,"Durham, NC 27710",2024-10-16,"Significant experience with data management / data quality oversight, reporting, merging databases, SAS or other statistical analysis platforms, data parsimony, QbD principles and familiarity with…",,https://www.indeed.com/m/viewjob?jk=0d974bcf021eae7e,IndeedScraperUSAEng_0d974bcf021eae7e,IndeedScraperUSAEng,Data,USA_ENGLISH,,UNKNOWN
NEW,Data Reviewer/Senior Research Associate,KBI Biopharma,"Durham, NC",2024-10-14,"Reviews data associated with testing of in-process and drug substance/drug product samples and development, transfer, qualification, and validation of analytical methods.","Job types: Full-time
Job types cc: Full-time",https://www.indeed.com/m/viewjob?jk=224450c1e4b106d7,IndeedScraperUSAEng_224450c1e4b106d7,IndeedScraperUSAEng,Data,USA_ENGLISH,,UNKNOWN
NEW,Distance Learning Operations Specialist,Carolina Biological,"Burlington, NC 27215",2024-10-24,"This position requires understanding of operations/product management, manufacturing, drop box or similar content management system and salesforce. Assists the DL Operations Manager by maintaining and…","Job types: Full-time
Job types cc: Full-time",https://www.indeed.com/m/viewjob?jk=2754c8ce83a11eae,IndeedScraperUSAEng_2754c8ce83a11eae,IndeedScraperUSAEng,Data,USA_ENGLISH,,UNKNOWN
NEW,Business Intelligence Analyst,Randolph Health,"Asheboro, NC 27204",2024-10-24,"Incorporates data from various sources (internal and external) for reports, surveys, and benchmark data. Maintains cost accounting system and comparative data reporting.","Job types: Full-time
Job types cc: Full-time",https://www.indeed.com/m/viewjob?jk=957e6258020396ca,IndeedScraperUSAEng_957e6258020396ca,IndeedScraperUSAEng,Data,USA_ENGLISH,,UNKNOWN
NEW,Senior Clinical Data Manager,Worldwide Clinical Trials,"Durham, NC",2024-11-06,Manage each of the data management projects to which assigned; provide leadership to the corresponding data management teams. Ensure that all data management operations are conducted to WCT SOPs;…,"Job types: Full-time
Job types cc: Full-time",https://www.indeed.com/m/viewjob?jk=df521945f41751d2,IndeedScraperUSAEng_df521945f41751d2,IndeedScraperUSAEng,Data,USA_ENGLISH,,UNKNOWN
NEW,Health Info Data Specialist,WakeMed Health & Hospitals,"Raleigh, NC 27610",2024-10-31,"This is a Hybrid Remote position and for coverage needs, if needed, will cover all HIM Departments within system. Licensure: Registered Health Information Technician Or Registered Health Information…","Job types: Full-time
Remote: Hybrid work
Job types cc: Full-time",https://www.indeed.com/m/viewjob?jk=40964d3e53fd92f9,IndeedScraperUSAEng_40964d3e53fd92f9,IndeedScraperUSAEng,Data,USA_ENGLISH,,TEMPORARILY_REMOTE
NEW,DATA MANAGER II,Guilford County Schools,"Greensboro, NC 27401",2024-10-29,Classified - Clerical Student Information/Data Manager. Fair Labor Standards Act Classification: Non-Exempt.,"Job types: Full-time
Job types cc: Full-time",https://www.indeed.com/m/viewjob?jk=d10b4ca7b9380d54,IndeedScraperUSAEng_d10b4ca7b9380d54,IndeedScraperUSAEng,Data,USA_ENGLISH,$16.36 - $-1 hourly,UNKNOWN
NEW,"Business Analyst, NetSuite",Fortrea,"Durham, NC",2024-11-08,"Design data flows and fields, as necessary. Perform data mapping, loading and extract work as necessary. Maintain documentation including ERP/company data dictionary, KPIs, NetSuite design…","Job types: Full-time
Benefits: Disability insurance, Health insurance, Dental insurance, 401(k), Paid time off, Vision insurance
Job types cc: Full-time",https://www.indeed.com/m/viewjob?jk=d7508e3ef1af0f02,IndeedScraperUSAEng_d7508e3ef1af0f02,IndeedScraperUSAEng,Data,USA_ENGLISH,$110000 - $130000 yearly,UNKNOWN
NEW,Full Time Data Utilization Specialist,Marine Federal Credit Union,"Jacksonville, NC 28546",2024-10-31,Ensure data accuracy and integrity in Power BI reports by performing regular data validation and quality checks. Knowledge of other data visualization tools and technologies.,"Job types: Full-time
Shifts: 8 hour shift
Remote: Hybrid work
Benefits: Disability insurance, Health insurance, Dental insurance, 401(k), Paid time off, Vision insurance, 401(k) matching, Life insurance
Job types cc: Full-time
Schedules: 8 hour shift, Monday to Friday",https://www.indeed.com/m/viewjob?jk=a817de76458f63fe,IndeedScraperUSAEng_a817de76458f63fe,IndeedScraperUSAEng,Data,USA_ENGLISH,$70000 - $85000 yearly,TEMPORARILY_REMOTE
NEW,IT Data Analyst 2,University of North Carolina at Chapel Hill,"Chapel Hill, NC 27599",2024-11-01,"Responsibilities include designing and maintaining data quality monitoring tools and dashboards, addressing data quality issues, and ensuring compliance with reporting standards.","Job types: Full-time
Remote: Hybrid work
Benefits: Health insurance, Retirement plan
Job types cc: Full-time",https://www.indeed.com/m/viewjob?jk=900c765b2b59179a,IndeedScraperUSAEng_900c765b2b59179a,IndeedScraperUSAEng,Data,USA_ENGLISH,$115000 - $124900 yearly,TEMPORARILY_REMOTE
NEW,Assistant Accounting Data Entry Clerk,Express Employment Professionals,"Raleigh, NC 27612",2024-10-14,"Daily enter key data of financial transactions in database. We are looking for a skilled Accounting Data Entry Clerk to perform a variety of accounting, bookkeeping and financial tasks.","Job types: Full-time
Shifts: 8 hour shift
Job types cc: Full-time
Schedules: 8 hour shift",https://www.indeed.com/m/viewjob?jk=de103c3b395c6018,IndeedScraperUSAEng_de103c3b395c6018,IndeedScraperUSAEng,Data,USA_ENGLISH,$21 - $21 hourly,UNKNOWN
NEW,"Lead, Database Architecture Analyst","Hanesbrands, Inc.","Winston-Salem, NC 27105",2024-10-25,Experience with data migration and database upgrades. Knowledge of data modeling and schema design. Understanding of data protection regulations and best practices.,,https://www.indeed.com/m/viewjob?jk=cfc8c06f97a0c55a,IndeedScraperUSAEng_cfc8c06f97a0c55a,IndeedScraperUSAEng,Data,USA_ENGLISH,,UNKNOWN
NEW,ITSM Analyst,Local Government Federal Credit Union,"Raleigh, NC 27609",2024-10-22,"Ability to analyze data and metrics to identify trends, issues, and areas for improvement. The Information Technology Service Management (ITSM) Analyst will be responsible for analyzing and improving…",Benefits: Opportunities for advancement,https://www.indeed.com/m/viewjob?jk=f460bd981d0b31ac,IndeedScraperUSAEng_f460bd981d0b31ac,IndeedScraperUSAEng,Data,USA_ENGLISH,,UNKNOWN
NEW,"Clinical Data Management, Manager",Duke University,"Durham, NC 27710",2024-10-14,"Monitors compliance with institutional requirements and provides guidance pertaining to quality data collection and capture, data security, and data flow plans. Safety and Ethics – 15% Effort.",,https://www.indeed.com/m/viewjob?jk=9e1d6fdcbf02ecf3,IndeedScraperUSAEng_9e1d6fdcbf02ecf3,IndeedScraperUSAEng,Data,USA_ENGLISH,,UNKNOWN
NEW,"Manager, P2P Data Operations, Financial Services",Wake Forest University,"Winston-Salem, NC 27106",2024-11-09,"Manages a team with responsibilities for data entry, data analysis, and other operational functions. Manages the oversight of supplier database, P2P data analytics, and related technology.","Job types: Full-time
Job types cc: Full-time",https://www.indeed.com/m/viewjob?jk=b4d7af373ca06017,IndeedScraperUSAEng_b4d7af373ca06017,IndeedScraperUSAEng,Data,USA_ENGLISH,,UNKNOWN
NEW,AI Solution Architect,Deloitte,"Raleigh, NC 27601",2024-10-14,"Build tools and capabilities that assist with data ingestion, feature engineering, data management, and organization. Address potential issues such as training data poisoning, AI model theft, and…","Job types: Full-time
Job types cc: Full-time",https://www.indeed.com/m/viewjob?jk=5ad2027f40f1756a,IndeedScraperUSAEng_5ad2027f40f1756a,IndeedScraperUSAEng,Data,USA_ENGLISH,$167325 - $278875 yearly,UNKNOWN
NEW,Enterprise IT Business Analyst Manager,City of Raleigh,"Raleigh, NC 27601",2024-10-25,"Enterprise-wide understanding of business processes, systems & data. Reading, analyzing, evaluating, interpreting and summarizing written materials and statistical data.","Job types: Full-time
Job types cc: Full-time",https://www.indeed.com/m/viewjob?jk=487bb5bd32b4d4a0,IndeedScraperUSAEng_487bb5bd32b4d4a0,IndeedScraperUSAEng,Data,USA_ENGLISH,$70257 - $129977 yearly,UNKNOWN
NEW,"Research Data tech II, Sanford School of Public Policy",Duke University,"Durham, NC 27710",2024-11-09,Complete interview data entry via tablet or computer and appropriately manage data transfer when required. Community Navigation charts a new vision that will offer all families universal screening to…,"Job types: Full-time
Job types cc: Full-time
Schedules: Weekends as needed, Nights as needed",https://www.indeed.com/m/viewjob?jk=4ad8dc67f30a68c2,IndeedScraperUSAEng_4ad8dc67f30a68c2,IndeedScraperUSAEng,Data,USA_ENGLISH,,UNKNOWN
NEW,QC Data Review Specialist - 2nd Shift (Monday-Friday 4:00pm-12:00am),Alcami Corporation,"Durham, NC",2024-11-08,"Performs detailed review and approval of all types of data and documents (e.g. protocols, reports, and test procedures). These activities may include reviewing documents and data, conducting basic…","Benefits: Disability insurance, Health insurance, Dental insurance, Tuition reimbursement, Vision insurance, 401(k) matching, Loan forgiveness, Prescription drug insurance
Schedules: Monday to Friday",https://www.indeed.com/m/viewjob?jk=f8f49700aae3b916,IndeedScraperUSAEng_f8f49700aae3b916,IndeedScraperUSAEng,Data,USA_ENGLISH,,UNKNOWN
NEW,"Senior, Salesforce Business Analyst",Circle K,"Raleigh, NC 27606",2024-10-16,"Manage the configuration, customization, and maintenance of our Salesforce platform. Collaborate with cross-functional teams to implement and optimize Salesforce features.",,https://www.indeed.com/m/viewjob?jk=54d0b8b468a2eb28,IndeedScraperUSAEng_54d0b8b468a2eb28,IndeedScraperUSAEng,Data,USA_ENGLISH,,UNKNOWN
NEW,Customer Service/Order Entry Specialist,CAROLINA COOKIE COMPANY,"High Point, NC 27263",2024-10-14,Make outbound calls to customers to provide assistance and support. Respond to customer inquiries and resolve issues in a timely manner. Analyze customer needs and recommend appropriate products or…,"Job types: Temporary
Shifts: Day shift
Job types cc: Temporary, Seasonal
Schedules: Weekends as needed, Day shift, Monday to Friday",https://www.indeed.com/m/viewjob?jk=ebef8a3b2dc7888f,IndeedScraperUSAEng_ebef8a3b2dc7888f,IndeedScraperUSAEng,Data,USA_ENGLISH,$13 - $15 hourly,UNKNOWN
NEW,Temporary Data and AI at Work Instructor,North Carolina State University,"Raleigh, NC",2024-10-14,"At NC State, data science is for everyone. Instructors will join a professional teaching community that meets twice monthly to discuss data science teaching and learning research and practice.","Job types: Temporary
Job types cc: Temporary",https://www.indeed.com/m/viewjob?jk=a88bc29282744fb7,IndeedScraperUSAEng_a88bc29282744fb7,IndeedScraperUSAEng,Data,USA_ENGLISH,,UNKNOWN
